,0,1,2
493,5월 연말정산 질문,/qna/detail.nhn?d1id=4&dirId=40311&docId=298550021,제가 2017년에 1월부터4월까지 근무를 하고 수술로인해서 5월부터8월까지 쉬가다 9월중순부터 다시 일을 시작했어요. 이런경우에는 연말정산 1월부터4월까지 9월부터 12월까지 서류제출하고 병원에 있을때 병원비랑 체크카드 쓴거는 환급 못받는건가요? 어떤식으로 신청을 해야되죠?
494,카드 재발급 질문이여,/qna/detail.nhn?d1id=4&dirId=40104&docId=298550020,카드 재발급 받으려면 발급받은곳으로 무조건 가야되나요??다른곳에서 하면 안되나요
495,미성년자가 통장 개설 할때,/qna/detail.nhn?d1id=4&dirId=40107&docId=298549983,미성년자가 통장 개설 할때 여권이없어서 학생증하고 도장하고 기본증명서를 뽑아서 우리은행가서 통장개설을 하려는데 기본증명서를 뽑으려면 신분증이나 여권필요하다는데 제가 올해 18살 만 16세입니다 생일 못지났고요 신분증하고 여권이없어서 학생증으로 주민센터가서 뽑으려는데 되나요? 학생증에는 주민번호는 아니고 생년월일 이름 제 얼굴사진이있습니다. 빠른 답변 부탁드립니다..
496,비트코인 지갑이동 시간,/qna/detail.nhn?d1id=4&dirId=40108&docId=298549958,지금 5시간 30분째인데 아직도안들어왔습니다..원래이렇게 오래걸리나요 ?
497,할아버지 연립 매입 절차 및 세금 질문드려요,/qna/detail.nhn?d1id=4&dirId=40201&docId=298549954,"할아버지께서 30년넘게 보유중인 연립이 있으신데요이번에 파신다고 하셔서 제가 사려고합니다.가족간의 매매시 어떤 절차로 이루어져야 하는지주의사항은 어떤것이 있는지 궁금합니다.또 매매가는 6000만원정도로 생각중이구요, 제 소유 부동산은 없는데취득세, 소득세는 얼마나 정도가 나올까요??쉽고 자세한 답변 부탁드리겠습니다."
498,당좌예금에 대해 좀 알려주세요,/qna/detail.nhn?d1id=4&dirId=40402&docId=298549949,"당좌예금에 궁금한 점이 있어서질문드립니다1)은행과 당좌거래 계약할 때 한도액은은행에서 정해주는 건가요?그후 부족할때 당좌차월 계약을 체결하는건지 좀 알려주세요2)당좌수표는 기업에서 필요할 때마다발행하는 건가요아니면 은행가서 인출하는 건가요?만약 은행이라면은행에서 당좌수표 인출후회사에서 보관 중일 때 몇 년 동안가지고 있다가 써도 괜찮은가요?3)당좌예금을 한도액 이상으로 입금했을 때는 어떻게 되는 건가요?분개도 좀 부탁드립니다예)당좌예금 한도액 500,000현재 잔고 0원에서거래처가 발행한 당좌수표 1,000,000을입금했을 때4)당좌수표를 거래처에 사용 안 하고일반 편의점 같은 데서도 사용 가능한 가요?답변 좀 부탁드립니다"
499,거래처 외상매출/여신/신용/담보/보증/보험/매출채권/부동산 관련 자격증/공부,/qna/detail.nhn?d1id=4&dirId=40402&docId=298549936,회사 관리팀 신입사원입니다.회사에서 거래하고있는 거래처에 외상매출 발생 시 리스크 관리하는 업무가 있어해당 내용에 대해 공부하고 싶은데 어떻게 하면될까요?관련 자격증 혹은 책이 있다면 추천 부탁드립니다.너무 깊은 내용보다는 업무에 필요한 부분 중심으로 공부할 생각입니다.
500,새마을금고 정기예금 세금우대,/qna/detail.nhn?d1id=4&dirId=40101&docId=298549922,15.4%가 면제되는 새마을금고 세금우대로 정기예금 가입했습니다.같은 주소지의 새마을금고가 아니면 가입시 세금우대 혜택이 없다고 하더군요그래서 주소지의 새마을금고에 가입했는데 가입후 다른 지방으로 주소를 이전하면정기예금의 세금우대가 사라지나요?
501,청약에 대해서..,/qna/detail.nhn?d1id=4&dirId=40203&docId=298549901,"안녕하세요. 이제 곧 결혼을 하게 되는 예비신혼부부입니다.요즘 공공임대가 많이 나오는데요, 여쭤보고싶은것이 있어 질문 드립니다.1. 만약 공공임대 신청만 했다면 청약통장은 아직 유효한건가요?2. 신청해서 당첨되었는데 계약을 하지 않으면 청약통장은 유효하지 않을까요?"
502,배달앱 배달의민족 요기요 배달통중에 뭐가 제일 괜찮나요? 몇년동안 배달의민족을 이용했는데 아무리 많이 이용해,/qna/detail.nhn?d1id=4&dirId=40611&docId=298549869,배달앱 배달의민족 요기요 배달통중에 뭐가 제일 괜찮나요?몇년동안 배달의민족을 이용했는데아무리 많이 이용해도 포인트가 개코딱지만큼 쌓여서 빡쳐서 원래 다 그런가 싶어서 요기요랑 배달통 깔아보니까 적립이 차원이 다르더라구요...제가 한달에 뭐 많으면 20번 적으면 10번 이정도 시켜먹는데 그럼 제일 효율적으로 적립되는 어플이 어떤건가요?
503,제가 이번에 고등학교3학년이 됐는데 조리학과를 알아보고있어요 4년제 추천좀해주세요!,/qna/detail.nhn?d1id=4&dirId=40602&docId=298549858,제가 이번에 고등학교3학년이 됐는데 조리학과를 알아보고있어요 4년제 추천좀해주세요!
504,사주vs종교vs과학vs인간vs철학 도대체 헷갈리면서 다른? 최종? 적?으로 뭔지?,/qna/detail.nhn?d1id=4&dirId=40604&docId=298549854,사주vs종교vs과학vs인간vs철학도대체 헷갈리면서 다른?최종? 적?으로 뭔지?
505,신축빌라 2억1천만원 구입했는데 법무 비용이 맞는건가요 ?,/qna/detail.nhn?d1id=4&dirId=40201&docId=298549827,신축빌라 2억1천만원 구입했는데 법무 비용이 맞는건가요 ?
506,공사부문 경리,/qna/detail.nhn?d1id=4&dirId=40610&docId=298549805,제가 공사부문 경리로 입사 하였는데 공사부문에서 경리로써 해야할일이 머가 있나요? 다른 업종들과 다르게 해야하는 부분을 알려주세요!!
507,재무설계 받고 싶습니다!,/qna/detail.nhn?d1id=4&dirId=401&docId=298549799,재무설계를 받고 싶은데 진짜 현실적으로 조언받고 포트폴리오를 구성받으려면 어디에서 물어봐야 하나요?무료재무설계는 보험싱품가입 등으로 좀 부담스럽고 카페나 좋은 사이트 있으면 알려주세요!
508,sgi서울보증관련 질문.,/qna/detail.nhn?d1id=4&dirId=40106&docId=298549779,장기렌트를 이용하다가 6개월치정도 미납을 해서 차량을 반납하고보증보험금 해서 서울보증에서 저한테 금액을 납부하라고 연락이왓는데채무불이행으로 되어서 신용카드를 못쓰고잇습니다.서울보증에서 전화해서.. 좀 나눠서 납부한다고하면 채무불이행은 풀어줄수잇을까요?..\
509,부동산소개비 얼마드려야하나요?,/qna/detail.nhn?d1id=4&dirId=4020202&docId=298549774,가게운영중입니다부동산에보증금 1500만원월세 90만원권리금 3000만원내놓았습니다성사시 부동산에 소개비얼마 드려야하나요?
510,직장인 생활비 어느정도가 적당한지,/qna/detail.nhn?d1id=4&dirId=406&docId=298549767,"저는 25살 2년차 직장인이구요월급이 세후 170인데생활비로 나가는 돈이1. 교통비 8만2. 개인생활비 15만 (본가에서 살고있어서 외식비,등)3. 데이트비 20~25만4. 핸드폰비 15만 (기본요금 9만 + 소액결제 쇼핑 4~5만원)총 63~65정도 사용한다고 보심 되는데ㅠㅠㅠ생활비 이정도면 많이쓰는건지ㅠㅠ 줄인다면 뭐부터 줄여야할지 조언좀 주세요"
511,우리카드로 인터넷 구매 시 매출전표의 카드번호가 다른 이유가 궁금해요.,/qna/detail.nhn?d1id=4&dirId=40104&docId=296619956,"제가 우리카드를 사용중입니다. 우리카드는 BC카드 회원사 임을 잘 압니다.그래서 카드전표에 우리카드 또는 비씨카드로 나옴을 인지하고 있습니다.그런데 제가 회사 것으로 사용한 내용을 비용 인정을 받기 위해매출전표를 구매한 사이트에서 인쇄하여 제출해야 하는데실제 제우리카드번호와, 매출전표에 적힌 카드번호(비씨라고 적힌 다른 번호)가 전혀 다릅니다.인터넷으로 구매한 것이다 보니, ISP 결제로 진행했는데 이렇게되면 카드번호가 다르게 되는건지...회사에는 우리카드 홈페이지에서 뽑은 매출전표로 제출해서 처리는 받았으나그 이유를 모른체 동일한 해프닝을 겪고 싶지가 않습니다.제 궁금증을 해결해주세요. ㅜㅜㅜ우리카드 상담사와 전화를 시도했으나,두번이나 본인들은 카드번호가 맞게 확인된다. 모르겠다. 매출처에 물어봐라 라는답변만 줘서 답답한 마음에 여기에 질문합니다.(비씨카드에 전화하니 우리카드 상담쪽으로 자동 연결되서.. 거기도 실패했어요... ㅜㅜ)"
512,택배 배송알바 20만원 . 일당금액 적당한가요?,/qna/detail.nhn?d1id=4&dirId=40611&docId=298549747,택배 배송알바 20만원 . 일당금액 적당한가요?
513,아이큐 높은 케릭터 나오는 애니 알려주세요,/qna/detail.nhn?d1id=4&dirId=40604&docId=298549722,아이큐 높은 케릭터 나오는 애니 알려주세요
514,팔목 통증,/qna/detail.nhn?d1id=4&dirId=40603&docId=298549720,안녕하세요 제가 팔목을 삐긋해서 아파서 병원을 가봤더니 팔목의 괄절?의 사이의 액이 세워나왔다고 하는데 그게 정확히 병명이 먼지 알고싶어요 그리고 제가 1cm밖에 안되어서 만약 더 커지면 수술을 해야 한다고 하는데 위험한 수술인가요?????
515,제주항공 티켓 스펠링 철자틀림 성에서 park인데 급하게쓰느라 pakr로적어저있네요 제주도국내여행인데 이런적,/qna/detail.nhn?d1id=4&dirId=40605&docId=298549701,제주항공 티켓 스펠링 철자틀림 성에서 park인데 급하게쓰느라 pakr로적어저있네요 제주도국내여행인데이런적이처음이라 걱정돼서여 상담사연결했는데 여권챙기라고 1시간전에와서 이야기하라고하는데국내여행인데...?? 돈내고 변경해라 그런 형식적인답 채택안합니다
516,임대아파트 우선분양권~,/qna/detail.nhn?d1id=4&dirId=402&docId=298549688,광양 송보 5차 입주민입니다.선착순으로  제(아내)명의로 계약해서 2008년 8월 26일 입주하고 전입 신청하고 지금까지 거주중입니다.작년 2017년 1월 14일 남편 명의의 집은 매도해서 팔아서 현재 세대주 다 무주택입니다.제가 2009년 2월 17일부터 2010년 4월 11일까지 자녀 학교 문제로 전출입 기록이 있어요.이 전출입 문제로 우선분양을 못 받나요?
517,검색하고 알아봤는데요 혹시 우체국 실비보험 1종 종합형 갱신형으로 있는데 6시간입원 맘모톰 수술을 했는데 보,/qna/detail.nhn?d1id=4&dirId=401030201&docId=298549686,검색하고 알아봤는데요 혹시 우체국 실비보험 1종 종합형 갱신형으로 있는데 6시간입원 맘모톰 수술을 했는데 보험료가 지급이 될까요?
518,주식미수금이 하한가로인해 반대매매로인한 변제가능 금액이 넘어섰을경우에 일반 대출처럼 이자를 내면서 천천히 갚,/qna/detail.nhn?d1id=4&dirId=40102&docId=298549671,주식미수금이 하한가로인해 반대매매로인한 변제가능 금액이 넘어섰을경우에 일반 대출처럼 이자를 내면서 천천히 갚아도되나요 아니면 최우선적으로 급히 처리해야되나요
519,23살 고졸 영화관 알바 어떤가요?,/qna/detail.nhn?d1id=4&dirId=40611&docId=298509231,"23살 남자고 고졸입니다 군필이구요영화관 알바 경험이 있는데 이번에 자리가 나서 해볼까 고민중입니다영화관 알바 해보신분들은 아시겠지만 평균 월급이 보통 100도 안돼죠전에 일할때도 보니까 대학교 재학,휴학중이거나다른일을 하면서 용돈벌이식으로 하시는분들이 많더라구요저와 비슷한 나이 또래인데 알바가 아닌 정규직 직원으로 일하시는분들도 많고저같은 경우 나이도 어린편은 아닌데 고졸이고 따로 준비하거나 하는게 없어서일을 하게되면 그게 주이고 생계형으로 일을 하는건데 영화관 알바 어떻게 생각하시나요전에 영화관 알바하면서 재밌게 근무한 경험이 있어서 고민이 많이 됩니다물론 직원으로 들어가면 좋겠지만 자리도 잘안나고 공고날때까지 마냥 기다릴수가 없어서요당장 일할 자리가 필요하기도 하고요.,."
520,한국 쇼핑사이트 추천해주세요,/qna/detail.nhn?d1id=4&dirId=40701&docId=298549596,"새물건,배송빠른사이트 추천해주세요"
521,포토샵으로 통장 금액좀 늘려주세요~~~ 저 금액을 3.384.430 으로 부탁드려요 ㅜㅜ,/qna/detail.nhn?d1id=4&dirId=40107&docId=298549594,포토샵으로 통장 금액좀 늘려주세요~~~저 금액을 3.384.430 으로 부탁드려요 ㅜㅜ
522,관세를 부과하지않고 다른나라에 수출하거나 수입해오면 좋은거아닌가요?,/qna/detail.nhn?d1id=4&dirId=408&docId=298549592,관세의 개념에대해 설명해주세요 ㅠㅠㅠ수입해오는 물건에 관세를 부과하면 좋은건가요?어떤면에서 좋은건가요?수출하는 물건에 관세를 부과하면 좋은건가요?어떤면에서?좋나요
523,회사에서 입사제의가 와서 입사할생각있으면 이력서를 제출하라고 해서 제출 하였는데 면접같은것 안보고 바로 업무,/qna/detail.nhn?d1id=4&dirId=40613&docId=298549590,회사에서 입사제의가 와서 입사할생각있으면 이력서를 제출하라고 해서 제출 하였는데 면접같은것 안보고 바로 업무안내를 해준다고 합니다. 월래 업무안내는 최종합격후에 해주는거 아닌가요?
524,신체검사 재검,/qna/detail.nhn?d1id=4&dirId=40603&docId=298549479,"신체검사 안과 재검 수술후부작용 눈어지러움 증상 때문에 재검을받으라는대4월에 한번 2개월마다 한번 씩해서 총3번을오라는대4,6,8월 그때마다 진단기록가지고 가면되는건가요?"
525,매출 증가율 계산,/qna/detail.nhn?d1id=4&dirId=40302&docId=298549469,문의드립니다담당자 1이 당월 샘플을 사용하여 전월대비 매출이 얼마나 증가했는지 계산하려고 하는데도무지 계산 방법을 모르겠습니다샘플 금액을 어떻케 반영시켜 계산해야할지 하 ㅠㅠ계산할수있는 방법이 있을까요...엑셀 수식을 어떻케 해야하는지도 알고싶어요답변 부탁드립니다 ㅠㅠ 하..
526,청년통장 건강보험료 질문할께요,/qna/detail.nhn?d1id=4&dirId=40311&docId=298549432,"1. 제가 1월부터 일을 시작해서 사대보험이 들어갔는데청년통장에서 납부기간 17년12월부터 18년2월까지 자격변동이 있을경우 18년2월(1개월분) 가구원 건강보험료 납부총액을 입력하라는데 엄마아빠동생 건강보험료는 제가 따로 못보는데 어떻게 입력해야되나요?2. 소득재산 증빙서류(건강보험료 납부확인서, 건강보험자격확인서) 는 가구원 전체 서류를 제출하라는데제꺼는 이미 스캔떳는데 엄마 아빠 동생껀 어떻게 때야되나요?"
527,"환율 물가 통화량 금리 이자율 의 서로 관계(비례,반비례 같은것... )에 대해서 설명좀 해주세영 또한 금리",/qna/detail.nhn?d1id=4&dirId=409&docId=298549388,"환율 물가 통화량 금리 이자율 의 서로 관계(비례,반비례 같은것... )에 대해서 설명좀 해주세영 또한 금리가 낮아지면 외국 자본이 왜 유출되는지 이해가 안가요 ㅜ 국어지문푸는데 상당히 난감하네여"
528,분개해주실분구해용,/qna/detail.nhn?d1id=4&dirId=40402&docId=298549332,분개해주실분구해용
529,궁금합니다.,/qna/detail.nhn?d1id=4&dirId=408&docId=298549282,파실랜 덖기전에 유의해야할 사항이 무엇인지 자세히 알려주세요.
530,노트북 펜 지원되는것 살려고 하는데 추천좀,/qna/detail.nhn?d1id=4&dirId=40608&docId=298549265,노트북 펜 지원되는것 추천좀 해주세요가격 과 장단점까지 ~!
531,"토지사용증명서류는 어떤 서류가 가능하고 발급,신청은 어디서하나요??",/qna/detail.nhn?d1id=4&dirId=40201&docId=298549252,"공장을 등록하려고합니다.토지사용증명서류는 어떤 서류가 가능하고 발급,신청은 어디서하나요??"
532,사업자등록 신청 업종선택 및 질문,/qna/detail.nhn?d1id=4&dirId=407&docId=298549208,"안녕하세요.창업에 앞서 사업자등록 신청을 하려는데 업종 선택에 어려움이 있어 질문드립니다.1.운영하면서 발생 하는 포인트 및 포인트 결제 시스템 입니다.1) 인터넷 홈페이지 운영입니다.2) 최초가입,로그인,댓글 등 포인트가 지급됩니다.3) 포인트 결제를 통하여 포인트를 구매 할 수 있습니다.2. 사업장 소재지1) 사업장 소재지를 제가 친구랑 살고 있고 집에서 운영 할 계획입니다. 문제가 없을까요?"
533,sc 플러스마일 카드 발급 원해요,/qna/detail.nhn?d1id=4&dirId=40104&docId=298549189,sc 플러스마일 카드삼성 앤마일리지카드삼성 더오 카드모두 가입조건 가능합니당유능한 설계사님 연결 부탁드려요~~
534,건설현장 일용직 근로자 노임 처리건,/qna/detail.nhn?d1id=4&dirId=403&docId=298549184,"건설현장 미장공으로 근무하는 아무개씨한달 19일이상은 출력인 안된다는 규정실제는 30일 근무 * 210000원  6,300,000원 인데회사 관계자가 19일 이상은 안되니 자료를 가져와롸 출력인원을 더 가져와라 하는데개인이 나가서 일을 했을뿐인데 무슨 말을 하는건지 모르겠습니다.30일을 신고하면 세금을 내야 한다.이 세무규정이 무엇인지 설명글을 부탁 드립니다."
535,10년전 제주 더클래식 현장 소장입니다. 연락 한번 주세요.,/qna/detail.nhn?d1id=4&dirId=404&docId=298549161,형제산업 카다로그 에 연락처가 변경 되신것 같아 남깁니다.
536,잡코리아 에서 입사지원 을 했었는데 입사지원 한 곳에서 알람이떠서 글을보니 제대로 알고지원한거 맞죠? 라는,/qna/detail.nhn?d1id=4&dirId=40613&docId=298549145,잡코리아 에서 입사지원 을 했었는데입사지원 한 곳에서 알람이떠서글을보니 제대로 알고지원한거 맞죠?라는 알람 문구가떠서 눌서 확인해보니입사 지원한 채용정보만 뜨고 문자나 알람 같은건다시 찾아서 읽을수가 없더라고요나의 알림같은거 들어가거나 헤드헌팅 글도없고제가 채용한곳에서 문자같은걸 보낸건지 알고싶네요..
537,토스대출?,/qna/detail.nhn?d1id=4&dirId=4010503&docId=298549144,토스 맞춤대출 각 은행별로 대출금리 나오는데 상담필요은행은 뭔가요?
538,민간분양 무주택 조건 중 60세이상 직계존속 문의 드립니다.,/qna/detail.nhn?d1id=4&dirId=40305&docId=298549127,"민간분양 무주택 조건 중 60세이상 직계존속 문의 드립니다.저의 어머니는 64세이시며 주택을 소유하고 계시고제가 세대주 이고, 저의 어머니가 세대원입니다.이런 경우에도 민간분양에서 무주택 조건에 해당가능 한지요?"
539,아르바이트생은 아마추어인가요? 프로인가요?,/qna/detail.nhn?d1id=4&dirId=40611&docId=298549125,아르바이트는 아마추어인가요? 프로인가요?
540,아르바이트생은 아마추어인가요? 프로인가요?,/qna/detail.nhn?d1id=4&dirId=40611&docId=298549125,아르바이트는 아마추어인가요? 프로인가요?
541,택시비를 회사에 청구하려고하는데 잘 모르겠습니다 도와주세요 ㅠㅠ,/qna/detail.nhn?d1id=4&dirId=40306&docId=298549074,신입사원이라 처음인데 야근을 해서 차가 끊겨 상사가 택시타고 퇴근해서 회사에 청구하라고하느데절차가 어캐되는건가요 뭔 사업자증빙영수증인가뭔가를 끊어야되고 그냥 카드전표로는 안된다는데그냥 통상적인 방법으로 제가 개인카드나 현금으로 택시타고 나중에 회사에 청구하려고할때 어떤 조건이 충족되어야하 는지 알려주세요 ㅠㅠ
542,한국장학재단 생활비 심사,/qna/detail.nhn?d1id=4&dirId=4010504&docId=298549043,18년 3월7일날 신청을 했는데 아직도 심사중인데 언제쯤 승인이 날까요?
543,굴삭기 실기,/qna/detail.nhn?d1id=4&dirId=40609&docId=298549036,"제가  저번주에 젤쉬운 주행코스에서 떨어졌지 뭡니까?.. 아 ㅜㅜ1~2시간 탓음 떨어질수도 있지만 전 정규반 10시간에 100만원씩 주고 배웟는데음...쪽팔리네요 ㅜㅜ 그래서 다시도전할려구여..내일 접수날이니까14일날  학원자체시험 또 있는데  그전날 1시간만타고  실기셤보게요..전 문제가 살짝 있나봅니다.. 제가 대형면허,지게차,로더 한번에 붙었는데굴삭기는 이해가 안가서 그런지 몇번만져보지도 못하고 주행에서 떨어졌네요 .그리고 한가지더말하자면  지금제나이가 35인데 이제까지 사무직,생산직,써비스업을다해봐왔지만 제적성이 안맞는거 같습니다 직장다녀서 힘들거나 돈을 쪼금 준다거나그만둘빠엔 차리라 중장비쪽으로 가는게 밥벌어먹고 사는게 더 효율적이지 않을까요 ?문제는 초보를 안뽑는다는겁니다ㅜㅜ 중장비쪽에 인맥들고 없고 어쩌죠 저 ,,아무튼 제문제는 일단 이두문제입니다.. 어서 빨리 취업이 됐음좋켓고굴삭기 합격을 하는게 일단 이렇게 두가지 목표입니다..이글을 보고 짧게마나 조언좀 해주겠다는 분들 참 감사하게 생각하겠습니다...생산직직장 퇴사한지 2달이 돼가는데 이나이에 집에서 글은 잘쓰지는 못하더라도 한번 성심성의껏적어 보았습니다 .,....."
544,2015년부터 2017년 8월까지 쭉 월200 급여였고 건강보험이 9만원대 나왔습니다. 근데 퇴직하고 다른,/qna/detail.nhn?d1id=4&dirId=401030201&docId=298549005,2015년부터 2017년 8월까지 쭉 월200 급여였고건강보험이 9만원대 나왔습니다. 근데 퇴직하고다른 곳으로 이직하여 월 평균 240 급여를 2017년 11월부터수령했습니다.근데 갑자기 2018년 1월부터 건강보험이 15만원이나 나오네요??월소득이 저보다 높은 학원원장님도 이정도는 안나오신다는데..대체 왜이런건지... 건강보험에 문의하니 연소득이 2017년 5월 신고가 1900만원이라고 하던데아니.. 2015년부터 쭉 그만큼 받았는데 9만원대다가 왜 2018년부터 저런건지.. 연금도 14만원으로 올라가고..아주 연금과 보험으로 30만원을 내고있네요.버는 건 같은데 대체 무슨 계산법일까요?원래 이런가요? 이만큼 나오는게 정상인가요???
545,한국장학재단에 생활비대출을 받으려고 하는데,/qna/detail.nhn?d1id=4&dirId=4010504&docId=298549000,"대학승인? 이런것도 다됐고 이제 얼마 빌릴건지 입력하는 란인데,이번방학때 알바해서 바로 갚을 거거든요,,50만원정도를 원금균등상환한 후에 거치기간 1년, 상황기간1년 하면 괜찮을까요,,??"
546,전세대출시 집주인이 법인회사로 되어잇으면 추가서류가 머필요하나요?,/qna/detail.nhn?d1id=4&dirId=4020201&docId=298548959,전세대출시집주인이 법인회사로 되어잇으면추가서류가 머필요하나요?
547,은평구 부동산 질문입니다.,/qna/detail.nhn?d1id=4&dirId=40201&docId=298548920,"불광동, 연신내, 대조동 부근에 사업자걸수있는 업무용 오피스텔 구할수있을까요?사업자도걸고 실제로 거주도 하려고합니다빠른답변부탁드립니다"
548,주택임대사업자 등록에 따른 양도소득세 면제 가능여부 질문입니다.,/qna/detail.nhn?d1id=4&dirId=40305&docId=298548919,"어머니 명의로 주택이 2개 있는데 주택임대사업자 등록 전입니다.(상가임대사업자는 등록)2000년 다세대 주택 구입(어머니 명의, 구입동시에 임대줌)2002년 빌라 구입(16년 아버지 -> 어머니 상속, 16년 부터 딸 집에 거주중, 현재 아들 거주)이런 경우 주택임대사업자 등록을 하여 빌라를 매도 할 경우주택임대사업자 세제해택으로 양도소득세 면제를 받을 수 있을까요?"
549,상가를 구입하여 임대 수익을 내려면 꼭 임대사업자로 등록해야 하나요? 등록해야 한다면 일반임대사업자로 해야,/qna/detail.nhn?d1id=4&dirId=40202&docId=298548912,상가를 구입하여 임대 수익을 내려면 꼭 임대사업자로 등록해야 하나요? 등록해야 한다면 일반임대사업자로 해야 하는지 아니면 주택임대사업자로 해야 되는지 문의드립니다. 기존에 주택임대사업자로 등록되어 있다면 또 어떻게 되는지도 궁금합니다
