,0,1,2
0,이직이유?,/qna/detail.nhn?d1id=4&dirId=40612&docId=298557790,안녕하세요이직준비중인 여자입니다자기소개서나 면접볼때 이직이유를 물어보면 뭐라고 해야 적절할까요?나이도 많고 경력도 없어서 불안하지만 지금있는 회사가 분위기도 별로고 직원들과도 대면대면해서 옮기고 싶어서요 같은 사무쪽으로 알아보려고 합니다도움 좀 주세요~~
1,안녕하세요..원룸건물구입예정입니다(1세대1주택자) 현재신랑명의의 빌라에 거주중이고 이빌라를 팔고 건물을 구매,/qna/detail.nhn?d1id=4&dirId=40301&docId=298557786,안녕하세요..원룸건물구입예정입니다(1세대1주택자)현재신랑명의의 빌라에 거주중이고 이빌라를 팔고건물을 구매할예정인데 빌라를 팔때양도소득세를 내야하는지와 원룸구입후 종합소득세를 내야하는가 궁금합니다(원룸매매가5억 보증금2000 월세300예정하에)부동산에 대해 너무몰라서ㅜㅜ지식인님들의 답변부탁드려요!
2,OK Cashbag 관련 질문 !!~~,/qna/detail.nhn?d1id=4&dirId=40611&docId=298557773,안녕하세요 OK Cashbag  관련 질문 드리겠습니다.커피믹스 같은것 먹고서  핸드폰 OK Cashbag 어플에  모으고있습니다.생각처럼 많이모이진않앗지만  이런포인트는 어떻게사용하나요?OK Cashbag 모바일카드  바고드 같은것도 어플에 보이던데.주유소같은데서  기름 넣을때도  바코드 찍고  포인트 사용가능한건가요?  궁금합니다~
3,무배당 행복을 多주는 가족사랑보험(0809) 상실된 보험인데 회복과 해지 어느게 유리할까요,/qna/detail.nhn?d1id=4&dirId=401030201&docId=298557763,"보장내용은 아래와 같습니다.보험계약은 2009년에 하였고 2016년2월까지 납부후 납부카드를 분실한 후에 재발급받아서돈이 안나가고 있는지를 모르고 이년이 지나가서 보니 현재 효력이 상실된 계약인 상태이고이달말까지는 효력회복이 가능한 상태입니다.2016년2월까지 납부한 금액은 \2,449,080 이고 해지시 환급금은 \1,262,845 입니다.효력회복을 위해서는 25회분의 보험료 약 75만원을 추가로 납부해야 합니다.그럼 추가납부해야 하는 75만원에 환급금에 대한 기회비용까지 총 200만원의 비용이 드는데검색해보니 이 보험 자체는 좋은 보험이라고 나오는데요저런 비용에도 불구하고도 유지하는게 유리한지 현행 보험상품들에 대한 정보가 없어서비교평가를 하질 못하겠네요 조언 부탁드립니다."
4,좋은 채용 정보를 모아서 선별적으로 제공하는 사이트는 없나요?,/qna/detail.nhn?d1id=4&dirId=406&docId=298557757,"좋은 채용 정보를 모아서 선별적으로 제공하는 사이트는 없나요?사람인, 잡코리아 등은 아는데.. 여기는 너무 쓸데 없는 정보도 같이 올라와서 정보를 얻기가 힘듭니다."
5,은행에서 외화를 원화로 환전하면 자료같은게 남나요?? 만역에 남으면 가족들이 환전 내역 확인시켜달라거 하면,/qna/detail.nhn?d1id=4&dirId=4010506&docId=298557751,은행에서 외화를 원화로 환전하면 자료같은게 남나요??만역에 남으면 가족들이 환전 내역 확인시켜달라거 하면 은행에서 해주나여??
6,일용직 햇살론,/qna/detail.nhn?d1id=4&dirId=4010503&docId=298557746,장기 연체 기록있습니다. 17년 1월 26일 날짜로로 현재 1년 이상 지났고 지금은 대출 및 연체 없습니다.아웃소싱 소속으로 생산직 근무중인데 이번에 원천징수 영수증 보니 일용직으로 되있더라고요..그동안 4대보험 미가입했었는데 3월부터 4대보험 신청해서 3회 이상 납부 후 6월에 햇살론 알아보려고 합니다급여는 250으로 4대보험 신고 넣었고요햇살론 가능할까요?? 한도는 어느정도 나올까요
7,이런 라이터는 어디서 어떻게 가스넣나요???,/qna/detail.nhn?d1id=4&dirId=40103&docId=298557737,이런 라이터는 어디서 어떻게 가스넣나요???
8,"대출 문의좀 합니다. 무직 , 학생 -현재 부채- 학자금 300 Osb 저축은행 500 ( 1년 전) 신용카",/qna/detail.nhn?d1id=4&dirId=4010506&docId=298557721,"대출 문의좀 합니다.무직 , 학생-현재 부채-학자금 300Osb 저축은행 500 ( 1년 전)신용카드 사용 (연체 x)연체 이력 x신용등급 7대출 가능한곳 있을까요 ..?"
9,기대출이 하나은행(급여은행) 바꿔드림론 1560정도인데 우리은행 1900 -이자만 납부중 고려저축햇살론 12,/qna/detail.nhn?d1id=4&dirId=4010503&docId=298557708,기대출이하나은행(급여은행) 바꿔드림론 1560정도인데우리은행 1900 -이자만 납부중고려저축햇살론 1200정도연체없이 갚아나가고 있는데..서울에 전세구하려니 5000천만원전세자금대출이 필요한데 가능한방법없을까요?4대보험회사이고 정규직 6개월 재직입니다.말도안되는 광고말고..정말 가능성있는 답변이 필요합니다.
10,피규어들 중고나라 판매가가 알고싶어요,/qna/detail.nhn?d1id=4&dirId=40502&docId=298557707,피규어들 중고나라 판매가가 알고싶어요
11,현대해상실비보험 가입할까요?,/qna/detail.nhn?d1id=4&dirId=401030201&docId=298557706,언제부터인지 잘 모르겠지만...건강에 대한 관심이 생기면서보험에 대한 부분까지 정보를찾아보 게 되었는데요 ㅎㅎㅎㅎ아직 보험에 가입해본 적이 없어서일단은 실비상품 하나는 필요할 거 같다는생각으로 알아보고 있는데...현대해상실비보험이 저에게 맞는상품은지 알 수 있을까요???
12,전세자금대출,/qna/detail.nhn?d1id=4&dirId=4010502&docId=298557702,국민은행에서 일반전세자금대출을 받고 있습니다. 2년 만기 지나서 바로 다른 집으로 이사를 하려고 합니다. (예를 들어서 올해 7월31일이 만기이고 바로 8월 1일또는 2일날 이사를 간다고 했을때)* 버팀목 전세자금대출조건을 충족합니다.*1. 버팀목 전세자금대출(신혼부부전세자금대출)  로  바로 변환이 가능한가요?2. 목적물변경신청이 있다고 알고 있는데 이런 경우에도 가능한건지요?3. 아니면 다른 방법이 있는지 궁금합니다.
13,벽틈에서 이런게올라왔는데 무엇일까요ㅠ 만처보니 스티로폴같은 느낌인데 일년동안 안그러다 오늘갑자기 생긴건데..,/qna/detail.nhn?d1id=4&dirId=40103&docId=298557694,벽틈에서 이런게올라왔는데 무엇일까요ㅠ만처보니 스티로폴같은 느낌인데 일년동안 안그러다 오늘갑자기 생긴건데...공사중이라고하면 실리콘같은것들이 공기땜에 부풀어올라 나온거라지만 무엇일까요ㅠ
14,멜론비트라는 오라클지 코인 아시는분 계신가요?,/qna/detail.nhn?d1id=4&dirId=40108&docId=298557672,멜론비트라는 오라클지 코인 아시는분 계신가요?매도랑 매수표를 보면 매수 가격이 표에서는 매도 맨아래 가격으로 표시되고매도표 보면 매수표 맨위로 표시가 되네요오라클지에 대하여 아시는분 있으시면 알려주세요
15,청약통장 가점,/qna/detail.nhn?d1id=4&dirId=40203&docId=298557662,가입후 중간에 불입을 안해도 가점은계속 올라가나요?만약 2010년 가입후 납입을 전혀 안해도 가점은9점인가요?아리송해서요확실한 답변 부탁드립니다
16,소방공무원인강 스마트폰수강?,/qna/detail.nhn?d1id=4&dirId=40601&docId=298557634,안녕하세요 공부를하는 대학생입니다올해 4학년인대 공부를 해야하는데 바쁜관계로학원은 못다닐거같고 . 알바도 해야하고 해서요.정신이 없는 상태라 소방공무원인강으로 공부를 하고싶은데요학원에서 열공하면 좋겟지만 제사정이 학원갈 사정이안되서 ㅠㅠ알바 하면서 소방공무원인강 을 스마트폰으로 한번 들어볼까하는데.어떨까요 소방공무원 인강으로 소방사관학원에 제공하는소방공무원인강 어떨까요?합격생이 올해 가장 많이나왔다고 하는데 맞는지 궁금하네요소방공무원인강 답변부탁드립니다!
17,동양생명 치아보험 어려울까요?,/qna/detail.nhn?d1id=4&dirId=401030201&docId=298557610,저는 치아의 건강을 챙겨야 되는 건알지만 생각보다 비용이 많이 들어서미루고 있었는데요...그러다가 이제는 더 이상 미룰 수 없을 거 같아서동양생명 치아보험에 가입하려고 하는데...가입하게 되었을 때 어떤 보장을 받을 수 있을까요?그리고 특약에 가입하는 게 좋을까요???
18,주택청약 무주택 관련 문의,/qna/detail.nhn?d1id=4&dirId=40203&docId=298557578,"전 지금 20대 여성 입니다.현재 할아버지 명의인 집에서 할머니와 부모님과 동생이 같이 거주 중입니다.주택 청약을 알아보던 중 무주택 관련해서 부모가 만 60세 이상이면 그 세대원은 무주택자가아니라는 말을 들은 거 같아 , 확인 할 겸 문의 드립니다.그렇다면 할아버지도 그 조건에 포함이 가능한가요?그리고 제가 현재 무주택자인가요? 만약, 아니라면 방법은 세대분리 뿐인가요?"
19,지역 신협인데 재무건전성 어떤가요? 믿을 수 있는 지점인가요 5천만 이상 예치해도될지 봐주세요,/qna/detail.nhn?d1id=4&dirId=401&docId=298557571,지역 신협인데재무건전성 어떤가요? 믿을 수 있는 지점인가요5천만 이상 예치해도될지 봐주세요
20,지역 신협인데 재무건전성 어떤가요? 믿을 수 있는 지점인가요 5천만 이상 예치해도될지 봐주세요,/qna/detail.nhn?d1id=4&dirId=401&docId=298557571,지역 신협인데재무건전성 어떤가요? 믿을 수 있는 지점인가요5천만 이상 예치해도될지 봐주세요
21,분개 질문있습니다.,/qna/detail.nhn?d1id=4&dirId=40402&docId=298557567,"법인 기업이구요신용보증기금에대출보증료 3,000,000신용조사수수료 20,000총3,020,000원을 보통예금 계좌에서 이체를 해주었는데요분개를 어떻게 해야할지 잘 모르겠습니다어디서는 대출보증료를 선급비용으로 잡아라, 지급수수료로 하면 된다, 보험료로 분개해라 등등의견이 여러가지더라구요.답변 부탁드립니다."
22,거래량 차트 보는 법 좀 알려주세요~,/qna/detail.nhn?d1id=4&dirId=40102&docId=298557566,안녕하세요~사진을 보시면아래 막대가 거래량인데요.검색을 해 봤지만 제가 원하는 답을 못 찾아 질문 글 올립니다.ㅎ1.거래량 막대가 빨간색인데 실제 주가가 음봉인건 왜 그런건가요?(사진에서 우측 참고)2.거래량 막대는 매우 높은데 주가 변동폭이 적은건 왜 그런가요?(사진에서 좌측 중앙쯤 빨간색 막대 높은데 위에 캔들차트 폭이 적은거)초보인 만큼 쉬운 말씀 부탁드립니다~^^;
23,신규 아파트 분양 계약/중도금/잔금 대출 관련 문의,/qna/detail.nhn?d1id=4&dirId=40203&docId=298557565,"초보적인 질문일 것 같은데요.. 확실한 답변을 구하지 못해 질문드립니다.9억 이하 아파트 신규 분양의 경우 중도금 대출 (40%/ 60% 중도금 비율일 때) 이 가능한 것으로 알고 있습니다.아래의 경우 대출 가능한 금액에 대한 답변 부탁드립니다.예) 분양가 9억 (계약금 10%, 중도금 60%, 잔금 30%)1. 중도금 대출 40% 가능 경우 나머지 [본인돈 60% ( 계약금 10%, 중도금 40%, 잔금 10% : 대출 40%]2. 중도금 60% 중 20% 불가 [ 본인돈 20% : 대출 80%  (계약금 10%, 중도금 40%, 잔금 30%) ]투기과열지구 기준으로 어떤 방식이 맞는 것인지 최대한 대출을 가져가는 방향으로 몇 % 적용이 가능한지답변 부탁드립니다."
24,이 피규어들 중고판매시 얼마정도인지 알고싶네요 미개봉 입니다.,/qna/detail.nhn?d1id=4&dirId=40502&docId=298557563,이 피규어들 중고판매시 얼마정도인지 알고싶네요미개봉 입니다.
25,지난주 토욜에 주문했는데 아직 출고도 안됨,/qna/detail.nhn?d1id=4&dirId=40701&docId=298557556,티몬에서 주문했는데 아직도 안와요.. 배송에 문제생긴걸까요
26,대환대출 알아보는데 어떻게하죠,/qna/detail.nhn?d1id=4&dirId=4010503&docId=298557482,고금리 기대출 5곳 2250정도 됩니다.신용카드 1년 넘게 사용하고있으며 연체이력은 하나도 없고 자가 소유는 없습니다고금리대출이 부담되어서 새직장에서 현재 3개월째 일하고있는 상태인데햇살론같은 대환대출로 2500이상 할 수 있을까요..
27,법인회사 건물 및 토지 매입시 부가세신고와 고정자산등록,/qna/detail.nhn?d1id=4&dirId=40306&docId=298557479,"복합건물의 101호,102호(토지+건물)을 매입했습니다.2018.01.08에 토지분 172,800,000원  과  건물분 67,200,000 /6,720,000 원 세금계산서를 수령했습니다.(법무사사무소 보수료 부분 391,600원 세금계산서 수령)구청에서 발급 받은 취득세(등록면허세)납부확인서 에는등기(등록)물건 : 토지+건물 1동101호(매매:근생)취득세  : 9,600,000원지방교육세 : 1,440,000원농어촌특별세 : 240,000원등기(등록)물건 : 토지+건물 1동102호(매매:근생)취득세  : 9,600,000원지방교육세 : 1,440,000원농어촌특별세 : 240,000원1. 이렇게 토지와 건물분이 통으로 적혀있어서 건물분과 토지분을 나눠서 기초가액에 적기가 애매한데,고정자산등록할때 그냥 건물분취득가액에다가 취등록세를 몰아서 입력해줘도 되는건가요?2. 취득가액에는 취득세,교육세,농특세,증지세,인지세,채권(할인)금액까지 포함하면 되는건가요?추가로, 이번 부가세 신고시에는 2018.01.08에 교부받은 건물과 토지분 세금계산서만 건물등감가상각   자산취득명세서 부가세신고를 하면 되는건지 알려주시면 감사하겠습니다."
28,어플결제했는데 문자로는 신한해외 카드번호승인 되있는데 아직 계좌에서 안나갔는데 이게 시간이 좀 걸리는건가요?,/qna/detail.nhn?d1id=4&dirId=40104&docId=298557473,어플결제했는데문자로는 신한해외 카드번호승인되있는데 아직 계좌에서 안나갔는데이게 시간이 좀 걸리는건가요??
29,페이스북 마케팅 질문있습니다.,/qna/detail.nhn?d1id=4&dirId=40401&docId=298557466,페이스북 마케팅 관련하여 질문있습니다.기존 운영하던 사이트 회원정보를 활용하여페이스북에서 마케팅으로 진행이 가능한가요?굳이 많은 대상으로 진행할 필요가 없고지금 갖고 있는 정보들로 충분히 마케팅에 활용이 가능할 거 같은데방법을 모르겠네요어찌해야하나요
30,남편 명의로 대출된 아파트가 있습니다. 당연히 세대주도 남편 명의로 되어 있구요 일때문에 따로 월세를 얻으려,/qna/detail.nhn?d1id=4&dirId=4020202&docId=298557438,"남편 명의로 대출된 아파트가 있습니다.당연히 세대주도 남편 명의로 되어 있구요일때문에 따로 월세를 얻으려고 하는데요아파트의 경우 부인 명의로 세대주 변경이 가능한지(주민센터가서 세대주 변경하면되는지?), 대출 명의는 남편것으로 계속 둘 예정이구요.그리고 남편은 새로 얻은 월세집 전세금 보호를 위해 전입신고를 할 예정이구요이렇게 할 경우 추가 세금등등 궁금합니다."
31,인터넷자동차다이렉트보험 할인,/qna/detail.nhn?d1id=4&dirId=401030202&docId=298557428,인터넷자동차다이렉트보험 할인 많이 받아서 가입하길 원합니다.다른 타사대비 어디가 저렴한지 정보나 할인많이 해주는데 혹시 있을까요?지금 제일 큰 회사가 삼성인가요? 인터넷자동차다이렉트보험 어디로 하는게 좋을까요?보험료 아낄 수 있는 방법 좋은 할인정보 좀 같이 공유해주세요.
32,KB닥터플러스 건강보험 가입할까요??,/qna/detail.nhn?d1id=4&dirId=401030201&docId=298557396,저는 보험에 대해서 아는 게 없다 보니어디서부터 시작해야될지 몰라서지인에게 물어봤었는데요...지인은 일단은 KB닥터플러스 건강보험에대해서 알아보는 게 좋겠다는이야기를 했었는데요...이 상품은 실비상품인가요????실비상품은 어떤 보장을 받을 수 있는건가요??
33,2018년2월13일에 면책이 결정 됐는데요 개인회생 끝나면 햇살론 받기는 힘든가요? 언제 즘 가능할까요??,/qna/detail.nhn?d1id=4&dirId=40106&docId=298557383,2018년2월13일에 면책이 결정 됐는데요개인회생 끝나면 햇살론 받기는 힘든가요? 언제 즘 가능할까요??
34,삼성생명 보험을 들구있는데 해지를 해야할지 고민이되서 글올립니다 내공 많이드릴게요,/qna/detail.nhn?d1id=4&dirId=4010302&docId=298557369,"계약자는 새엄마로 되있고 피보험자는 저로 되어있어요보험료도 제가내고 보험금도 수령인이 접니다20살에 가입햇는데 그땐 어려서 계약자고 피보험자고 머ㅜ가뭔지 몰라서 그냥싸인하라는대로만 싸인해서 가입한 보험이에요제작년에수술을 하고 보험의 중요성을 깨닫고 알아보던중제 보험이 많이 안좋다는 얘기를들어서 해지를 하려고해도새엄마가 계약자라 해주지를 않아서 보험료는 납부하고있는 상황인데 이러지도 저러지도 못하고있습니다정확히 보장내용을 알고싶어서 고객센터물어봐도 계약자가아니라 알려줄수없다고만 얘기해주고환장하겠습니다..누구는 수술해서 그냥 이 보험 계속 유지해야한다는사람도있고누구는 그냥 해지하고 실비 저렴한걸로 들고 다른걸 더 채우자는ㅅ ㅏ람도있고..ㅠㅠ보험은 삼성퍼펙트업통합보험 인데아는 설계사분이 이도저도아닌 보험이라고 하더라구요대충 보험에대해서 설명드리자면CI보장, 리빙케어보장, 재해장해특약,재해치료비보장특약,신입원특약,암치료비특약,특정질병입원특약,실손의료비보장특약(종합입원,질병통원,상해통원형) 이렇게 있어요괜찮은 보험일까요?해지할수있는 방법은 없을까요?"
35,이럴땐어떻게해야할지 오래된다세대연립주택입니다 자주배관에문제가생겨 위아래할것없이 수시로 배관공사를합니다 저희집,/qna/detail.nhn?d1id=4&dirId=402&docId=298557323,이럴땐어떻게해야할지오래된다세대연립주택입니다자주배관에문제가생겨 위아래할것없이 수시로 배관공사를합니다저희집이3층이라 피해가많은건지..몇년전부터 아래층에물이세고두번의배관공사와도배비까지변상햇읍니다문제는저희집이세서 옥상방수를 하게되었거든요사전고지햇지만 1층2층 다비협조여서개인부담으로남편이재료사다햇읍다그런데 작년에 1층물이센다고 협조해달라고하더군요검사결과메인배관문제라 금액이얼마안드니 본인들이햇다고하더군요3층옥상방수때 1층에서부담안햇으니 앞으로는 제게 이런저런거 바라지도말라고햇어요그리고저희집은 재작년에배관 모두교체하여 별문제가없다고생각햇는데 이번에 2층에서 물이센다고합니다검사결과저희집수도배관문제라고하더라구요당연히제가해드려야하는게맞는데저옥상방수할때 나몰라라 하더니 자기집센다고당연히제가고쳐야된다고합니다물론맞는말이죠작년옥상방수건에대해서 언급햇더니다자고짜 화를냅니다돈낸지얼마안됏는데 또낼수없다고그말은 제가 이집을세주었을때 물이세서 방수를햇고거기에대한금액을늦게 받은거지요7년전쯤 개인비용으로방수를햇고 분담생각도안햇던건데 제가 이사오고 이층으로물이세면서 두번의공사와도배비용청구하셔서 저도몇년전햇던방수비용을애기해서받은거구요작년에옥상방수에대해선 받지않았거든요그런데 이번에본인집에물이세니 고쳐내라는거죠고치는게문제가아니라 너무화가나서요주인아주머니와전화로대판싸웟거든요당연히내가해주는게맞는데 해주기시른거예요옥상방수는 나몰라라하면서 이럴땐어떻게대응해야하는지
36,내공100] 자동차 회사에서 왜 신발을 디자인하고 만들까요?,/qna/detail.nhn?d1id=4&dirId=404&docId=298557321,"자동차 회사에서 왜 신발을 디자인하고 만들까요?아우디, 벤츠, BMW, 람보르기니, 페라리 등그 마크를 단 신발들을 쉽게 찾아볼 수 있는데요,단순히 마크를 단 것일 뿐일까요?아니면 신발회사에 외주를 주고서 자신들의 이름으로 신발을 팔고 있는 것일까요?팔고 있다면 왜 신발을 팔고 있는 것이지요?궁금합니다.자동차와 신발의 관련성이 많아서 일까요? 내공100겁니다~!"
37,실비보험 저렴한곳 어디인가요?,/qna/detail.nhn?d1id=4&dirId=401030201&docId=298557320,"실비보험만 들려고 하는데올 4월부터 실비는 단독으로만 가입이 가능하게 바뀌었다고 하더라구요.괜찮은 실비보험사 어디인까요?실비는 다 거기서 거기다 다 똑같다 아무데서나 들어라...이러는분들 많던데맞는말인가요? 그냥 실비보험이 보장이나 보험료가 다 거기서 거기라면,인터넷다이렉트로 이름있는 삼성화재 같은데 드는게 제일 좋은가요?"
38,미니스톱 AT랑 알바랑 다른건가요????,/qna/detail.nhn?d1id=4&dirId=40611&docId=298557302,미니스톱 AT랑 미니스톱 알바랑 다른건가요????
39,KT 소액결제 선결제,/qna/detail.nhn?d1id=4&dirId=401&docId=298557295,지난달에 kt 소액결제 했던걸 선결제를 하려고 114 상담원이랑 통화해봤는데 요금을 내는 날짜가 안지났어도 개월만 바뀌면 선결제가 안된다는데 대리점을 가도 안되는건가요? 요금 내는 날짜는 4월 21일이라 안지났어요
40,KT 소액결제 선결제,/qna/detail.nhn?d1id=4&dirId=401&docId=298557295,지난달에 kt 소액결제 했던걸 선결제를 하려고 114 상담원이랑 통화해봤는데 요금을 내는 날짜가 안지났어도 개월만 바뀌면 선결제가 안된다는데 대리점을 가도 안되는건가요? 요금 내는 날짜는 4월 21일이라 안지났어요
41,낮은 단계 연방제가,/qna/detail.nhn?d1id=4&dirId=405&docId=296142435,낮은 단계 연방제가 안되는 이유를 자세히 알려주세요 ^^
42,메리츠화재실비보험 가입 요령은???,/qna/detail.nhn?d1id=4&dirId=401030201&docId=298557252,저는 아직 보험에 가입해 본적이 없지만...언제 사고나 질병으로 인해서병원에 가서 치료를 받을지 모르다 보니..미리 실비상품 하나 정도는 가입해 놓는 게좋을 거 같다는 생각을 하게 되었는데요..그래서 메리츠화재실비보험에 가입하려고 하는데..가입하기 전에 알아봐야될 게 있을까요???비교사이트에 들어가서 무엇을 확인하는 게 좋을까요??
43,국민카드 이지론플러스로 100만원 대출받을라고 하는데 원금균등분할상환 방식이라면 12개월로 했을경우 중간에,/qna/detail.nhn?d1id=4&dirId=4010502&docId=298557247,국민카드 이지론플러스로 100만원 대출받을라고 하는데 원금균등분할상환 방식이라면 12개월로 했을경우중간에 원금을 다 갚아버리는 방식은 안되는건가요?
44,피시방 알바를 처음 시작했습니다.,/qna/detail.nhn?d1id=4&dirId=40611&docId=298557171,"피시방 알바를 처음 시작했습니다. 오후파트로 혼자하니까 생각보다 더 힘들더라구요. 음식 메뉴가 헷갈리고 주문량이 너무 많아 정신없고 지치네요. 밥먹을 시간도 없어서 안먹구요. 결국 퇴근할때까지 자리청소~설겆이 다 제대로 못끝내서 제가 과연 이 일을 할 수 있을까 싶습니다. 해보셨던 분들은 어떻게 적응하셨는지 궁금해요또, 원래 pc 100대 이상인곳은 두명이서 일한다고 들었는데 혼자서 일하는 경우도 많은가요?일단 버텨보고 아무래도 적응이 어려우면 말씀 드리려는데 후임을 구하기 까지 시간이 걸리니까, 최대한 빨리 말씀 드려보는게 좋을까요?"
45,법인도장 개인도장,/qna/detail.nhn?d1id=4&dirId=407&docId=298557147,개인사업자 운영중인데 회사 도장을 파려한는데사이트에 들어가보면 법인도장이 따로 있던데개인사업자는 법인도장으로 만들어도 상관없나요?
46,이분 이름이나 인스타계정아시는분있나요...?,/qna/detail.nhn?d1id=4&dirId=406&docId=298557146,이분 이름이나 인스타계정아시는분있나요...?
