,0,1,2
1473,달러 구입 하여 현물로 가지고 있다가 파는게 나을가요 아니면 달러통장을 만들어서 가지고 있는게 나을가요 둘중,/qna/detail.nhn?d1id=4&dirId=40107&docId=298523203,달러 구입 하여 현물로 가지고 있다가 파는게 나을가요 아니면 달러통장을 만들어서 가지고 있는게 나을가요 둘중에 무엇이 좋은지 모르겠어요
1474,땀이 너무 많이나요. 운동부족 아니고 어릴때부터 이랬어요. 뭐 때문에 이런건가요 그리고 병이라면 돈 안들이고,/qna/detail.nhn?d1id=4&dirId=40604&docId=298523172,땀이 너무 많이나요.운동부족 아니고 어릴때부터 이랬어요.뭐 때문에 이런건가요그리고 병이라면 돈 안들이고 할 수 있는 치료방법은요
1475,바텐더 관련 질문,/qna/detail.nhn?d1id=4&dirId=40606&docId=298523125,중3인데 바텐더에 관심을 갖게되어서 궁금한거 지식인에 올려봅니다!! 바텐더가 될려면 따야할 자격증은 어떤게 있나요?? 그리고 바텐더 관련 학과?? 같은게 있을까요?? 마지막으로 바텐더가 될려면 어떤걸 기본으로 쌓아가며 바텐더라는 꿈을 이룰수있을까요?? 자세한 답변 부탁드립니다!!
1476,몇년전부터 오른쪽 고관절쪽이 아파 엠알아이도 찍고 병원도 다녀봣으나 의사마다 원인을 모른다하여 허리쪽으로 엠,/qna/detail.nhn?d1id=4&dirId=401030201&docId=298523103,몇년전부터 오른쪽 고관절쪽이 아파 엠알아이도 찍고병원도 다녀봣으나 의사마다 원인을 모른다하여 허리쪽으로 엠알아이및 진찰햇으나 허리통증으로인한건아니라고하니 고통스럽습니다 양반다리가 안돼고 무릎안쪽통증까지심해지는데 원인이 무엇일지 문의드립니다
1477,간호조무사 자격증.,/qna/detail.nhn?d1id=4&dirId=40603&docId=298523091,간호조무사 실습등 다마치고 시험만 보면 되는 상황인데요..독학하기엔 힘들고 학원다니긴 어려워서 인강혹은 특강같은거 뭐없나요?ㅠ
1478,주택임대사업자 등록 시 기준시가 관련 문의,/qna/detail.nhn?d1id=4&dirId=402&docId=298523065,"임대사업자 등록 시장기임대주택의 요건을 갖추려면등록 당시 기준시가 6억 이하, 수도권 외 지방은 3억 이하여야 한다고 되어 있는데요 ..저는 3월 29일 임대사업자 등록증을 발급 받고 당일 세무서에 사업자 등록을 완료하였습니다.그런데, 얼마전까지 확인했던 공시지가(2017년 1월 1일 기준)가 3억(지방) 이하였는데요,금일 4월 30일 기준으로 공시될 2018년 1월 1일 기준 공시지가를 열람했더니3억(지방)이상으로 확인되네요 ..그렇다면, 위의 요건에서 말한 등록 당시 기준 시가는제가 등록할 당시 공식 확인 가능한공시지가인 2017년 1월 1일 기준인지아니면 4월 30일 공시될 2018년 1월 1일 기준인지 궁금합니다.답변 주시는 분, 미리 감사드립니다."
1479,정신과공익이 취업에 문제가있다던데 제가 한전취업준비중인데 블라인드채용인데 정신과공익이 문제가될까요?,/qna/detail.nhn?d1id=4&dirId=40612&docId=298523057,정신과공익이 취업에 문제가있다던데제가 한전취업준비중인데 블라인드채용인데 정신과공익이 문제가될까요?
1480,창고 바닥을 에폭시 라이닝으로 작업을 했는데 조그마한 기포현상이 왜 생기고 없애 수 있는 방법이 있나요.,/qna/detail.nhn?d1id=4&dirId=40404&docId=298523004,창고 바닥을 에폭시 라이닝으로 작업을 했는데 조그마한 기포현상이 왜 생기고없애 수 있는 방법이 있나요.
1481,코스프레:제가 77사이즈인데 기모노나 유카타를 입을건데 부모님께세 66도 괸찮다고 하시는게예요 기모노나 유카타는 넓으,/qna/detail.nhn?d1id=4&dirId=40502&docId=298522968,제가 77사이즈인데 기모노나 유카타를 입을건데 부모님께세 66도 괸찮다고 하시는게예요 기모노나 유카타는 넓으?니까... 그래서 정말 괸찮을까해서요..... 괸찮을까요?
1482,직장탐색기간보장 적용대상개선!! http://www1.president.go.kr/petitions/1836,/qna/detail.nhn?d1id=4&dirId=40403&docId=298522958,직장탐색기간보장 적용대상개선!! http://www1.president.go.kr/petitions/183656참여후 많은공유부탁합니다내공100걸었어요
1483,수프림 마스터 칭하이가 뭔가요?,/qna/detail.nhn?d1id=4&dirId=405&docId=298522954,제목그대롭니다.
1484,스톨테스트 관련 질문,/qna/detail.nhn?d1id=4&dirId=40609&docId=298522946,스톨테스트를 할때 rpm이 규정치보다 왜 높아지고 낮아지는지 그리고 무슨문제가 있어서 그런건지 설명해주세요 물론 오늘까지요
1485,다국적 기업의 입지 특성과 다국적 기업의 지역변화에 대해 써주세요 (중3 사회입니다) 내공 300겁니다,/qna/detail.nhn?d1id=4&dirId=404&docId=298522929,다국적 기업의 입지 특성과 다국적 기업의 지역변화에 대해 써주세요(중3 사회입니다)내공 300겁니다
1486,자동차 보험관련 와이프될사람이 본인 부모님으로부터 차를 사고 아버지 명의로 보험을 들어갈예정입니다. 헌데 그,/qna/detail.nhn?d1id=4&dirId=401030202&docId=298522916,자동차 보험관련와이프될사람이 본인 부모님으로부터 차를 사고 아버지 명의로 보험을 들어갈예정입니다. 헌데 그전에 어머님이 보험처리를 한 이력이 있어서 보험료가 할증된 상태더군요이 차를 제명의로 돌리고 제이름으로 보험을 너으면 사고 이력이 없어지나요? 아니면 그대로 승계되는건가요
1487,sk휴대폰 요금 카드결제를 했는데.. 통장잔고를 보니 카드결제전에 벌써 자동이체 계좌로 납부가 된 상태더라구,/qna/detail.nhn?d1id=4&dirId=40104&docId=298522901,sk휴대폰 요금 카드결제를 했는데..통장잔고를 보니 카드결제전에 벌써 자동이체 계좌로 납부가 된 상태더라구요..통장잔액은 건드리면 안되는 돈인데..이럴경우 카드가 취소가 되나요아니면 통장으로 송금처리긴 되나요.?통장으로 받을수 있는방법이 있을까요?
1488,경찰공무원인강,/qna/detail.nhn?d1id=4&dirId=40601&docId=298522858,경찰공무원 인강을 사서 들을려고 하는데요. 인강 에듀윌 좋나요? 에듀윌보다 괜찮은곳 있나요?
1489,KT 현대카드 M에디션2 카드 발급하려고 하는데 혜택 있을까요?,/qna/detail.nhn?d1id=4&dirId=40104&docId=298522841,KT 현대카드 M에디션2 카드 발급하려고 하는데 혜택 있을까요?
1490,1.불공에 들어가는 계정과목 알려주세요 2.불공이랑 면세에 지참하는 증빙서류 뭔지 알려주세용,/qna/detail.nhn?d1id=4&dirId=40402&docId=298522768,1.불공에 들어가는 계정과목 알려주세요2.불공이랑 면세에 지참하는 증빙서류 뭔지 알려주세용
1491,고1인데 사회시간에 수행평가를 보는데 저희조의 주제가 고등학생의 가족간의 갈등이에요 제가 문제점응 찾는건데,/qna/detail.nhn?d1id=4&dirId=408&docId=298522745,고1인데 사회시간에 수행평가를 보는데 저희조의 주제가 고등학생의 가족간의 갈등이에요 제가 문제점응 찾는건데 뭐가 있을까요?? 빨리요 ㅠㅠ
1492,농협 자유입출금 상품중에서,/qna/detail.nhn?d1id=4&dirId=40101&docId=298522676,지류통장 발급되고 계좌번호 그대로 유지 할수 있는 상품 있나요?부모님 통장이 기본 상품으로 알고 있는데 부모님이 최소 몇십년은 쓰셨을텐데타행이체 할때 수수료 붙고 SMS 통지도 돈내고아무리 수시로 돈이 나가도 잔액도 한번에 들어오는 금액도 저랑 차원이 다른데이자가 어차피 티끌이지만 제꺼보다 더 티끌이십니다...여러 이유로 지류통장 꼭 있으셔야 하고 바꾸면 계좌번호 헷갈린다고 싫어하십니다.부산은행에는 전환하면 통장은 발급안되지만 계좌번호는 그대로 유지하는거 있던데[제가 씁니다]농협은 없나요?제가 직접 찾아보려니까 30몇개나 되서....
1493,청소년 통장 만들기 1.통잔종류 2.통장만들때필요한준비물,/qna/detail.nhn?d1id=4&dirId=40107&docId=298522673,청소년 통장 만들기1.통잔종류2.통장만들때필요한준비물
1494,가장 넓은 아파트가 어디인가요?,/qna/detail.nhn?d1id=4&dirId=40201&docId=298522662,가장 넓은 아파트가 어디인가요? 오피스텔도 괜찮아요~~제가 알기론 해운대 하버타운이 255평으로 가장 큰걸로 알고 있는데 아닌가요?
1495,잡매니저는 어떤업무를하는건가요?,/qna/detail.nhn?d1id=4&dirId=40611&docId=298522623,"잡매니저는 어떤업무를하는건가요?인력관리라고되어있는데 영업도하는건가요?한달정도는출근하고 그뒤로는 자택근무라고하고..자택근무시간이 7시부터11시, 그리고 4시부터8시 이고 주말 및 공휴일도 자택근무라더라구요..인력사무소처럼 하루하루 사람들을 일하는곳으로 보내는거라고하던데..맞는건가요?"
1496,이거 어떻게 풀어여되나요ㅜㅠ? 설명해주세요ㅜㅜ,/qna/detail.nhn?d1id=4&dirId=405&docId=298522615,이거 어떻게 풀어여되나요ㅜㅠ? 설명해주세요ㅜㅜ
1497,아파트 중도금 및 잔금처리가 궁금합니다~ 아파트청약관련 질문입니다 현재 전세3억짜리 빌라에 살고 있으며 1억,/qna/detail.nhn?d1id=4&dirId=4010501&docId=298522585,아파트 중도금 및 잔금처리가 궁금합니다~아파트청약관련 질문입니다현재 전세3억짜리 빌라에 살고 있으며 1억은 신혼부부전세자금 대출입니다8억대 아파트 분양되면 중도금 40프로가 나온다고 하는데 잔금까지 부족한 중도금과 잔금등 나머지 60프로는 어떻게 충당해야 하나요?중도금은 몇차로 나눠서 내던데 시공사가 대출을 해주는 40프로를 나눠내다 부족한금액은 어떻게 대출을 받아야 하는지 궁금합니다 현금을 60프로 가지고있는 사람은 없을거 같은데요 음도와주세요
1498,최대다수와 최대행복을위하여 소수의견이 무시되는 일상생활속 사례에 대해 알려주세요.,/qna/detail.nhn?d1id=4&dirId=408&docId=298522539,최대다수와 최대행복을위하여 소수의견이 무시되는일상생활속 사례에 대해 알려주세요.
1499,전 전문상담가와 심리상담사가 아니라 그냥 상담사와 상담가와의 차이점이...,/qna/detail.nhn?d1id=4&dirId=40604&docId=298522505,전 전문상담가와 심리상담사가 아니라 그냥 상담사와 상담가와의 차이점이...
1500,학생증 하나체크카드,/qna/detail.nhn?d1id=4&dirId=40104&docId=298522503,학생증으로 하나체크카드를 받앗는데요 용돈을 계좌이체로 받아서 잔액이 9만원이 잇는데 버스 타서 찍엇는데 돈이 없다고 그러던데 왜그럴까요?? 편의점에서 사먹기도 햇어요..체크카드 등록 다햇고 교통카드도 할인등록하고 다햇어요
1501,제가 20인데 고등학생처럼 생겼어요 근데 담배를 피는데 무조건 그편의점에만 파는 담배를 제가 피는데 이번에,/qna/detail.nhn?d1id=4&dirId=406&docId=298522477,제가 20인데 고등학생처럼 생겼어요 근데 담배를 피는데 무조건 그편의점에만 파는 담배를 제가 피는데 이번에 민증을 잃어버렸어요. 근데 민증 잃어버리고 사러갔는데 그쪽편의점은 싸이패스지문인식기를 사용해서 민증이 거의 필수라더군요.그래도 성인인증만 되는거 아니냐며 운전면허증과 바리스타자격증(증명사진만으로는 성인인걸 확신하지못한다더군요) 제가 차키까지 보여줬습니다.그래도 안된다더군요. 그래서 이번에 민증 발급하러가면서 임시신분증 바로 발급해서 가려고 하는데 그래도 안되면 이건 인권 무시및 차별대우(나이많으신분들은 검사안하심ㅡ.ㅡ 당연한건데 솔직히 이정도면 팔았어야됨)로 그냥 엎어버리고 경찰 불러도 되죠? 진짜 제가 알기론 국가법인자격증및 자동차운전면허증으로도 민증 대신해서 쓸수 있다던데 임시신분증까지 안되면 더이상 진짜 민증말고 할수 있는게 없다는소린데 엎어도 되는거죠? 이정도면 편의점의 갑질이 너무심각하다고 생각하고 경찰불러서 끝내렵니다.
1502,"웹개발자는 4차산업혁명에 로봇에 대체될직업vs 살아남을확률이 아주높은직업 개발자는,로봇을 다루는 직업이라고생",/qna/detail.nhn?d1id=4&dirId=40608&docId=298522444,"웹개발자는 4차산업혁명에 로봇에 대체될직업vs 살아남을확률이 아주높은직업개발자는,로봇을 다루는 직업이라고생각햇는데오히려 사라질직업인가요?!!!((( 웹개발자안할거에요 광고하지말아주세요)))"
1503,지역주택조합 관련 질문 드립니다. 4년째 제자리 걸음만 걷고 있는 지주택 조합원 입니다. 올해 3월 임시총회,/qna/detail.nhn?d1id=4&dirId=40203&docId=298522425,지역주택조합 관련 질문 드립니다.4년째 제자리 걸음만 걷고 있는 지주택 조합원 입니다.올해 3월 임시총회 개최전 부터 에서 두 번째 선출된 현조힙장 불신임 한다는 전 조합원들의 의견을 조합장에게 전달 하여서 임시 총회에서 이 시간부로 조합장에서 사퇴 선언 하고 만장일치로 새 조합장님이 선출 되었습니다.이제부터는 사업에 속도를 내는가 싶었는데 전 조합장이 사퇴서를 제출 안 하고 있어서 관할 구청에 조합장 변경 인가 신청을 못하고 있어서 사업이 진행이 안 되고 있습니다.전 조합장 신임하는 조합원 단 한명도 없는걸로 알고 있는데도 자발적으로 사퇴서 제출 안 하면 방법이 없다고 하는데 법적으로 하면 시간이 많이 걸린다고 하는데좋은 방법이 없을까요?
1504,만약 통일후 정치적변화가 되는것(급함내공100),/qna/detail.nhn?d1id=4&dirId=409&docId=298522331,만약 통일후 정치적변화 되는것이 뭔가요기사화해주시면 더좋고안해주셔도괞찬아요...........
1505,제가 체육교육학과를 희망하는 고1여학생인데요 인천대 인하대 생각중인데 내신은 국 영 사탐 과탐만 들어간다고,/qna/detail.nhn?d1id=4&dirId=40602&docId=298522265,제가 체육교육학과를 희망하는 고1여학생인데요 인천대 인하대 생각중인데 내신은 국 영 사탐 과탐만 들어간다고 하네요.그래서 수학학원만 다니는데 끊고 영어로 바꾸든 조금 일찍 체대입시를 시작하든 해보려는데 부모님은 고등학생인데도 쓸데없는 전교석차와 실기는 쉬우니까 아무나 통과해준다는 개말도안되는 생각을 가지고 계십니다.그래서 영어는 노력하는데 학원도 안다니니 정보도 없어서 못하고 수학은 흥미가 너무 없어서 못하고 실기는 부모님이 쉽다고 생각하니까 못하고 쓸데없는 일본어 기가 중국어 공부나 하게 생겼어요
1506,03년생 중학교3학년 학생인데요 생일은 지나지않앗구요 알바를 하고싶기도하지만 집도 그렇게 못사는것도아니고 용,/qna/detail.nhn?d1id=4&dirId=40613&docId=298522245,03년생 중학교3학년 학생인데요 생일은 지나지않앗구요 알바를 하고싶기도하지만 집도 그렇게 못사는것도아니고 용돈도 꼬박꼬박받지만 아빠가 일을 잠시 쉬게되어서 저의학원비의 전부는 안되더라도 휴대폰요금이나 용돈은 제가 벌어서 써보라고 아빠가 말햇어서욬ㅋ뭐부모님동의는 당연히받아주신다고햇고 제가 잘몰라서 중3 16살이 할만한 알바없을까요?? 집에서 하는인터넷부업 광고 이딴거 올리지마세요 추천받을려고하는거잔아요;;;
1507,Ibk 급여 통장 질문이요,/qna/detail.nhn?d1id=4&dirId=40104&docId=298522206,Ibk 급여 통장 을 만들었는데요 발급카드를하이브리드?카드로 만들어주셨어요근데 그게 신용카드라 연회비가 나가던데저는 주로 쓰는카드가 있어사 그냥체크카드로 사용하고 싶은데이미신청은 되어있는데변경 가능할까요??
1508,이거 어디서 파는건가요?,/qna/detail.nhn?d1id=4&dirId=40701&docId=298522185,이거 어디서 파는건가요?
1509,내공 100점드려요 제가 고깃집식당전단지알바를 하는데 돈은 월급으로 받아요 그런데 어느순간부터 오늘은나오지말,/qna/detail.nhn?d1id=4&dirId=40611&docId=298522172,내공 100점드려요 제가 고깃집식당전단지알바를 하는데 돈은 월급으로 받아요 그런데 어느순간부터 오늘은나오지말라는 사장님말이부쩍늘었고 근무시간이 단축되는 경우가많았습니다. 그래서돈을벌어야되는데 돈벌이가잘안되서 오늘 그만두려고합니다. 몇일후면 일본여행도가야되고 운전학원비용도 지불해야되요. 월급날은 4월6일입니다. 과연일찍 사장님이돈을주실까요?? 근무시간늘려달라해도 늘려주질않습니다. 일본가는항공은 4월10일날에 예약했습니다. 여행준비한다고 몇일동안 일을빠듯하게해야됩니다. 답변부탁드려요ㅠㅠ
1510,하천 직강 공사 장점,/qna/detail.nhn?d1id=4&dirId=404&docId=298522144,ㅈㄱㄴ 길게 알려주세요
1511,Si재료역학 9판 솔루션 가지고계신분 있나요ㅠㅠ James M. Gere요,/qna/detail.nhn?d1id=4&dirId=40404&docId=298522129,Si재료역학 9판 솔루션 가지고계신분 있나요ㅠㅠJames M. Gere요
1512,"제가 회사에 임시직으로 와 있습니다. 3개월단위로 끊어서 계약을 하게 되어있는데,올해(2018년) 3월부터",/qna/detail.nhn?d1id=4&dirId=40311&docId=298522059,"제가 회사에 임시직으로 와 있습니다. 3개월단위로 끊어서 계약을 하게 되어있는데,올해(2018년) 3월부터 근무했고요. 12월이 되면 회사에 정규직이 되느냐 안 되느냐가 판가름이 나는데, 저는 지금 타지에 와서 원룸에 월세도 내고 있습니다. 이 경우 연말정산을 안하나요? 일은 지게차 만드는 일쪽에 와 있는데 지게차로 하역하는 업무를 맡고 있습니다. 근무 시간은 오전8시부터 저녁9시까지 하고 토일요일은 오후 5시까지 근무합니다.그리고 시급제로 적용하고요. 월급은 매달 10일날 나옵니다.연말정산이 가능한지 여부 좀 가르쳐 주세요."
1513,체크카드 SMS서비스 있는데 그거 계좌이체 해도 문자 가나요? 저가 저 명의로 안되서 부모님걸로 가서 그런데,/qna/detail.nhn?d1id=4&dirId=40104&docId=298522052,체크카드 SMS서비스 있는데 그거 계좌이체 해도 문자 가나요? 저가 저 명의로 안되서 부모님걸로 가서 그런데 계좌이체로 해도 문자 가나요?? 아니면 안가게하는법 있나요?
1514,부모님께 돈빌릴 때 차용증 작성 및 주택구입자금 소명관련 문의드립니다,/qna/detail.nhn?d1id=4&dirId=40303&docId=298521995,"안녕하세요?금번에약4억5천만원정도의주택구입시추가로필요한자금1억5천만원을은행이자부담을줄이기위해은행대신부모님한테차용증을쓰고빌리려고합니다.1.이금액이면이율1%로매달지급해도괜찮은지요?2. 10년이상상환기간을가져가면차용이아니라무상증여로도볼수도있다고하는데8년정도후에원금상환하면괜찮은지요?3. 18년4월부터3억원이상의주택구입시자금소명을해야한다고들었는데,그러면이금액이상의주택을구입하면서자금증빙서류를의무적으로제출하여신고를해야하는지요? (즉,차용증을세무서에제출해야하는지요?)4.최근10년동안부모님께생활자금이나차량구입등으로약3500만원정도지원을받았는데5천만원이하라따로증여신고는안했습니다...금번에부모님께필요자금차용시,과거의이부분을신고안한것은문제가안되는지요?고수님들의자세한답변주시면감사하겠습니다."
1515,재무관리 문제 하나만 풀어주십쇼,/qna/detail.nhn?d1id=4&dirId=40402&docId=298521971,"a사의 기말주당이익은 1000원 예상. 이익의 50%를 유보하고 재투자 수익률은 12%일때1)a사의 성장률과 주식가치, 성장기회의 현재가치2)a사가 이익의 60%를 유보할때 주식가치의 변화는?"
1516,배우가 꿈... 고민..,/qna/detail.nhn?d1id=4&dirId=406&docId=298521962,현재 고2입니다 한참 중요한 시기죠...그것을 아니깐 저 역시 학업에 충실히 임해서 공부를 열심히 하고있고요..그런데 저는 제 가슴뛰게 하는 것이 진짜 자신이 원하는것이라 생각하는데저는 제 가슴뛰게하는 것이 영화배우라는 꿈입니다.저는 배우라는게 역시 힘들다는것을 알기에 2순위 희망인 아나운서라는 꿈을 목표로 달려가고있습니다'현재'로서는요... 근데 저는 앞서말했다시피 영화배우가 꿈이기에아나운서를 목표로 공부를 하니깐 동기부여가 전혀 되지않습니다. 계속 딴 생각만 들고요..결론을 말하자면 저는 영화배우를 하고싶은데 어떻게해야될까요? 저희 부모님은 정말 좋으신 분들이셔서 제가 하고싶은 것은 무엇이 됬든 믿고 지지해주셔서 부모님의 반대는 걱정이 없습니다저도 지금 솔직히 시도도 해보지않고포기한다면 후회할거같은데 연기자가 되고싶다고솔직히 말씀드리고 부모님께 연기학원을 보내달라고 부탁을 해볼까요?? 조언 좀 부탁드리겠습니다
1517,이거 리필심 다른거 맞죠?,/qna/detail.nhn?d1id=4&dirId=40107&docId=298521956,이거 리필심 다른거 맞죠?
1518,자동차의무 보험 직원이 연기시켜 과태료 나옴,/qna/detail.nhn?d1id=4&dirId=401030202&docId=298521932,자동차 보험 가입했는데 저는 만기전에 냈고 일하는 직원이 몇일 미루다 보이의무보험 지연으로 과태료 나왓는데  보험사는 보험사 여기말고 가입했는데랑 애기하라하고가입한데는 여러사람가입 받아 보험회사랑 연결해주는 업체인가봐요이거 안해줄라함 어떻게 해야하나요  소비자 고발 센터 신고해야 하나요전번은 어떻게대는지요
1519,신한은행 통장 부모님통장인데 부모님핸드폰에 S알리미어플 안깔려있으면 알림안가나요 ?,/qna/detail.nhn?d1id=4&dirId=40107&docId=298521922,신한은행 통장 부모님통장인데 부모님핸드폰에 S알리미어플 안깔려있으면 알림안가나요 ?
1520,쿠팡 주식 사고싶은데요 ...,/qna/detail.nhn?d1id=4&dirId=40102&docId=298521903,쿠방 주식을 사려고하니 쿠팡은 비상장 주식이라고 하네요그래서 이렇게 질문드립니다 쿠팡 비상장 주식도 사는 방법이있나요?있다면 알려주심 진심으로 감사드립니다
1521,아파트청약자격에 대하여 질문합니다. 제가 현재는 무주택자이고 2015.11.16일 청약저축종합통장에 가입하여,/qna/detail.nhn?d1id=4&dirId=40203&docId=298521857,아파트청약자격에 대하여 질문합니다.제가 현재는 무주택자이고 2015.11.16일 청약저축종합통장에 가입하여 2년이 지났으며 2017.11.15일에 의정부 지역주택조합 분양권을 매입하여 올해 11월 입주예정입니다 의정부에 거주중이고 4월분양예정인 세종시 힐스테이트 마스터 1순위 청약 가능할까요.
1522,안양시 인문환경,/qna/detail.nhn?d1id=4&dirId=404&docId=298521808,안양시 인문환경좀 알려주세욤ㅠㅠ제가 사회숙제를 내일까지 내야되서ㅠㅠ알려주시면 진짜진짜 감사드리겠습니다ㅠㅠ
1523,결말 수정분개,/qna/detail.nhn?d1id=4&dirId=40402&docId=298521684,"기초상품: 5,000(500개x\10) 매출: 75,000 매입: 39,600당기 상품 매입의 상세 자료는 다음과 같다.-4월: 1,000개의 상품을 개당 \12에 매입-8월: 1,200개의 상품을 개당 \13에 매입-12월: 800개의 상품을 개당 \15에 매입회사는 당기 중 총 2,500개의 상품을 개당 \30에 판매하였고 회사는 선입선출법에 의해 재고자산을 관리하고 있다. 상품매매거래에 대해서는 매입계정잔액에서 매출원가가 산출되도록 하기 위한 수정분개만 고려한다.>>수정분개는 어떻게 되는지, 그 이유는 왜인지 자세한 답변 부탁드립니다."
1524,스타렉스를 주차중에 받았는데.. 수리비용 얼마정도 나올까요? 위에 깨져있는부분은 다른분이 그런거고.. 저는,/qna/detail.nhn?d1id=4&dirId=401030202&docId=298521680,스타렉스를 주차중에 받았는데.. 수리비용 얼마정도 나올까요?위에 깨져있는부분은 다른분이 그런거고.. 저는 범퍼랑 위 흰색 부분처리해야될거 같은데.. 현금으로 50만원 말씀하시는데.... 가격이 적당한건가요? 아님 그냥 보험처리하는게 나을까요?혹시 보험처리하면 내년이 금액 많이 차이날까요??
1525,Iminthesixthgrade. class1의뜻,/qna/detail.nhn?d1id=4&dirId=40103&docId=298521649,Iminthesixthgrade. class1의뜻
