,0,1,2
988,25살 남자 대학생입니다 다이어트 도와주세요!!,/qna/detail.nhn?d1id=4&dirId=406&docId=298537340,안녕하세요 지식인님들다이어트 20일차인 25살 남자 대학생입니다다이어트를 처음 해봐서 제가 하고 있는 방식이 맞는건지 여쭤보려고 합니다ㅎㅎㅎㅎ글이 좀 길 수 있어요 전문가님들 잘 부탁드립니다!!우선 저의 하루 일과부터 말씀드릴게요아침 8시반에 기상을 합니다자취생이라 게을러서 항상 아침은 거르고 학교를 가요이건 다이어트 전에도 그랬구요매일 12시나 1시에 점심시간이 있어서 집에서 만들어먹고오후 6시에 저녁을 먹습니다이때는 가끔 사먹기도 합니다그리고 다이어트를 시작한 후로는야식이나 술은 입에도 대지 않았고 운동도 시작했습니다매일 저녁 8시 반에서 10시까지 배드민턴을 치고 있습니다샤워 후 다시 학교서 공부하고 평균적으로 새벽 두시쯤에 집에 와서 잡니다같은 일상이 매일 반복이구요컴공과라는 특성 상 하루종일 컴퓨터 앞에만 앉아있고그동안 자취하면서 친구들이랑 새벽 두세시에 술이랑 야식을 엄청 먹어대는 데다가 여태 일년 정도 운동을 안했어요...골격이 좀 있는 편이라작년 이맘때 쯤에는 179/75였는데어떻게 해도 80은 안넘길래 방탕하게 살았더닠ㅋㅋㅋ80을 뚫은 후로는 푹푹 찌네요 아주 그냥..그래서 지금은 179/85 입니다 ㅠㅠ제대한지 꽤 됐고 운동도 안했기 때문에체지방율이 높아서근육 붙은 85키로는 아니에요 ㅠㅠ그간 술로 빚어진 뱃살이 문제입니다 ㅎ올해 말에 면접 시즌이라 다이어트를 하기로 결심했습니다제가 질문하고 싶은건1. 어제 몸무게를 쟀는데 시작할때와 완전 그대로더라구요..물론 바로 효과가 있을 것이라곤 생각하지 않았지만그래도 0.1키로는 빠질줄 알았는데..운동 시간이라던가 취침시간 등에 뭔가 잘못된게 있는건가요?? 만약 있다면 어떻게 고쳐야 하나요??다른 친구들의 말로는 한두달 이상 해야 효과가 난다고 하기도 하고 또는 근육으로 가고 있어서 몸무게는 변동 없을 수도 있다고 해서 잘 모르겠어요2. 지방을 없애는게 목적이라 주로 배드민턴이고 가끔 풋살하는 정도의 유산소 운동만 하고 있어요윗몸일으키기는 현재 허리가 안좋은데다가 혼자하는 운동을 하면 재미가 없어 금방 포기할거 같습니다 ㅠㅠ혹시 이런 부분에서 조언해주실수 있으신가요 운동법이라던가 종목이라던가 아니면 그럼에도 불구하고 한다면 효과 좋은 웨이트 트레이닝이라던가3. 혹시 식단 조절까지 해야하나요..? 인생에 먹는게 유일한 낙인데... 하루에 먹는 두끼의 메뉴도 조절 해야..하나요..?? ㅠㅠㅠㅠㅠㅠ 아니면 다이어트 할 때 좋은 음식 추천좀 해주세요 ㅠㅠ 포만감 높은걸로..4. 말씀 드렸다시피 새벽 2시쯤에 취침을 하는데6시에 저녁을 먹으면 운동 포함해서 8시간 가량 물만 먹는데 너무너무 진짜 엄청 고통스럽습니다 ㅜㅜ 몇시까지는 먹는게 허용이 되나요.... 제발 ㅠ5. 운동 후에 이온음료는 괜찮나요..?상세하게 써주시면 감사하겠습니다!!
989,클로바 충전시켜놓고 자도될까요? 100%로 완충됬는데 계속 연결되있으면 배터리 수명이 빨리가나싶어서요..ㅠㅠ,/qna/detail.nhn?d1id=4&dirId=40103&docId=298537246,클로바 충전시켜놓고 자도될까요?100%로 완충됬는데 계속 연결되있으면 배터리 수명이 빨리가나싶어서요..ㅠㅠ
990,페이스북 대학교 설정,/qna/detail.nhn?d1id=4&dirId=40608&docId=298537146,페이스북 대학교 설정하고 전공인 it융합공학을 입럭하고 저장을 누르면 저장이 되질 않아요... it만 입력하거나 융합공학만 입력했을 때에만 저장이 되는데 어떻게 해야 영어랑 한글을 같이 붙여서 저장할 수 있는지 알려주세요ㅠ
991,DSR 계산 중,/qna/detail.nhn?d1id=4&dirId=4010503&docId=298537133,1년 만기 일시 상환 신용대출(1년단위 연장 중)은DSR 계산시 원금과 이자가 전체 포함되나요?아니면 마이너스 대출처럼 10년으로 나누어서 포함시키나요?
992,질문하기 누르면 제목 입력창이 안나와요;;;;;,/qna/detail.nhn?d1id=4&dirId=40102&docId=298537074,질문하기 누르면 제목 입력창이 안나와요;;;;;
993,보증금 100/50월세 살고있는데 올해 2월에 들어왔어요. 사정이 생겨 이사을해야하는데 보증금에서 수수료 얼,/qna/detail.nhn?d1id=4&dirId=4020202&docId=298537040,보증금 100/50월세 살고있는데 올해 2월에 들어왔어요.사정이 생겨 이사을해야하는데 보증금에서 수수료 얼마떼이나요?
994,취업 스트레스가 너무 심해요...다들 어떻게 이겨내셨나요,/qna/detail.nhn?d1id=4&dirId=406&docId=298536970,"최근에 처음으로 상반기 채용 원서를 넣기 시작했어요. 엄청 가벼운 마음으로요.그냥 이번에 붙으면 좋고 떨어지면 경험이지, 물론 떨어질 확률이 높지만이라고 생각하면서 넣기 시작했는데, 최근에 제가 제일 가고싶은 회사 사류를 합격했어요.서류부터 높은 경쟁률을 뚫고 뽑혔다고 생각하지 이 기회를 너무 놓치기 싫고,서류를 붙었으니 인적성 준비를 매일매일 잠도 줄여가면서 하는데,인적성 문제는 하나 하나 틀릴 때 마다 스트레스가 너무 심해요.맞출 수 있었는데 집중 못해서 틀린 그런 문제들을 보며 제 능력이 이거밖에 안됐나 너무 한심하고결국 오늘 잠오는거 참고 공부하다가 맞을 수 있는 문제를 다 틀리고 혼자 울었어요...몇백대 1의 경쟁률을 뚫으면서까지 이렇게 취업을 해야되나 싶고, 인적성을 통과 못하면 서류를 통과한 보람이 없으니까 더 열심히 하려고 하는데, 과정이 너무 힘드네요인적성에서부터 200명만 뽑는데, 200명 안에 어떻게 들지 너무 막막하고 생각할수록 저는 그만큼의 경쟁률을 뚫지 못하는 사람이라는 생각이 들면서 취업을 영원히 못할 것 같네요. 그래도 상관 없다는 생각이 들기도 하면서 무기력해지고요다들 취업 하면서 이런 생각 많이 하셨을 것 같은데, 어떻게 이겨내나요...그냥 이렇게 힘든 시간 보내면 보상이 오긴 올까요...."
995,그림과 연관지여서 설명해주세요,/qna/detail.nhn?d1id=4&dirId=40401&docId=298536949,그림과 연관지여서 설명해주세요
996,두개다 사용해보신분들있으신가요 추천부탁드려요 어떤걸로해야할지 선택장애가 ㅠㅠ,/qna/detail.nhn?d1id=4&dirId=40401&docId=298536899,두개다 사용해보신분들있으신가요 추천부탁드려요 어떤걸로해야할지 선택장애가 ㅠㅠ
997,"전주시 덕진구 알바,청소년 단기알바",/qna/detail.nhn?d1id=4&dirId=40611&docId=298536812,"전주시 덕진구 알바안녕하세요 17살 고등학교 1학년 남고생입니다.돈이 너무필요하지만 집에서 용돈을 한달에 한번씩받는데 이번달 용돈을 보충수업교재와 문제집을 사는데 다 써버렸는데 더 못받아서 돈에 너무쪼달려 야자끝나고 천원짜리 햄버거하나 먹지못하는 지경입니다ㅜㅜ.한창 먹고싶은게 많을 나이인데 돈이 너무부족해서 제가 주말에 알바를해서 돈을 벌어쓸 생각입니다 그래서 그러는데 전주시 덕진구 인후동,아중리,우아동,호성동,금암동에서 인형탈,전단지 혹은 단기알바를 주말에 시켜만 주신다면 정말 열심히하겠습니다!! 제발 시켜만주십쇼 jung23145@naver.com 으로 메일을 보내주세요 시켜만 주신다면 정말열심히 하겠습니다 돈은 최저시급만 주신대도 정말 감사히받고 열심히 일해 뜻깊은곳에 쓰겠습니다 제발 시켜만 주세요! jung23145@naver.com"
998,제네시스 중고로 구매 예정입니다 취득세 질문드립니다 차량값이 2900만인데 취득세는 중고가로 7% 떼는건가요,/qna/detail.nhn?d1id=4&dirId=4010502&docId=298536811,제네시스 중고로 구매 예정입니다 취득세 질문드립니다차량값이 2900만인데취득세는 중고가로 7% 떼는건가요?아니면 신차가로 떼가는건가요?
999,전산회계 1급,/qna/detail.nhn?d1id=4&dirId=40402&docId=298536800,"전산회계 1급 자격시험 관련 질문이요 ㅠㅠ일반전표 입력할 때 현금 입,출금시 출금전표 입금전표사용 안하고 그냥 차,대변으로 입력 해도 되나요?적요 등록은 언제 하는건가용 등록할때는 문제에 제시 되어있나요 아니면 알아서 판단하고 적나용?"
1000,환자가 돈이없어서 수술을 받지못하거나 병원에서 쫓겨나는 사건이나 뉴스,/qna/detail.nhn?d1id=4&dirId=40603&docId=298536794,환자가 돈이없어서 수술을 받지못하거나 병원에서 쫓겨나는 사건이나 뉴스같은 사례가 필요합니다도와주세요 링크도 가능하고 복붙하셔두되요ㅠㅠㅠㅠㅠㅠ
1001,★★★강의 뭐가 뭔지 몰라서 도움 부탁드립니다!!!★★★(내공110),/qna/detail.nhn?d1id=4&dirId=40601&docId=298536789,제가 공무원을 준비하려고 하는데공단기 사이트 들어가보니18개월이 있고 평생0원 프리패스가 있는데18개월은 책을 따로 사야된다고 알고 있는데1.평생 0원 프리패스는 캐시로 책을 다 살 수 있는 건가요?2.18개월vs평생0원 프리패스 중 책값과 강의료를 포함한 가격 가성비는 어떤것이 나은가요?(제가 가진 돈이 별로 없어서 선택의 중요성을 느끼고 있는 시점입니다.)3.공단기는 강의 비용이 너무 비싸기에해커스나 에듀윌 등의 다른 공무원 강의 하는 곳에 프리패스를 구입해서 하는 것이 나을까요?(가격은 확실히 싼걸로 알고 있습니다.)4.공단기에 비해 타사 강의가 좋을까요?5.만약 타사 강의가 좋다면 그 이유에 대해 말씀 해주세요.
1002,암호화폐 거래를 위해 비대면계좌개설을 하는 이유는 무엇인가요?,/qna/detail.nhn?d1id=4&dirId=40102&docId=298536779,"암호화폐 거래를 위해 비대면계좌개설을 하는 이유는 무엇인가요?실명인증을 해야함은 물론이고, 거래금액 증액을 위해서는 어차피 은행을 방문하여야 하던데 왜 굳이 비대면계좌개설을 하는건지요?"
1003,우리은행 00 으로 돈이 빠져나갔는데 저번달 후불교통비가 이만큼이나 나올 일이 없거든요?? 그래서 우리은행 아이디를..,/qna/detail.nhn?d1id=4&dirId=40107&docId=298536767,우리은행 00 으로 돈이 빠져나갔는데 저번달 후불교통비가 이만큼이나 나올 일이 없거든요?? 그래서 우리은행 싸이트 들어가서 아이디랑 비번 치려니까 아이디는 찾았는데 비번은 변경하려면 아이디?보안??카드가필요하다네요ㅠㅠ 이거 그냥 신분증 들고 은행가서 보안카드 필요하다고 얘기하면 되는건가요??그리고 빠져나간 돈이 정확히 뭔지는 싸이트에서 확인가능한거죠??
1004,편의점알바하다가나왔는데 이거설마독거미같은건아니죠? 잡을라다가 들어갔음,/qna/detail.nhn?d1id=4&dirId=40611&docId=298536764,편의점알바하다가나왔는데 이거설마독거미같은건아니죠? 잡을라다가 들어갔음
1005,개인회생 신청이 고액 체납자도 가능한건가요? 억이 두자리 수나됩니다. 법인회사로 제명으로 하다강제폐업후 동생,/qna/detail.nhn?d1id=4&dirId=40106&docId=298536762,개인회생 신청이 고액 체납자도 가능한건가요? 억이두자리 수나됩니다.법인회사로 제명으로 하다강제폐업후동생명의로 대표를 변경했어요 법무사에 비용지불하고동생이제 이름으로 사업하다 그래서.여러 글을 읽다가 해결 책을 찾고싶어서요해당세무소에서 전화도오는데 도저히 해결불가능해요 십일억이나되어서...개인회생신청할수있을까요?법인명의를 동생으로바꿨어도 제앞으로 세금고지서오네요.어떤분은 명의를 빌려준거입증하고 벌금내야된다는데차라리벌금 이 오백 미만이면 그렇게 라도 하고싶어요동생은이혼하고 자녀도 없어요저는아이들 셋 주부이고요
1006,증권거래세 인하?에 대해,/qna/detail.nhn?d1id=4&dirId=403&docId=298536740,증권거래세 인하를 추진(?)한다는 기사를 봤는데증권거래세를 인하하면 어떤 효과가 있나요?거래세 인하를 추진하는 목적과 기대효과 한계점 등이 궁금해요!증권거래세가 인하로 줄어든 세수에 대한 대안으로 양도소득세를 늘리는 게 있다는데양도소득세는 무엇이고 대안으로써의 장단점은 어떤 것들이 있는지가 궁금해요.그리고 이중과세논란때문에 거래세 인하 이야기가 나온 걸로 알고 있는데정확히 어떤 논란인가요?최대한 자세히 설명해주세시면 좋을 것 같아요ㅎㅎ
1007,"다름이 아니오라 방금 신복위 고객센터 전화 해서 물어 보았습니다. 프리나, 워크에 고연봉이 해당 될수 있는지",/qna/detail.nhn?d1id=4&dirId=40106&docId=298536719,"다름이 아니오라 방금 신복위 고객센터 전화 해서 물어 보았습니다.프리나, 워크에 고연봉이 해당 될수 있는지....상담사가 하는 말이 연체 31일째 되면 신청 할수는 있지만 고연봉으로 인해 채권사에서 반려 할수 있다고 합니다.이게 무슨일인지.. ㅜ.ㅜ저의 현재 채무는 매월 월급 600 , 계약직 6월에 계약 끝남, 무직자 3-4개월OK 저축은행 2018.01.3 920만원 대출 890만원 남음 매월 35만원 2021(만기)JB 우리캐피탈 2017..12.20 700만원 대출 658만원 남음 매월 35만원 2020 (만기)우리카드 201.08.09 1500만원 대출 1110만원 남음 매월 75만원 2019 (만기)카카오 비상금 2017.07.29 100만원 대출 2만원 남음 (마이너스 통장) -산와 대부 2018,02,20 300만원 대출 295만원 남음 (이저 납부) 매월 12만원 2021 (만 기)러쉬앤 대부 2018.02,15 200만원 대출 200만원 남음 (이자 납부 매월 12만원 2021 (만기)국민카드 2005.02.14 228만원 현금 서비스 (2월) , 4월 350만원, 5월 100만원 ~10월까지한도 1000 - 거의 풀 현재 10프로 리볼빙삼성카드 2005.09.30 370만원 현금 서비스 (작년 11월), 4월 100만원, 5월 100만운 ~10월까지한도 1000 - 거의 풀 현재 10프로 리볼빙지인 1인 1200만원 - 내년 2019년 갚아주기함지인 1인 950만원 - 매달 30만원 여유 생길떄 마다지인 1인 380만원 - 매달 60만원 9월까지지인 1인 250만원 - 5월에 갚아주어야함지인 1인 200만원 - 6월에 갚아 주어야 함지인 1인 700만원 - 올해 말 까지 갚아주어야 함지인 1인 230만원 - 올해 말 까지 갚아주어야 함4월 부터 15일에 대부 및 캐피탈 은 납부 하고 4월 26일에 카드 2개를 연체 들어 가려고 합니다.그리고 5월 부터 캐피탈은 연체 들어가고 대부는 납부 하고 5월 말 또는 6월에 프리 신청 하려고 합니다.밑에도 제가 글을 남겼지만 현재 승선 중이라 휴가가 6월 말입니다.채무가. 거기다 베트남 여자 친구 임신 4개월...... 아직 혼인신고도 못하고 있고직업이 항해사다 보니 외국에서 거의 있다 하니 연락은 주로 SNS 혹은 인터넷으로가끔 한국에 도착하면 전화기 사용, 혹은 외국 현지에 있을떄는 로밍 전화기 켜놓고요여기에서 외국에 있다고 하면 연체시 프리나 워크 할떄에도 왠만하며 추신 전화는 받으려고 합니다. ㅜ.ㅜ.그런데 연봉이 7000이 되면 반려가 될수가 있다고 해서 너무 고민스럽습니다.반려가 되면 신고한 날부터 연체된 금액과 신용 악하가 될수 있다는... ㅜ.ㅜ제가 현재 신용 나이스 7등급 올스 8등급인데요.4월 월급 들어 오면 4월달 700만원 매꿀수도 있지만 지인들 한테 빌어야 하고 그리고5월에도 거진 600만원 납부후 6월에 백만원 여유가 생기면서 7월 애백만원 되면서 올해 말되면 매달 200씩 갚으면서내년까지 갚을수도 있지만문제는 베트남에 있는 임신한 여자 친구로 인해 종자금이 필요 하게 되었어요 ㅜ.ㅜ혼인신청서 작성 및 아기가 태어나는 8월 그리고 출생 신고, 최소 2-3000만원 있어야 하는 상황이 되어서..더욱더고민 스럽고 힘드내요... ㅜ.ㅜ4월 부터 연체 생기고 월급 챙기면 6월 까지 1000 정도는 현금화 할수 있는데.. ㅜ.ㅜ어떻게 하면 좋을까요.. 조언 부탁 드리겠습니다"
1008,9급 공무원 수학 시험 범위가 어떻게 되나요,/qna/detail.nhn?d1id=4&dirId=40601&docId=298536710,9급 공무원 수학 시험 범위가 어떻게 되나요
1009,췌장염에대게요리는어떤지요?해로운지요?,/qna/detail.nhn?d1id=4&dirId=40305&docId=298536704,췌장염에대게요리는어떤지요?해로운지요?
1010,자소서 쓸때 왕따 얘기 안쓰는게 좋겟죠?,/qna/detail.nhn?d1id=4&dirId=406&docId=298536545,뭔가 왕따를 당했고 그것을 극복하기위해 뭘 해야됬었는데어떤식으로 극복을 했다고 해야될까요저는 그냥 힘들었었고 죽고싶었지만 그래도 지나가겠지하면서 계속 버티다가 졸업하고갔거든요..근데 솔직히 왕따를 극복하기위해서 뭘 했다는것도 이상하구 그래서요..애초에 평범한애가 그냥 착하기만해서는 욕만 먹구 밥도 혼자먹다가도 못먹겠어서 돈 다내고도안먹고 그렇게 다녔는데..그냥 이유없이 싫어하는애들을 굳이 어떻게 돌려봐야겠다고 노력해봐야 애들이바뀔거같지도않았는데제 성장과정에서 이렇다할게 없어서 쓰려고하는데 버티다가 졸업한게 극복이 될수가있을까요안쓰는게 나을까요
1011,지배회사와 지주회사의 차이는 무엇인가요?,/qna/detail.nhn?d1id=4&dirId=404&docId=298536508,지배회사와 지주회사의 차이는 무엇인가요?
1012,흔히 사용하는 단위변환들을 알려주세요 예를들면 1ml=1/1000L 처럼 적어주세용,/qna/detail.nhn?d1id=4&dirId=40404&docId=298536468,흔히 사용하는 단위변환들을 알려주세요 예를들면 1ml=1/1000L 처럼 적어주세용
1013,카페 식당을 창업하기위해 준비중인데 토지를 매입하고 건축을 해야하는데 자금이 부족합니다. 토지매입 자금부터가,/qna/detail.nhn?d1id=4&dirId=40105&docId=298536445,카페 식당을 창업하기위해 준비중인데 토지를 매입하고 건축을 해야하는데 자금이 부족합니다. 토지매입 자금부터가 부족해서 대출을 알아보던중인데 시설자금대출(후취담보?)라는것을 알게되었습니다.이 대출을 받으면 토지매입을 할때도 이 대출자금을 사용할수있고 매입후 나머지 자금으로 건축을하여 건축을 담보로 조건을걸어 대출이 가능하다던데 이게 맞는건가요?1.총 투자금액은6~7억 정도 생각하고있으며 한도는 얼마나 나올까요2.현재 자금은 1억5천정도가 있는데 한도내 대출가능한지요3.시설자금대출을 받기위해 신용도 기준이있는지요.4.상환기간은 어떻게되고 이자율이 얼마나 될지요
1014,국민임대 아파트에 입주할 예정인데...,/qna/detail.nhn?d1id=4&dirId=40203&docId=298536430,일단 저 혼자 살려고 신청했습니다.나중에 제가 사는 국민 임대 아파트에 부모님을 모시고 같이 살아도 상관 없나요?
1015,주거래은행 월급은 기업은행통장이고 주로사용하는카드는 신한 현대카드입니다 그럼 제주거래은행은어디인가요? 이번에,/qna/detail.nhn?d1id=4&dirId=40107&docId=298536409,주거래은행월급은 기업은행통장이고주로사용하는카드는 신한 현대카드입니다그럼 제주거래은행은어디인가요?이번에 청약이랑 적금도좀넣을라고하는데어디로 넣어야 나중에 대출같은거받을때수월하게받을수있는건가요?
1016,경기도권에 재건축 중인 아파트를 프리미엄 8천만원 주고 총 3억 5천만원에 매입하기로 하고 계약금까지 모두,/qna/detail.nhn?d1id=4&dirId=40201&docId=298536400,경기도권에 재건축 중인 아파트를 프리미엄 8천만원 주고 총 3억 5천만원에 매입하기로 하고 계약금까지 모두 지불하였습니다일주일 뒤에 잔금을 치루고 등기이전 하기로 하였는데 부동산에서 등기비가 970만원이 든다고 하네요등기비 970만원이 적절한가요?답변 부탁드립니다.
1017,{ } 와 {파이(동그라미에 짝대기)}의 차이가 뭐에요?,/qna/detail.nhn?d1id=4&dirId=40604&docId=298536375,{ } 와 {파이(동그라미에 짝대기)}의 차이가 뭐에요?
1018,와이즈만 영재학원 과학강사 면접,/qna/detail.nhn?d1id=4&dirId=40602&docId=298536360,와이즈만 영재학원 과학강사이번에 면접을 보러가게 됐습니다.제가 학벌도 그저 그렇고 신입이라..과외경험은 있어요.전공은 화학이었구요.실험과학이라는게 저희 때는 없던 것들이라면접 시 어떤 질문을 하실까요?현재 와이즈만에서 교사로 일하시는 분이 계시면 도움부탁드립니당.이게 정장을 입어야 할지 그건 좀 오바인건지도 헷갈리네요..
1019,제가 이번에 체크카드를 잃어버려서 다시 신청을 해서 카드를 받았는데요 돈 뽑을 일이 있어서 뽑을려고 하니까,/qna/detail.nhn?d1id=4&dirId=40107&docId=298536303,제가 이번에 체크카드를 잃어버려서 다시 신청을 해서 카드를 받았는데요 돈 뽑을 일이 있어서 뽑을려고 하니까 기계에서 사용 할수 없는 카드라고 뜨더라고요...현금 입금도 안돼요!!!!ㅠㅜㅠㅜ물건 살때 아무런 문제 없이 사용하는데....이거 왜그런 거에요???
1020,한국장학재단 푸른등대장학금,/qna/detail.nhn?d1id=4&dirId=4010504&docId=298536285,언제쯤 발표가 날까요??
1021,안녕하세요 지금 현 고등학교 3학년 재학중인 학생입니다. 제가 작년 제작년에 한 학교 모의투자 대회를 해보고,/qna/detail.nhn?d1id=4&dirId=40102&docId=298536259,안녕하세요 지금 현 고등학교 3학년 재학중인 학생입니다.제가 작년 제작년에 한 학교 모의투자 대회를 해보고 재미가 있는거 같아서큰 금액은 아니지만 제가 모은 돈으로 한번 해볼려고 합니다.Q1. 18년기준 생일 지났으면 법적 대리인의 허락이 필요합니까?Q2. 비대면 계좌도 있던데 비대면 계좌는 말 그대로 폰으로 계좌를 생성하는지Q3. NH투자증권 같은곳 에서 해야하는게 좋은지 아니면 다른 증권사가 더 좋은지 장단점
1022,서장훈같은애국보수가많아요 우파 김주성같은 매국진보가많아요 좌파 우리나라대한민국,/qna/detail.nhn?d1id=4&dirId=408&docId=298536229,보수가강해야산다
1023,"조그만한 가게라도 ex)10평 할랄 인증, 할랄 프렌들리 등 무슬림 종교를 가진 사람들이 이용하는 식당은 어",/qna/detail.nhn?d1id=4&dirId=40604&docId=298536198,"조그만한 가게라도 ex)10평할랄 인증, 할랄 프렌들리 등무슬림 종교를 가진 사람들이 이용하는 식당은어떻게 생기는 건가요?할랄 인증 받는 조건이 무엇인가요?제가 찾아보기로는 무슬림 사람이어야하고,돼지고기,술,개고기 이것만 안들어가는 식당이면되는건가요?또한, 소는 같은 무슬림종교를 가진 사람이 도축해야하는걸로 알고있는데 우리나라에 있기는 한가요?찾아도 안나오던데 유통을 어떻게 받는것일까요?아니면 다 제치고개인식당에서 한국식 할랄이라고 양심껏 돼지고기,술,개고기 첨가안된거 팔면서 할랄이라고 한다면 마크만 없지 그것도 할랄푸드아닌가요?ex)잡채에 돼지고기 빼기,또는 애초에 안들어가는 비빔밥 메뉴 등뉴비빔밥같은거 전문으로하면 무슬림사람들이 먹나요?-자세히 알고싶습니다.-"
1024,제가 어떤 pcb회사에 일을한게 처음엔 2016년 10월 21일날 파견직(아웃소싱)으로 입사했다가 2017년,/qna/detail.nhn?d1id=4&dirId=4010503&docId=298536139,제가 어떤 pcb회사에 일을한게 처음엔 2016년 10월 21일날 파견직(아웃소싱)으로 입사했다가 2017년 04월부로 정직원되어 4대보험가입은 5월2일날 가입을했고 쭉다니다가 2018년 4월1일날 부당한해고를 당한거같아 질문합니다.3월 31일(토요일)근무하는날인데 무단결근을한상태였습니다. 이건 제가무단결근한것이기에 잘못은맞지만 제가 이회사에 다니면서 결근한게 총 4번인데 이번건수까지해서 결근했단 이유로 회사에서 쫒겨나게되었습니다. 졸지에 전 실업자가되었고 기간을정해주지도않고무작정 결근이 여러번있으니 그만두라는식의 말을하여 나오게되었습니다. 더군다나 4월이면 1년이라 퇴직금발생이되는달이기도해서 더 억울한상태인데 보상받을수있나요???자세히 답변부탁드려요ㅠㅠ
