,0,1,2
542,아이디성형외과,/qna/detail.nhn?d1id=7&dirId=70110&docId=298544449,아이디성형외과 재수생이라서 수능꿑나고 광대축소알아보러 갈려는데 비용은 얼마쯤하나요 ㅠㅠ수험생이벤트도 하나요 회복기간이랑 수술하고 며칠후부터 일상생활가능한지알려주시면 감사하겠습니다 ㅠㅠ
543,제가 지금 한약을 먹고있숩니다.다이어트 한약은 아니고 그냥 몸좋아지라고 먹는거거든요 그런데 한약먹으면서 다이,/qna/detail.nhn?d1id=7&dirId=70701&docId=298544413,제가 지금 한약을 먹고있숩니다.다이어트 한약은 아니고 그냥 몸좋아지라고 먹는거거든요 그런데 한약먹으면서 다이어트하면 살안빠지나요??한약때문인가 싶어서요..
544,"생리를보름이상해서 호르몬주사맞았는데, 아직도 양이너무많네요 한달전에 검진상 아무이상없다고했는데... 난소물호",/qna/detail.nhn?d1id=7&dirId=7011404&docId=298544402,"생리를보름이상해서 호르몬주사맞았는데,아직도 양이너무많네요한달전에 검진상 아무이상없다고했는데...난소물호이센치말곤 정상이였어요..하혈이 너무심해서 덩어리도그렇고,유산일수도있나요?"
545,인대강화주사를 맞았는대 맞았을때 아픈건 자도알고있습니다 그런대 맞고 얼마지나지않아 머리가 어지럽고 귀에서 삐,/qna/detail.nhn?d1id=7&dirId=70101&docId=298544393,인대강화주사를 맞았는대 맞았을때 아픈건 자도알고있습니다 그런대 맞고 얼마지나지않아 머리가 어지럽고 귀에서 삐거리는소리와함께 눈앞이 하얗게변하고 엄청 덥고 어지럽고 입에서는 단맛비슷하게 이상한맛이 나더라구요 그래서 접수처에서 진료비를내다가 물마시로 갔다오는길에 주저앉아서 몆십분 가량을 눈을감고 고개를숙이고 앉아있었습니다 이게 원래 정상인지 아니면 이주사가 저한태 안맞는건지 몰리서 질문을 올립니다. 이게 부작용인지 운래그러는건지몰라서 정확하게 답변해주시면 감사하겠습니다 제가맞은주사가 아마 DNA주사였던걸로 기역합니다.
546,로아큐탄 질문,/qna/detail.nhn?d1id=7&dirId=70401&docId=298544392,로아큐탄 부작용 중에 회복지연이 있는데 이게 피부 재생력이 떨어진다는 건가요?
547,청소년 타투에 대해 문의합니다.,/qna/detail.nhn?d1id=7&dirId=705&docId=298544388,청소년 타투에 대해 문의합니다.한자로 성 빼고 이름만 새길건데크기는 새끼 손가락 크기만큼 하고 싶은데가격과 청소년 타투가 되는 곳이 있나요..?
548,혀갈라짐질문합니다 옛날부터 혀중앙은 갈라져잇엇구요 아프지도않고 별지장도없어서 대수롭지않게넘겻엇는데 보통은 혀,/qna/detail.nhn?d1id=7&dirId=70204&docId=298544335,혀갈라짐질문합니다옛날부터 혀중앙은 갈라져잇엇구요아프지도않고 별지장도없어서 대수롭지않게넘겻엇는데보통은 혀가안갈라져잇는게 맞더라구요이거 뭐 건강에문제가잇는건가요담배는하루한갑하고 술은안합니다담배는이제끊으려구요..
549,인대강화주사를 맞았는대 맞았을때 아픈건 자도알고있습니다 그런대 맞고 얼마지나지않아 머리가 어지럽고 귀에서 삐,/qna/detail.nhn?d1id=7&dirId=70101&docId=298544309,인대강화주사를 맞았는대 맞았을때 아픈건 자도알고있습니다 그런대 맞고 얼마지나지않아 머리가 어지럽고 귀에서 삐거리는소리와함께 눈앞이 하얗게변하고 엄청 덥고 어지럽고 입에서는 단맛비슷하게 이상한맛이 나더라구요 그래서 접수처에서 진료비를내다가 물마시로 갔다오는길에 주저앉아서 몆십분 가량을 눈을감고 고개를숙이고 앉아있었습니다 이게 원래 정상인지 아니면 이주사가 저한태 안맞는건지 몰리서 질문을 올립니다. 이게 부작용인지 운래그러는건지몰라서 정확하게 답변해주시면 감사하겠습니다 제가맞은주사가 아마 DNA주사였던걸로 기역합니다.
550,불면증에좋은약초,/qna/detail.nhn?d1id=7&dirId=705&docId=298544302,너무 답답해서 지식인에 글을씁니다제가 몇년전부터 불면증에 시달리고 있습니다 처음에는금방좋아질주 알았는데 꽤 오래지났는데도 정신과가서약처방도 받아서 꾸준히 먹었는데도 좋아지질 않네요 약을장기간 먹어서인지 위가 너무 안좋다고 해서 약보다는 다른것을하고 싶은데 불면증에 좋은약초나 건강식품 불면증에 도움이될만한것이무엇이 있을까요 제발도와주세요
551,고등학생 체육관,/qna/detail.nhn?d1id=7&dirId=707&docId=298544301,저는 지금 고2 여학생이고 몸이 망가지는 게 느껴져서 운동이라도 해볼까 싶어요 주중에는 불가능하고 주말에 체육관에 다닐까 싶은데 괜찮을까요? 성적에 지장이 갈 정도는 아닐까 걱정도 되고 다닐만한 체육관이 있을까 고민도 되네요 도와 주세요ㅜ
552,목 통증 도수치료 관련,/qna/detail.nhn?d1id=7&dirId=701&docId=298544282,"앉아서 일을 많이 하는 사무직 회사원입니다. 원래 일자목인건 알고 있었으나 최근들어 목통증이 심해져서잠을 설치기까지 합니다. 주변에서 듣자하니 일자목이나 거북이목은 도수치료가 효과적이라 하는데 실질적으로 효과가 있는지요? 또한 도수치료가 마사지 하는건지 어떤건지 궁금합니다.도수치료의 방법과 효과, 회사가 역삼이라 역삼근처 도수치료 잘하는곳 알고싶습니다."
553,미오이노시톨하고 비타민D 엽산 세가지 같이 먹어도 되나요?,/qna/detail.nhn?d1id=7&dirId=70109&docId=298544245,미오이노시톨하고 비타민D 엽산 세가지 같이 먹어도되나요?
554,어깨운동 중에서 바벨원판을 들고 차핸들운전하듯이 돌렸다내리고 반복하는 자세가 정확한 명칭이 뭔지알수있을까요?,/qna/detail.nhn?d1id=7&dirId=70701&docId=298544233,어깨운동 중에서 바벨원판을 들고 차핸들운전하듯이돌렸다내리고 반복하는 자세가 정확한 명칭이 뭔지알수있을까요??
555,혈소판감소증,/qna/detail.nhn?d1id=7&dirId=7010104&docId=298544208,혈소판감소증백혈구수 7.4 정상  적혈구수 4.07 정상  헤마토크리트 38.1  정상*혈소판수 71000어떻게 해야되나요. 고견을 부탁드립니다.
556,7000만원을갚아야하는데합의를안해줍니다징역얼마나살까요?,/qna/detail.nhn?d1id=7&dirId=701&docId=298544173,7000만원을갚아야하는데합의를안해줍니다징역얼마나살까요?
557,코끝재수술 자가늑연골 기증늑연골 비용 얼마정도?,/qna/detail.nhn?d1id=7&dirId=70110&docId=298544154,코끝재수술 자가늑연골 기증늑연골 비용 얼마정도?
558,라섹후 점안액 질문,/qna/detail.nhn?d1id=7&dirId=70112&docId=298544133,너무 자주넣다보니 벌써 다써가지고 약국가서 1회용 방부제없는거 아무거나 사용했는데자주넣다본 벌써 또 다써가지고 약국가서 인공눈물 달라니까 아이원 점안액 주더군요ㄱㅇㄷ이였습니다. 뜯을때마다 스트레스였는데 통으로된 점안액이라 편리갑 지금2일째 사용중근데이렇게 막 사용해두되나요? 라섹병원 다녀온뒤 2주뒤에 다시찾아오라하고 약처방내려준 인공눈물은 거의 1주치였음  그렇다는말은 떨어지면 약국가서 알아서 해결하라는 것같고 주의사항도 없고귀찮으시면 다 안 읽으셔두됨 요점말 말씀드림라섹후 아이원 써두됨?  네이버검색하면 아이원안과만 나와서 스트레스
559,코성형후 실리콘이 기울어져서 한쪽면 콧대가 수축되서 분필심은것처럼됐고 그부위에 압박감 당김 불편감이 있는데,/qna/detail.nhn?d1id=7&dirId=70110&docId=298544130,코성형후 실리콘이 기울어져서 한쪽면 콧대가 수축되서 분필심은것처럼됐고 그부위에 압박감 당김 불편감이 있는데 구축 초기증상 인가요?코성형한지는 6개월정도 됐구요 자고일어났을때나 온도차가 나는곳에 있으면 종종 붉어지고 부어보일때가 있지만 항상그렇지는 않아요.구축초기는 내과적치료로 잡을수있다하여 병원에 갔는데 의사가 다시실리콘을 뺄순없지않냐며 붉거나 붓는증상이없다고 아무조치를 안취해주시던데 구축초기 아니겠죠?
560,히스티온정10ml 슈다페드정 피디정 코데날정 이렇게 처방받은 약을 먹고 새벽에 눈이 충혈되고 눈꼽이 끼면서,/qna/detail.nhn?d1id=7&dirId=70401&docId=298543928,"히스티온정10ml슈다페드정피디정코데날정이렇게 처방받은 약을 먹고 새벽에 눈이 충혈되고 눈꼽이 끼면서 안구통이 생겼어요. 아침이 되었는데 안구충혈과 불편감은 그대롭니다. 코데날이 항히스타민제와 병용처방 하지 않는다는 문구를 봤는데, 괜찮을까요?"
561,https://m.blog.naver.com/PostList.nhn?blogId=jojo_world 이사이트,/qna/detail.nhn?d1id=7&dirId=711&docId=298543899,https://m.blog.naver.com/PostList.nhn?blogId=jojo_world이사이트 정품인가요??블로그에서 파는건 처음봐요
562,붓지 않는 고환통증,/qna/detail.nhn?d1id=7&dirId=70113&docId=298543893,붓지 않는 고환통증우측 고환과 그 윗배 통증이 금요일 밤부터 시작됐습니다.심한 통증은 아니고 뻐근하고 불편한 정도인데 우측 고환을 만져도 딱히 아프지 않고 붓지도 않았고 크게 딱딱하지도 않습니다. 병원에서 촉진을 했는데 붓거나 그런게 없다고 의사가 말했습니다. 초음파는 하지 않았구요.항생제랑 소염제를 3일간 먹었는데 크게 차이가 없습니다. 빈뇨 잔뇨감 혈뇨 이런것도 전혀 없고요.부고환염이면 붓고 만지면 아프다는데 그런게 아닙니다. 이런 경우에는 어떤 질환인가요??
563,봄여름만 되면 손등에 아토피,/qna/detail.nhn?d1id=7&dirId=7010104&docId=298543884,봄여름만 되면 손등에 이상한 아토피? 같은게 올라와요 다른 계절은 전혀 이상이 없는데 꼭 봄여름만 되면 이러는데 이게 무슨 증상인가요? 간지러워서 긁으면 더 심해져요ㅠ
564,"자해상처..?(사진있음) 둘 다 하고나서 바로 찍었던 건데 지금은 각각 5일, 2일 되었습니다 언제쯤 사라질",/qna/detail.nhn?d1id=7&dirId=70103&docId=298543882,"자해상처..?(사진있음)둘 다 하고나서 바로 찍었던 건데 지금은 각각 5일, 2일 되었습니다언제쯤 사라질까요?안하려고 하는 중이니 하지말라는 말은 안하셔도 됩니다..."
565,홍대 신경치료 치과 추천해주세요. 광고 사절,/qna/detail.nhn?d1id=7&dirId=70203&docId=298543861,제목 그대로 입니다.광고절대 사절입니다.광고 신고합니다. 진짜 잘하는 곳 추천 해주세요내용입니다: 2년 전이 충치치료했던 곳이 신경이랑 가까워서 찬물 마시면 약간 시릴 수 있다고 했는데 1년 동안은 심하게 시리다가 조심하면서 마셨는데 얼마 전 스케일링 받으면서 그 치아에 찬물을 엄청 쏘아댔어요 그런 후부터 신경이 예민해진 건지 일주일 동안 자는데 그 치아 주변으로 신경이 다 아프고 완전 빠질 거 같고 자면서도 고통 때문에 깨는 게 빈번합니다 그래서 스케일링 받은 치과에 가서 물어보니 치아 신경과 코의 상악동염? 이 너무 근접해 있어서 그곳에 염증이 생기면 앞서 말한 동일증상이 생길 수 있다기에 일단 이비인후과 가서 약은 처방받았는데 엑스레이상으론 코가 차오른 건 없었구요 무슨 증상인가요?? 밤마다 잠을 못 자요ㅜㅜㅜㅜ
566,폐암 초기 증상?,/qna/detail.nhn?d1id=7&dirId=70602&docId=298543859,저희 아빠는 51 중학생 부터 담배를 피어오셨데요술도 일주일에 5번은 하는 것 같고요일주일 전 부터 코피를 많이 흘리시고입에서도 피가 나오는 거 같던데암 증상인가요??또 오늘은 재수없게 윗니만 몽땅 빠지는 꿈을 꿨어요피는 안났고요너무 기분이 별로네요..
567,임산부 케어 하는 곳 있나요? 우정산 근처에 임신부 케어 잘 하는 곳 일을까요? 지금 막달인데 몸이 너무 힘,/qna/detail.nhn?d1id=7&dirId=7011402&docId=298543858,임산부 케어 하는 곳 있나요?우정산 근처에 임신부 케어 잘 하는 곳 일을까요?지금 막달인데 몸이 너무 힘들고 전체적으로 부어서 너무 힘들어요 ㅠㅠ알아보니 출산 하기 전에 관리 받으면 더 좋다고 해서요..집이 우장산 인데 임산부 이다보니 너무 먼데는 안되고집에서 가까운 곳에서 다니고 싶어요..임산부 케어 추천 부탁 드립니다!!
568,코수술 후 4일째 인데요 ! 볼따구 양쪽이 볼거리 걸린거 처럼 부어있는데 ... 왜이런거죠?,/qna/detail.nhn?d1id=7&dirId=70122&docId=298543848,코수술 후 4일째 인데요 ! 볼따구 양쪽이 볼거리 걸린거 처럼 부어있는데 ... 왜이런거죠?
569,임신2주차 관계일 어제 임테기 햇을때 희미하지만 누가봐도 2줄이엿슴니다 그렇다면 관계일은 대략 몇일인가요?,/qna/detail.nhn?d1id=7&dirId=7011401&docId=298543824,임신2주차 관계일어제 임테기 햇을때 희미하지만 누가봐도 2줄이엿슴니다그렇다면 관계일은 대략 몇일인가요?
570,직급 관련 질문합니다.,/qna/detail.nhn?d1id=7&dirId=703&docId=298543807,1. 지방보조원2. 지방보조원(1종)3. 지방보조원(2종)지방자치단체에서 무기계약직(공무직)을 위처럼 직급이 나열되어 있는데어떤게 맞는지?어떤직급을 의미하는지?알고 싶습니다.누군가 물어오니.. 정확히 대답을 할수 없어서 이리 지식in에 문의해봅니다.
571,"다리 알,붓기 질문",/qna/detail.nhn?d1id=7&dirId=70701&docId=298543798,며칠전에 체육시간에 오래달리기한게아직도 좀 아픈데 시간 지나면 나아지나요?그리고 다리 알같은거는 놔두면 없어지는건가요 안 사라지나요?
572,헬스 질문입니다,/qna/detail.nhn?d1id=7&dirId=70701&docId=298543793,1.머신은 한달정도면 중량을 올릴수가 있는데 벤치프레스나 스쿼트는 중량이 잘안오르거나 오래지나야 올리게되더라고요...왜그런가요? 먹는게 부족한건지..팔근력이 부족한건지2.딥스할때 가슴위주로하는데 단단해지기보단 커진느낌이드는데 잘된건가요?
573,유선발달이 사춘기시기나 임신이 아닌데도 발달이 될수있나요?? 일단 임신은 절대아니고 22살인데 한달동안 가슴,/qna/detail.nhn?d1id=7&dirId=7011404&docId=298543791,유선발달이 사춘기시기나 임신이 아닌데도 발달이 될수있나요?? 일단 임신은 절대아니고 22살인데 한달동안 가슴이 뻐근한 느낌이 있어요 생리전후와 관계없이 가슴을 살짝 만지면 알베긴것처럼 아프네요 사춘기시기도 아니고 임신도 아닌데 유선발달이 일어날수있나요?? 전에 산부인과에서 호르몬 검사를 한번핬었는데 결과에 다른건 다 정상이고 젖나오는 호르몬수치가 약간 높다고 하셨는ㄷㅔ 관련이 잇나요?
574,"상징의 효과 상징의 효과가 뭔가요 ,,?",/qna/detail.nhn?d1id=7&dirId=71105&docId=298543771,"상징의 효과상징의 효과는 뭔가요 ,,?"
575,탄수화물.단백질 질문입니다,/qna/detail.nhn?d1id=7&dirId=70701&docId=298543763,칼로리나 단백질 같은 경우 영양성분에 표기된 것 전부를 다 흡수를 할수있지는 않잖아요그런데 얼마나 흡수되는지를 모르니까 일단 먹었으면 영양성분에 표기된 만큼의 칼로리나 단백질이 섭취됐다고 봐도되는거죠?
576,흡연자 입니다. 오늘 라식했는데 라식 하고 6시간뒤에 흡연을했는데 괜찮을까요???너무나 자연스럽게 담배를폈어,/qna/detail.nhn?d1id=7&dirId=70602&docId=298543735,흡연자 입니다. 오늘 라식했는데 라식 하고 6시간뒤에 흡연을했는데 괜찮을까요???너무나 자연스럽게 담배를폈어요ㅠㅠ
577,머리카락이 너무 빠져서 탈모인지 뭔지 정확하게 진단을 받고싶어서 그러는데 병원을 어디과로 가야하는지 모르겠어,/qna/detail.nhn?d1id=7&dirId=701&docId=298543694,머리카락이 너무 빠져서 탈모인지 뭔지 정확하게 진단을 받고싶어서 그러는데 병원을 어디과로 가야하는지 모르겠어요ㅠㅠ 그리고 신도림.구로에서 잘하는곳이 어딘지 알려주세요
578,피부질환 어떻게 해야 되나요?,/qna/detail.nhn?d1id=7&dirId=70404&docId=298543655,"등,팔,다리...몸전체에 이런증상이 있어요.가려움은 참을만해요.피부과에선 약처방해서 먹었는데 조금 괜찮다 싶더니 또시작이네요.이런거는 태어나서 처음입니다."
579,건강검진에 폐검사 추가하면.,/qna/detail.nhn?d1id=7&dirId=7010101&docId=298543648,안녕하세요.국가에서 하는 일반건강검진에 폐검사까지 같이 하면 얼마나 나오나요?
580,피부질환 어떻게 해야 되나요?,/qna/detail.nhn?d1id=7&dirId=70404&docId=298543655,"등,팔,다리...몸전체에 이런증상이 있어요.가려움은 참을만해요.피부과에선 약처방해서 먹었는데 조금 괜찮다 싶더니 또시작이네요.이런거는 태어나서 처음입니다."
581,건강검진에 폐검사 추가하면.,/qna/detail.nhn?d1id=7&dirId=7010101&docId=298543648,안녕하세요.국가에서 하는 일반건강검진에 폐검사까지 같이 하면 얼마나 나오나요?
582,얼마전 샤워하다 계란흰자같은 냉이 나왔는데 응고된피가 섞인것처럼 나왔어요. 배란기라 그런걸까요..자궁에 출혈,/qna/detail.nhn?d1id=7&dirId=7011403&docId=298543643,얼마전 샤워하다 계란흰자같은 냉이 나왔는데 응고된피가 섞인것처럼 나왔어요.배란기라 그런걸까요..자궁에 출혈이 있는걸까요?냄새도 간지럼도 없습니다. 임신한 사람도 아닙니다.
583,갑상선수치 3월에 종합검진에서 갑상선 혹과 염증이 소견이 있었어요 혹은 그전부터 있었는데 사이즈도 2mm가,/qna/detail.nhn?d1id=7&dirId=7010104&docId=298543617,갑상선수치3월초에 종합검진에서 갑상선 혹과 염증이 소견이 있었어요혹은 그전부터 있었는데 사이즈도 2mm가 더 커졌고피검사수치에서 TSH? 수치가 16.17 나왔어요진료요망이래서 25일날전문병원가서 피검사 했는데 정상수치래요초음파도 봤구요(혹과 염증 有)이럴수가 있을까요?다른병원 가봐야할까요?종양지표 cyfra21-1 수치상층했다고 나오는데 갑상선과 연관있는건지 ㅜㅜ 자궁육종암 초기에 수술한적 있어서 더 걱정이네요
584,포도먹는 꿈,/qna/detail.nhn?d1id=7&dirId=70404&docId=298543604,오늘 꿈에 엄마집에 냉장고를 열어보니까 포도가 되게 많더라구요. 그중에 거봉이 있었는데 그걸 제가 몇알따서 먹었는데 포도먹는 꿈은 무슨꿈인가요?
585,이 클리닉 중 제일 괜찮은게 뭔가요?,/qna/detail.nhn?d1id=7&dirId=70309&docId=298543598,"이 클리닉 중 제일 괜찮은게 뭔가요?1. 르미네상스 클리닉 풀코스2. J-RUBY 클리닉 풀코스3. 무코타클리닉 풀코스4. 밀본 프라미아 클리닉전 단발머린데 고데기를 해서 좀 부스스해지고 건조한 모발이라 유수분, 단백질 채우고 싶은데 어떤데 오래 유지되고 좋을까요?간단한 차이점도 부탁드립니다"
586,관절에좋은식품,/qna/detail.nhn?d1id=7&dirId=70403&docId=298543553,관절염에 좋은 식품에는 뭐가있나요어머니가 관절염으로 고생하시는데 조금 편안하게산책정도는 하실수 있었으면 좋겠습니다이번에 관절에좋은식품 사드릴려고 하는데아무래도 먹기 편한것이 좋을것 같아요관절염에 좋은약초나 식품알려주세요 알약을 못드시거든요
587,한 달 전 발목이 접질렀는데 안쪽으로는 굽혀지는데 기지개 펴듯이 바깥쪽으로 펴지질 않습니다. 억지로 펴려고,/qna/detail.nhn?d1id=7&dirId=70106&docId=298543539,한 달 전 발목이 접질렀는데 안쪽으로는 굽혀지는데 기지개 펴듯이 바깥쪽으로 펴지질 않습니다. 억지로 펴려고 하면 통증이 있구요 그래서 경사진 곳을 잘 못보고 걸었을 땐 통증이 옵니다.처음에 발목이 많이 부었는데 지금 한국이 아니라 병원은 못 가고 찬물로 여러날 마사지 해주었습니다. 멍도 올라왔다 사라졌습니다.처음엔 붓기가 많이 가라앉았는데 지금은 또 약간 부어 있는 상태입니다. 시간이 지나면 낫는 건지.. 어떻게 해야할까요?ㅠㅠ
588,마른체형 운동방법,/qna/detail.nhn?d1id=7&dirId=70403&docId=298543534,안녕하세요제가 이번에 운동을 시작하려고 합니다. 체형은 마른 체형이구요남성입니다.헬스장에서 운동을 할 예정입니다. 운동을 어떻게 해야될지 잘 몰라서 질문합니다원하는거는 체중과 근육량을 늘리면서 덩치를 키우고 싶습니다제가 군대에 있을때는 단백질 보충제를 섭취하면서 매일 한부위씩 운동하는 방식으로 했었습니다. 이렇게 해도 상관없나요??방법좀 알려주시면 감사하겟습니다
589,라비에트정 잘라서 먹어도 되나여.,/qna/detail.nhn?d1id=7&dirId=70404&docId=298543492,라비에트정 잘라서 먹어도 되나여. 라비에트정 20mg 받았는데 용량이커서 칼로 반으로 잘라먹어도 괜찮나요.
590,어제 부터 목이 약간 안 좋았는데 기침 할때마다 목이 따끔따끔 해요 이거 감기 증상 맞나요 ?,/qna/detail.nhn?d1id=7&dirId=7010101&docId=298543491,어제 부터 목이 약간 안 좋았는데기침 할때마다 목이 따끔따끔 해요이거 감기 증상 맞나요 ?
591,헬스 후 무조건 샤워 해야하나요? 예전에는 주위시선때문에 했는데 헬스장도 집에서 5분거리고 헬스후 바로 집에,/qna/detail.nhn?d1id=7&dirId=707&docId=298543346,헬스 후 무조건 샤워 해야하나요?예전에는 주위시선때문에 했는데 헬스장도 집에서 5분거리고 헬스후 바로 집에가고요 또 다이어트를 이제시작해서 몸도 부끄럽고 친구랑 같이 다니는데 친구는 걍 니 몸 아저씨몸매라 핑계라고 걍하라하는데 난감합니다.
592,이빨 깨짐,/qna/detail.nhn?d1id=7&dirId=702&docId=298543333,어제 넘어져서 앞니가 조금 깨졌는데 다행이도 그렇게 많이 깨지진 않았어요. 숨쉴때 조금 시리고 입다물고 있으면 안시린고 어떻게해도 아프진 않은데 이정도면 어떤 치료를 해야할까요? 지금 여행와있어서 목요일에나 제대로 치료할수있을것같아요. 일단 여행지에있는치과를 임시방편으로 가보긴한건데 집에돌아와서 제대로 치료받으려면 어떤류의 치료를 받아야하나요? 제일 자연스럽고 오래가는 치료법이 좋을것같아요.
593,영양제 지금 잘 먹고 있는건지 확인부탁드립니다,/qna/detail.nhn?d1id=7&dirId=70403&docId=298543304,"영양제 지금 잘 먹고 있는건지 확인부탁드립니다아침먹고 프로바이오틱스, 비타민C 한알씩 같이저녁먹고 비오틴,종합비타민,실리마린 한알씩 같이자기전 칼슘마그네슘 두알이렇게 먹고있는데 괜찮을까요?"
594,쌍수라인  잘못 잡힌건가요?,/qna/detail.nhn?d1id=7&dirId=70110&docId=298543272,앞트임이랑 쌍수를 안과해서 했었는데대충 3개월 된것같네요한쬐은 아직 붓기가 덜빠진건가요?엄마가 자꾸 라인 풀린거아니냐 스트레스 주셔서요
595,다음달부터 헬스를 시작하려는데 평소 제 몸에 자존감도없고 보여주기도 싫은데 몸이 그동안 너무 쪄서 그래서 운,/qna/detail.nhn?d1id=7&dirId=70701&docId=298543267,다음달부터 헬스를 시작하려는데 평소 제 몸에 자존감도없고 보여주기도 싫은데 몸이 그동안 너무 쪄서 그래서 운동을 하려하는데 고민입니다.한층이 헬스장이고 운동후 샤워도 할텐데 그림과 같은 몸인데운동복 갈아입거나 샤워할때 남들시선이 다 몸좋은데 나만 그렇게 보이고 느껴집니다.걍 제가 신경쓰여요. 근데 샤워는 안하고 가기 그렇고 어떻게 해야할까요?그리고 운동복 갈아입을때 팬티 런닝 다벗고 입는건가요?샤워 운동후 하는게 났죠? 집가서 샤워할까 하는데
596,"안녕하세요 28살 남성입니다, 1년에 한두번씩 심장이 조이는 증상이 있기는 했는데요 어제 놀이기구를 타면서",/qna/detail.nhn?d1id=7&dirId=70105&docId=298543264,"안녕하세요 28살 남성입니다,1년에 한두번씩 심장이 조이는 증상이 있기는 했는데요어제 놀이기구를 타면서 심하게 긴장을 했더니30초 남짓 기구를 다 타고 나서도 손발이 부들 부들 떨렸거든요그런데 오늘 자고 일어나서 생활하다 보니어금니쪽에 은근이 통증이 오면서 가슴이 답답하네요원래 긴장을 너무 심하게 해도 이런 협심증증상이 발생할 수 있나요?"
