,0,1,2
1014,안녕하세요 지금 중학교 2학년인 여학생입니다 제가 왼발 엄지발톱의 오른쪽 끝부분이 살을 파고들어 살짝 부딪히,/qna/detail.nhn?d1id=7&dirId=70103&docId=298535002,안녕하세요 지금 중학교 2학년인 여학생입니다 제가 왼발 엄지발톱의 오른쪽 끝부분이 살을 파고들어 살짝 부딪히기만 해도 아프게 통증이 느껴지고 오늘은 좀 보려고 건드리니 노란 진물? 고름? 비슷한것이 터졌습니다ㅠㅠ 이번주 토요일에 병원을 가보려고하는데 정형외과를 가야하나요?? 수술을 한다면 많이 아픈가요ㅠㅠㅠㅠ 어떤분 사진을 보니까 발 전체에 붕대를 감았던데.... 수술은 생각만해도 너무 겁나용ㅠㅠ 내공 40 드려욤
1015,기관지염인가요? 목이 엄청 아프고 가슴통증은 있다가 사라졌지만 되게 속이 뜨거운 느낌이고 숨쉬는게 매우 답답,/qna/detail.nhn?d1id=7&dirId=7010101&docId=298534995,기관지염인가요?목이 엄청 아프고 가슴통증은 있다가 사라졌지만 되게 속이 뜨거운 느낌이고 숨쉬는게 매우 답답하고 기침 계속하지만 열은 안나요
1016,저의엄마가 유방에 양성종양을 가지고있는데 저음에는0.5cm였다가 1년뒤에 다시 검사하니까1.5cm가 나왔어요,/qna/detail.nhn?d1id=7&dirId=70116&docId=298534988,저의엄마가 유방에 양성종양을 가지고있는데 저음에는0.5cm였다가 1년뒤에 다시 검사하니까1.5cm가 나왔어요 의사는 1년뒤에 다시 와보라하는데 정말 양성 맞을까요 1년만에 종양이 너무 커진것 같아요
1017,임신가능성관련 질문입니다.,/qna/detail.nhn?d1id=7&dirId=7011401&docId=298534957,2월 16일이 생리시작이었구요 20일에 관계를 맺었습니다. 질내사정을 했고 3월 7일에 다시 관계를 가졌습니다. 이때는 체외사정이었구요.월요일에 병원갔더니 초음파로 너무 작아서 잘 안보인다며 이번주 목요일에 다시 병원을 오라고 했는데초음파로 안보일정도 작은데 제 아이일 가능성이 있나요?
1018,물똥만 계속 나와요 거의 한 달? 두 달?정도 계속 물똥 밖에 안나와요 가끔씩 토끼똥 나오긴 하는데 거의 매,/qna/detail.nhn?d1id=7&dirId=7010102&docId=298534948,물똥만 계속 나와요거의 한 달? 두 달?정도 계속 물똥 밖에 안나와요 가끔씩 토끼똥 나오긴 하는데 거의 매일 물똥 밖에 안싸요 아픈데도 없고 스트레스도 옛날엔 자해할 정도로 심하게 받았지만 3~4달 전부턴 스트레스 거의 받을 일도 없고 심하게 받지도 않는데 왜 이럴까요..최근엔 2틀 연속 붉은물똥이 나오다가 이젠 안나와요 건강에 무슨 이상이 생긴 걸까요??
1019,항문에 강낭콩만한 말랑한 뭔가 삐져나와 있는데 그게 회음부 살? 성기쪽으로 가는 살이랑 이어져있는데 이게 뭐,/qna/detail.nhn?d1id=7&dirId=70104&docId=298534913,항문에 강낭콩만한 말랑한 뭔가 삐져나와 있는데 그게 회음부 살? 성기쪽으로 가는 살이랑 이어져있는데 이게 뭐죠? ㅠ 올챙이 같은 구조로 이어져있는데똥쌀때 피가 나온적은 없고요 가끔 화끈화끈 거리게 아플때가 있습니다 이번 년도에 장염 걸린 후 생긴것 도 같고 원래 있었던 것도 같고 잘 모르겠어요 ㅜ 근대 일상생활에 지장은 없거든요수술이 필요한 건가요??
1020,가글 관련 질문입니다 제가어금니쪽에 충치치료를 좀 마니 해서 은으로 씌어진부분이 많아요. 치아도 약한편인데,/qna/detail.nhn?d1id=7&dirId=70203&docId=298534877,가글 관련 질문입니다제가어금니쪽에 충치치료를 좀 마니 해서 은으로 씌어진부분이 많아요. 치아도 약한편인데 가글해도 별 상관없나요?
1021,눈살이 적은편인가요 많은쳔인가요? 쌍꺼풀 생기고 싶어서 그러는데 적은지 많은지 알려주세요,/qna/detail.nhn?d1id=7&dirId=705&docId=298534850,눈살이 적은편인가요 많은쳔인가요? 쌍꺼풀 생기고 싶어서 그러는데 적은지 많은지 알려주세요
1022,피임효과 있나요,/qna/detail.nhn?d1id=7&dirId=7011403&docId=298534845,"막달 생리가 3월 10일에 끝났구요 피임약 3월 25일부터 먹기 시작했어요 주기는 전혀 일정하지않아요 몇달동안 안나오다가 몇달동안 나오고 그런정도 ,, 생리가 언제 나올지 몰라서 여행때문에 늦추려고 먹은건데 이번주에 피임효과가 있을까요 ??"
1023,다이어트 식단 추천해주세요 수험생인데 계속 앉아있더니 살이 쪄서ㅠㅠ 밤에 15분정도 살짝 땀날정도 가볍게 운,/qna/detail.nhn?d1id=7&dirId=70601&docId=298534837,"다이어트 식단 추천해주세요수험생인데 계속 앉아있더니 살이 쪄서ㅠㅠ 밤에 15분정도 살짝 땀날정도 가볍게 운동하는데식단이 이렇게 하면 괜찮은가요?아침일반식 , 사과 1개점심닭가슴살 또는 두부샐러드, 방울토마토 5개, 고구마 작은 거1개, 삶은계란1개간식브라질너트1개저녁닭가슴살 또는 두부샐러드, 방울토마토 5개, 고구마 작은거1개고칠부분이나 따로 추천할 식단있음 알려주세요"
1024,등이아파요 ㅠㅠㅠㅠㅠㅠㅠㅠㅠ 어제 꽃보러가서 좀 많이걷고 힘들긴했는데 막 가방도 에코백인데 무거운것도 아니였,/qna/detail.nhn?d1id=7&dirId=70105&docId=298534835,등이아파요 ㅠㅠㅠㅠㅠㅠㅠㅠㅠ 어제 꽃보러가서 좀 많이걷고 힘들긴했는데 막 가방도 에코백인데 무거운것도 아니였고 중간중간 쉬었는데 좀 녹초가 되긴 했지만 근데 점점 시간지날수록 왼쪽 등 날개뼈 밑쪽이 통증이오면서 숨쉴때마다 아파요 깊게 숨쉬면 날개뼈 안쪽이 아프면서 숨이 턱 막혀요 몸을 살짝 비틀어도 아프고 숨쉬면 바람이 어디로들어가는지 느껴지는것같기도하고 아무튼 숨쉬기가 너무 힘들고 괴로워요 ㅠ 작게쉬면괘찮은데 크게쉬면 아파서 너무답단ㅂ해요 담걸린건지 뭔지 병워가야하나요ㅠㅜㅜ
1025,손목에 여드름 같은게 났는데 건들이기만해도 아프네요 ㅠㅠ 혹시 물사마귀는 아니겠죠??,/qna/detail.nhn?d1id=7&dirId=70111&docId=298534827,손목에 여드름 같은게 났는데 건들이기만해도 아프네요 ㅠㅠ 혹시 물사마귀는 아니겠죠??
1026,20살 남성 자살충동...,/qna/detail.nhn?d1id=7&dirId=70109&docId=298534807,"졸업하고나서 20살됬는데 이 이후로 너무 우울해요.초등학교 3학년부터 친구 하나없었고. 괴롭힘부터 왕따를 당해왔어요.중학교1학년때는 각종 괴롭힘이 너무 심해요 교실 자체를 들어가지 않았습니다.책상에 온갖 욕설낙서,그리고 터진체로 흘려져있는  우유펙..그래도절 유일하게 이해해주고 절 봐주신 선생님은 미술 선생님이셨는데이젠 이름조차 제대로 기억이 안나요..ㅋㅋ이게 왕따생활과 가정폭력이 맨날 지내다보니제 자신을 자연스레 숨기게 되었어요.사회에서도 평소처럼 행동안하고..그래서 사회만 나가면 무서워요..어렸을때부터 가정폭력에,왕따밑 괴롭힘,,친구하나없음..제가 유일하게 자신있는 그림조차도 남들그림보고 열등감과 우울함을 느껴요..지금 20살되서 더 슬픈건 뭔지 아세요?어렸을때부터 귀랑 눈이 안좋게 태어났어요.한마디로 장애에요.뿐만아니라 지금 20살인데도 키가 중학교때처럼 165에요.게다가 못생기고.. 71킬로 비만..정말 슬프고 우울해요..잘하는거 하나없고 키도작고 못생기고 맨날 가정과 남들에게 욕이나 먹고제자신을 숨기면서 살고..이런 우울함과 슬픔을 피시방가서 풀어요..자살충동이 많이들고만약 군대를 가게되면 군대에서 머리에 총박고 자살생각 할정도에요...정말 다시 인생을 살게 된다면 좋은 부모와 좋은사람들을 만나고싶네요..저한텐 인생 가망이 없죠?자살생각부터 차라리 범죄를 저지르고 감옥에 살고싶을정도에요..티비에 나오는 키 185에 멋진 연애인들이 너무 부럽거든요..저는 유일하게 '노력은 배신하기도 한다'로 믿어요..제가 아무리 노력해도 안되는게 대부분이었거든요."
1027,제가 토끼를 6년 정도 키우고 있는데 한 3년 전에 배에 동그란게 있어서 병원에서 제거했어요 그런데 이번에도,/qna/detail.nhn?d1id=7&dirId=70104&docId=298534792,제가 토끼를 6년 정도 키우고 있는데 한 3년 전에 배에 동그란게 있어서 병원에서 제거했어요 그런데 이번에도 또 생겼더라고요 네이버에 쳐보니깐 농양이라는데 농양제거 간단한 수술인가요? 아니면 안해도 되는건가요?
1028,안녕하세요. 20살 여자입니다. 분비물이 많이 나오고 냄새가 심해요. 몇달 전부터 겨울이라 이틀에 한번꼴로,/qna/detail.nhn?d1id=7&dirId=7011404&docId=298534774,안녕하세요. 20살 여자입니다.분비물이 많이 나오고 냄새가 심해요.몇달 전부터 겨울이라 이틀에 한번꼴로 씻었는데가만히 앉아만 있어도 땀 차듯? 생리하듯? 축축해지고씻은지 12시간도 안되서 악취가 나기 시작합니다.또 생리불순이 심해서 (1년에 많으면 3번정도 함)질염 검사랑 생리불순 검사를 하려고 하는데 비용이 대략 얼마정도 들까요? 대충이라도 말씀 좀 해주세용 ㅠㅠ또 생리불순엔 어떤 이유가 있나요?남성호르몬이 과다해도 생리불순일 수 있나요?신체면에서 키 빼고 남성적이에요.
1029,디페린겔쓰는데 살리실산 포함된 폼클렌징 써도되나요? 이름은 라로슈포제 에빠끌라 딥클렌징 이에요,/qna/detail.nhn?d1id=7&dirId=70401&docId=298534766,디페린겔쓰는데 살리실산 포함된 폼클렌징 써도되나요?이름은 라로슈포제 에빠끌라 딥클렌징 이에요
1030,다이어트 운동,/qna/detail.nhn?d1id=7&dirId=70701&docId=298534740,안녕하세요혹시 아침에 밥먹고 운동해도 살이 빠지나요??아침 밥먹고 운동 몇시간후에 운동 하는게 좋을까요운동 끝나고 몇시간후에 밥먹는게 좋을까요저 출근때문에 11시에 밥을 먹습니다아침 밥 대신 먹고 바로 운동하면 괜찮을 음식이 있나요?아침운동 걷기30분 달리기10분 근력운동 10분 이렇게 합니다~~저녁에 10시 퇴근입니다~~그리고 1시간 정도 걸어서 집에와서 근력운동 30분 40분 운동하죠운동 끝나면 12시입니다~~ 그 시간에 머먹으면 안좋게죠? (예 계란 닭가슴살점식은 현미밥 김 시금치 이렇게 먹으면 괜찮을까요?마야에 아침 밥안먹고 운동하면 저녁에 근력운동하게 소용없나요??
1031,키에 대한 성장,/qna/detail.nhn?d1id=7&dirId=70115&docId=298534708,아빠 168 엄마 169나 (중1) 168털은 겨털 조금 났어요. 어느정도 까지 클까요?키크는 운동 방법
1032,영어 발음적어주시면 감사하겠습니다ㅠㅠㅠㅠㅠ The Fosbury Flop: A High Jump Techni,/qna/detail.nhn?d1id=7&dirId=70309&docId=298534697,"영어 발음적어주시면 감사하겠습니다ㅠㅠㅠㅠㅠThe Fosbury Flop: A High Jump Technique배면뛰기: 높이뛰기 기술A high jump consists of three phases: approach, take-off, and flight.높이뛰기는 세 단계로 구성된다. 즉, 도움닫기, 발 구르기, 공중동작이다During approach, the athlete runs toward the bar at a high speed to pick up the necessary force for a strong jump.도움닫기를 하는 중에 선수는 힘찬 점프를 하는 데 필요한 힘을 얻기 위해 빠른 속도로 막대를 향해 달려간다.For take-off, the athlete must overcome gravity by jumping directly upward while pushing against the ground.선수는 발 구르기를 하기 위해 땅을 밀면서 수직으로 위쪽으로 뛰어서 중력을 이겨내야만 한다.→ 「by + -ing」는 ‘~함으로써’라는 뜻, 여기서는 ‘수직으로 위쪽으로 점프함으로써’로 해석. 분사구문으로 주절의 주어인 athlete가 생략 동사 pushes를 분사 pushing으로 바꾼 구조.The greater the force applied to the ground, the greater the force that lifts the athlete.땅에 가해지는 힘이 셀수록 선수를 들어 올리는 힘도 더 세진다.→ 「the + 비교급, the + 비교급」 구문은 ‘~할수록 더욱 ~하다’는 뜻During the last phase, the athlete has to manage the flight so that he or she clears the bar without knocking it off. 마지막 단계에서 선수는 막대기를 쳐서 떨어뜨리지 않고 넘기 위해 공중 동작을 조절해야만 한다.→ 「so that + 주어 + 동사」 구조로 ‘~하기 위해서’로 해석하며, ‘매우 ~해서 ~하다’는 뜻의 「so + 형용사 ／ 부사 + 주어 + 동사」와 구분Dick Fosbury, a native of Portland, Oregon, was fascinated with the sport when he was young.오리건 주의 포틀랜드 출신인 Dick Fosbury는 어렸을 때 높이뛰기에 마음을 빼앗겼다. 그는 성공한 높이뛰기 선수가 되기를 원했다.Fosbury flop –배면뛰기   consist of -~로 구성되다   phase –단계approach –도움닫기   take-off –도약, 발 구르기   flight –공중동작gravity –중력   knock off -~을 쳐서 떨어트리다"
1033,아들이 사구체신염을 10년 동안 앓고 있습니다 최근에는 혈압이 200까지 올라 현재 약을복용하는데요 며칠전부,/qna/detail.nhn?d1id=7&dirId=7010105&docId=298534687,아들이 사구체신염을 10년 동안 앓고 있습니다최근에는 혈압이 200까지 올라 현재 약을복용하는데요며칠전부터 신경을 쓴탓인지 혈뇨가 나온다고합니다불안과걱정이 앞서 한숨만 나옵니다이러다가 악화되는건 아닌지 마음이 너무 아픕니다답변 부탁드립니다
1034,안녕하세요. 생리 시작 하고부터 생식기는 아니지만 아래에 오돌도돌 두드러기처럼 막 뭐가 나고 생활 불편할 만,/qna/detail.nhn?d1id=7&dirId=70402&docId=298534670,안녕하세요. 생리 시작 하고부터 생식기는 아니지만 아래에 오돌도돌 두드러기처럼 막 뭐가 나고 생활 불편할 만큼 간지럽고 따갑기도 해요 ㅠㅠ 며칠 내내 계속 이러는데 생리대 부작용 인가요..? 매번 쓰던 생리대였는데 저번달부터인가 생리하면 오돌도돌 뭐가 나네요 ㅠㅠ 애터미 허브데이 생리대가 화한 느낌이 드는데 약한 피부라 자극이 돼서 그러나요 ㅠㅠ 자주 갈아줘도 씻지 않으면 그대로구요 학교를 다니기 때문에 하루에 한 번 정도밖에 못씻어요 ㅠㅠ
1035,"자다가 갑자기 배가 쿠릉쿠루루르르릉 같은 느낌이 오면서 아프길래 바로 화장실가서 대변을 하려는데 ,,, 배가",/qna/detail.nhn?d1id=7&dirId=7011403&docId=298534660,"자다가 갑자기 배가 쿠릉쿠루루르르릉 같은느낌이 오면서 아프길래 바로 화장실가서대변을 하려는데 ,,, 배가 진짜 생리통과는 다르게아프더라구요 ... 4시간전에 기름많은 닭강정을조금 많이 먹긴 했는데 그것때문인가요 ? ㅠㅠ생리통 말고는 딱히 배아픈적이 없어서 더 놀랬어요ㅠㅠ식은땀 나고 ㅠㅠㅠㅠㅠ 지금은 괜찮은데,,, 닭강정 때문인가요???아니면 뭐 임신초기 증상인가유 ....ㅠㅠ어떻게해야 배가 좋아지나유 ㅠㅠ"
1036,1번. 요세 뇌가 잠시욱씬욱씬거렸다가 멈추는데 이유가있나요? 2번.몇달전에 커터칼로 손가락뼈까지찌른느낌이있었,/qna/detail.nhn?d1id=7&dirId=70107&docId=298534642,1번. 요세 뇌가 잠시욱씬욱씬거렸다가 멈추는데 이유가있나요?2번.몇달전에 커터칼로 손가락뼈까지찌른느낌이있었는데그때이후 손가락접을때마다 뚝뚝소리나던데두렵더군요 이게어떻게되는건아닌가하고제가소심해서 병원가자란말을잘안해서역시병원가봐야겠죠..?
1037,다이어트 식단 봐주세요 . 기상 6시 아침 - (8~9시)우유 1팩 (350ML) 계란2알 점심 -(11시3,/qna/detail.nhn?d1id=7&dirId=70601&docId=298534632,"다이어트 식단 봐주세요 .기상 6시아침 - (8~9시)우유 1팩 (350ML) 계란2알점심 -(11시30분~1시)고구마 반개 닭가슴살 1덩이 (약150g)저녁 - (운동전 6시30분) 고구마 반개 우유 1팩 (350ML)중간중간 공복감을 느낄땐 간식으로 요플레 , 견과류 ,오이 , 고추 ,당근, 방울토마토 정도 먹을생각입니다 다같이 먹는건 아니구요물은 하루 3L이상씩 마셔보려고 합니다 .현재 키 179 몸무게 94 정도 나갑니다이렇게 식단을 짜고 주 4회이상 유산소 가볍게 뛰기 1시간 해볼 생각입니다 ."
1038,발이 간지럽습니다. 제가 발에땀이많습니다ㅜㅜㅜ 어떤증상이고 어떻게 치료할수있을 까요ㅜㅜ,/qna/detail.nhn?d1id=7&dirId=7010106&docId=298534628,발이 간지럽습니다.제가 발에땀이많습니다ㅜㅜㅜ어떤증상이고 어떻게 치료할수있을 까요ㅜㅜ
1039,왼쪽 가슴 아랫부분 아픔,/qna/detail.nhn?d1id=7&dirId=70101&docId=298534576,왼쪽 가슴 아랫부분이 만지면 아프네요 몽우리? 그 밑에 부분이 아픈요.. 오른쪽은 안아픈데 왼쪽만 아파요.. 뭐때문이죠? 그리고 병원을 가면 어느병원을 가야되나요?
1040,다이어트 식단 봐주세요 . 기상 6시 아침 - (8~9시)우유 1팩 (350ML) 계란2알 점심 -(11시3,/qna/detail.nhn?d1id=7&dirId=70601&docId=298534632,"다이어트 식단 봐주세요 .기상 6시아침 - (8~9시)우유 1팩 (350ML) 계란2알점심 -(11시30분~1시)고구마 반개 닭가슴살 1덩이 (약150g)저녁 - (운동전 6시30분) 고구마 반개 우유 1팩 (350ML)중간중간 공복감을 느낄땐 간식으로 요플레 , 견과류 ,오이 , 고추 ,당근, 방울토마토 정도 먹을생각입니다 다같이 먹는건 아니구요물은 하루 3L이상씩 마셔보려고 합니다 .현재 키 179 몸무게 94 정도 나갑니다이렇게 식단을 짜고 주 4회이상 유산소 가볍게 뛰기 1시간 해볼 생각입니다 ."
1041,발이 간지럽습니다. 제가 발에땀이많습니다ㅜㅜㅜ 어떤증상이고 어떻게 치료할수있을 까요ㅜㅜ,/qna/detail.nhn?d1id=7&dirId=7010106&docId=298534628,발이 간지럽습니다.제가 발에땀이많습니다ㅜㅜㅜ어떤증상이고 어떻게 치료할수있을 까요ㅜㅜ
1042,왼쪽 가슴 아랫부분 아픔,/qna/detail.nhn?d1id=7&dirId=70101&docId=298534576,왼쪽 가슴 아랫부분이 만지면 아프네요 몽우리? 그 밑에 부분이 아픈요.. 오른쪽은 안아픈데 왼쪽만 아파요.. 뭐때문이죠? 그리고 병원을 가면 어느병원을 가야되나요?
1043,안녕하세요 치아교정중인데 의사선생님이 갑자기 앞니 를 벌린다고하시더라고요 일부로 땡기시는데 왜그러는거에요?,/qna/detail.nhn?d1id=7&dirId=70201&docId=298534573,안녕하세요 치아교정중인데 의사선생님이 갑자기 앞니 를 벌린다고하시더라고요 일부로 땡기시는데 왜그러는거에요? 앞니 벌어지면 안돼지안나요?
1044,감기약을 먹으면 혀가 꼬이나요? 아까 낮아 감기약을 먹었는데 지금 졸립진 않고 자꾸 말을 심하게 더듬네요..,/qna/detail.nhn?d1id=7&dirId=7010101&docId=298534520,감기약을 먹으면 혀가 꼬이나요?아까 낮아 감기약을 먹었는데 지금 졸립진 않고 자꾸 말을 심하게 더듬네요..말하는데 단어가 생각이 안나기도 하고 혀가 맘대로 안움직이는? 그런느낌이 들어요평소에도 이러긴 한데 오늘따라 심한것같네요..
1045,얼라이브 데일리 맨 울트라 포텐시 멀티+징크 골드 아이즈 포 비주얼 펑션 루테인 20mg 동시복용 괜찮나요?,/qna/detail.nhn?d1id=7&dirId=70403&docId=298534518,Natures Way 얼라이브! 원스 데일리 맨 울트라 포텐시 멀티-비타민 타블렛+Nature's Way 징크 골드 아이즈 포 비주얼 펑션 루테인 20mg같이복용하려고 하는데요사무적인일을 많이해서비타민  챙기고 루테인 영양제도 같이 챙기려는데멀티비타민 타블렛에 루테인도 함량되있는걸로 아는데하나만 복용하는게 맞나요?참그리고 복용은 멀티비타민 1개 복용 이고 루테인은 2알씩인가요?(아침저녁?한번에2알?)궁금합니다..효과적인면에서는 멀티비타민 얼라이브제품이 좋다고해서 가격대비 한번 먹어보려고 합니다.
1046,Msm nag SAM-e 보스웰리아 질문,/qna/detail.nhn?d1id=7&dirId=70403&docId=298534498,Msm nag SAM-e 보스웰리아 이렇게 네 개가관절 연골에 좋다는데요저 4개를 다 먹는건 오바겠죠??저 4개 중에 하나만 먹는게 좋나요??
1047,로아큐탄을 처방받앗습니다!! 근데 하루 한알씩 복용하라해서 2달동안 60알정도 먹엇는데 크게 효과는 못본거같,/qna/detail.nhn?d1id=7&dirId=70111&docId=298534493,로아큐탄을 처방받앗습니다!! 근데 하루 한알씩 복용하라해서 2달동안 60알정도 먹엇는데 크게 효과는 못본거같아요.. 혹시 하루 2알복용해도 괜찮을까요? 입술이 마르거나 다른 부작용은 전혀없는상황입니다.. 다른 후기들 보니까 막 2~3알씩 드신다해서..2알씩 복용해도 되는건가요??
1048,저 의무기록사에대해 질문좀하려고요,/qna/detail.nhn?d1id=7&dirId=710&docId=298534454,저의 꿈이 의무기록사인데 혹시 의무기록사들이 하는일들을 구체적으로 적어주세요 내공은 100입니다하는일들 리스트를 적어주시면 감사드리겠습니다.
1049,왜 이러죠..?,/qna/detail.nhn?d1id=7&dirId=70109&docId=298534395,안녕하세요. 중2입니다.요즘따라 계속 하루종일 슬프고 이유도 모르겠는데 갑자기 눈물이 나오고 눈물이 나오면 계속 나오고 그러다 괜찮아졌다가 다시 또 슬퍼지고 계속 반복돼요.. 왼쪽 가슴이 너무 찟겨지는 것처럼 아프고 마음이 콱 막힌것처럼 너무 답답해요. 내 자신이 너무 쓸모없는것 같고 옛날에 엄마가 했던 말이 계속 떠오르고 그거만 생각하면 계속 눈물이 나고 너무 미안해요.그리고 온몸에 힘이 빠져서 서있다가도 힘이 빠져서 넘어질 뻔한적도 많고 발목이 걷다가 힘빠져 옆으로 꺽일뻔한 적도 많고 핸드폰 하고 있다 손에 힘 빠져서 떨어질때도 많고 배도 두통도 너무 심해요. 입맛도 없고 토할것 같은 기분이 들고. 그러다 새벽에 폭식하게 되고. 잠도 요즘에 안와요 눈을 감으면 눈물이 나와서 울게되고 코가 막혀 잠을 못자요. 그래서 3일내내 진짜로 36시간동안 6시간만 잤어요..정신차려보면 울고있고 왜 우는지 모르겠는데 뭔가 울고 있어여 할것 같고 맘과 다르게 계속 울게 되고. 제가 유학중인데. 가족이 너무 보고싶고 너무 외로워요. 예전에도 이랬는데 방학동안 부모님봐서 괜찮아졌는데 다시 방학 끝나고 돌아오니까 더 아프고 외로워요.무슨 증상인가요....?
1050,보조 답변바랍니다.,/qna/detail.nhn?d1id=7&dirId=70701&docId=298534362,만약에 벤치 30kg를 보조를 받으면 30kg만큼의 자극이 가슴에 오게 되는건가요?아니면 보조를 받았으니 30kg만큼의 자극을 느끼기는 힘든가요
1051,자꾸 뭐가나요 몸 아무곳에나 가끔 나는데 엄청 간지럽고 붉은색 점인대 오돌토돌해요 ㅜㅜ 알레르기는 아닌거같고,/qna/detail.nhn?d1id=7&dirId=70111&docId=298534352,자꾸 뭐가나요몸 아무곳에나 가끔 나는데엄청 간지럽고 붉은색 점인대 오돌토돌해요 ㅜㅜ알레르기는 아닌거같고.. 아토피인거같나요?아니면 뭐에 물린건가요..번지는거같진않고 몸에 여러군데 다닥다닥나타나요
1052,"발바닥에 이런게 생겼는데,, 누르면 아프고요 티눈인가요? 티눈이면 티눈액으로 제거 할 수 있을까요?",/qna/detail.nhn?d1id=7&dirId=70111&docId=298534291,"발바닥에 이런게 생겼는데,, 누르면 아프고요 티눈인가요? 티눈이면 티눈액으로 제거 할 수 있을까요?"
1053,제가 노래방을 자주다녔었는데 예전에 되던 고음이 지금은 목이 갈라지고 음이탈하고 그러네요... 갑자기 감기처,/qna/detail.nhn?d1id=7&dirId=70118&docId=298534271,제가 노래방을 자주다녔었는데 예전에 되던 고음이 지금은 목이 갈라지고 음이탈하고 그러네요... 갑자기 감기처럼 목한번 이상해지더니 그래요.. 왜그러죠 다시 안돌아가나요...? 성의답변 부탁드려요 ㅠㅠㅠㅠ
1054,"새끼냥이가 오늘 태어났는데 첫 배변이 언제까지 이루어져야하나요? 하루, 이틀 .. .,답변부탁드릴께요",/qna/detail.nhn?d1id=7&dirId=70113&docId=298534240,"새끼냥이가 오늘 태어났는데 첫 배변이 언제까지 이루어져야하나요? 하루, 이틀 .. .,답변부탁드릴께요"
