,0,1,2
1428,눈동자크기가 짝짝이 입니다 ... 오른쪽눈이 더큰데 눈동자도 오른쪽이 더 큽니다 ...하 ..스트레스받아요,/qna/detail.nhn?d1id=7&dirId=70112&docId=298526849,눈동자크기가 짝짝이 입니다 ... 오른쪽눈이 더큰데 눈동자도 오른쪽이 더 큽니다 ...하 ..스트레스받아요 ㅠㅠㅠㅠ
1429,티눈인가요 사마귄가요..?,/qna/detail.nhn?d1id=7&dirId=70307&docId=298526842,티눈인가요 사마귄가요..?
1430,입안에 이상한것들이 났는데 뭔지좀 알려주세요....,/qna/detail.nhn?d1id=7&dirId=70204&docId=298526825,입안에 이상한것들이 났는데 뭔지좀 알려주세요....
1431,술에만취하거나 수면제 먹으면 생명이 위험해도 못깨어나나요?,/qna/detail.nhn?d1id=7&dirId=70401&docId=298526807,"술에만취해본적이있어서 어떤느낌인지알긴아는데아무리그래도 죽음에 위기 ( 불이나서 피부에 붙었다거나 , 연기에 질식한다거나 )이런때에도 못일어나나요? 아무리 깊숙히 잠들어도 일정 고통이 생기면 일어나는거아닌가요?궁금해요"
1432,뛰는 것이 힘든데 그에대한 좋은 방법 좀 알려주세요.,/qna/detail.nhn?d1id=7&dirId=70105&docId=298526801,요즘 학교에서 많이 먹어서 그런지 조금만 뛰어도 심장이 엄청 뛰고 다리가 아프고 그떈 머리가 어지러웠습니다. 이런 거 없앨만한 좋은 방법 좀 알려주세요. (내공50)
1433,눈 앞이 번쩍이며 보이지 않아요 10년 정도 됬는데 일년에 한두차례만 왔어서 신경 않썼었는데 요즘은 종종 이,/qna/detail.nhn?d1id=7&dirId=70108&docId=298526798,"눈 앞이 번쩍이며 보이지 않아요10년 정도 됬는데 일년에 한두차례만 왔어서 신경 않썼었는데요즘은 종종 이렇게 됩니다증상이1. 눈 앞이 반짝이며 안보이고2. 방치하면 뒷목이 땡기며 두통도 옵니다3. 더 시간이 흐르면 머리가 굳어요..바보가 된달까멍하기도 하면서 보고 듣는걸 인지가 안됩니다(10년친구를 보면서 이름을 기억못한다던지..들어도 ""그게 뭐지?"" 이리되요..)어디에 문제가 있는걸까요 검사를 받아보려면무슨 과를 가야할까요 .. 예전에 신경쪽으로 검사해봤을땐의사가 모르겠다고 하더군요..직장인 건강검진에서는 빈혈이나 혈압은 정상에 가깝게 나왔습니다( 근데 빈혈이 있긴 해요 혈압도 낮은거 같고)증상나타나면 밥먹고 잠을 잡니다.. 자고 일어나면 다시 괜찮아요.. (주위에선 영양이부족해서 그런거라고 하는데 진짜 좀 먹으면 괜찮아 지긴해요..) 정말.. 일하다가, 운전하다가 증상 나타날까 겁이 납니다"
1434,펀치력 근육,/qna/detail.nhn?d1id=7&dirId=70701&docId=298526787,"복근,.외복사근.삼각근.광배근.삼두근.전완근.종아리.허벅지 근육만있어도 펀치력은 쎄나요?그리고 이두근은 뭔 역할하나요"
1435,신경계와 호르몬의 차이는 무엇인가요?,/qna/detail.nhn?d1id=7&dirId=708&docId=298526778,신경계와 호르몬의 차이는 무엇인가요?
1436,세균성 전립선염 완치,/qna/detail.nhn?d1id=7&dirId=70113&docId=298526770,세균성 전립선염에 걸려서 비뇨기과 방문후 pcr 검사받고발견된 균에맞게 항생제를 약 2달간 복용후다시 검사를진행해 완치 판정을 받았습니다.그럼 100% 균이 없어진게 맞는거죠?인터넷글들보니 재발이다 뭐다 말이 많아서 질문드립니다.
1437,인바디 검사를 했는데..,/qna/detail.nhn?d1id=7&dirId=70701&docId=298526736,제가 헬스장에서 인바디를 했는데 키 175 몸무게 62.5 나이 24 남자인데근육량 51kg정도 체지방(률?) 12kg정도 복부지방? 1kg인가 이렇게 나오고 저지방근육형이라는데 괜찮은 수치인가요?몸무게 표준이 67키로라서 몸무게 5키로더 늘리는게 목표인데 꾸준히 계속 운동하면 근육량이 더 많아지고 체지방은 더 낮아지겠죠?그리고 제 기준에서 근육량이 어느정도 더 나와야 이상적인지 알려주세요.
1438,아기를 바라는데... 임신이 쉽게 안되네여 ㅠ 왜죠?,/qna/detail.nhn?d1id=7&dirId=7011401&docId=298526705,아기를 바라는데... 임신이 쉽게 안되네여 ㅠ하트가 질내사정이구요 ㅠ 그래도 요번달은 될줄알았는데 안됬네요왜죠?
1439,임플란트 후 통증문의,/qna/detail.nhn?d1id=7&dirId=70202&docId=298526646,임플란트를 한 지 만 5년째입니다아랫니 어금니구요 양쪽입니다만 유독 한쪽이 아픕니다1년전 엑스레이 사진에는 괜찮았거든요참고로 30대입니다그런데 요즘 임플란트 밑 턱뼈에 간헐적으로 통증이오고특히 옆으로 눕거나 그쪽으로 데이면 통증이 오는데임플란트가 흔들리거나 냄새나는건 없습니다정상인건가요? 가끔 통증이 올 수도 있는건가요?
1440,목감기 빨리낫게 하는법,/qna/detail.nhn?d1id=7&dirId=70102&docId=298526635,다음주 토요일에 합창대회가 있는한여학생입니다.합창대회를 앞두고매우열심히 연습을했는데요결과 = 목감기에 걸려버렸네요ㅜㅜ이번주 토요일에 연습이 또있어요ㅜ지금 목이너무 아픈데..ㅠ또 목이 쉬었거든뇨그래서말인데요1.어떻게하면 금방나을까요?2.가래를 없애는방법은없나요?3.한 5일 내에 목이 쉰게 없어질수있을까요?어떤방법으로해야 가장빨리낫나요?내공 150겁니댜 ㅠ 빨리..ㅜㅜ답변해주세요ㅠㅠㅠ
1441,요새 가래가 너무 많이 생깁니다. 외출은 안 하구요 원래 알레르기 비염이 있기는 합니다 평소에는 신경쓰일 정,/qna/detail.nhn?d1id=7&dirId=7010101&docId=298526605,요새 가래가 너무 많이 생깁니다.외출은 안 하구요 원래 알레르기 비염이 있기는 합니다평소에는 신경쓰일 정도는 아니어서 큰 상관은 없지만 밤에 유독 나옵니다. 전에는 안 이랬구요최근에 몸무게도 몇 달 사이에 6키로가 이유 없이 빠졌는데 관련이 있을까요
1442,아버지께서 장기요양 1등급 판정을 받으시고 용구 및 재가 서비스를 받으시던 중 위급상태로 병원에 입원하고 계,/qna/detail.nhn?d1id=7&dirId=70120&docId=298526587,아버지께서 장기요양 1등급 판정을 받으시고용구 및 재가 서비스를 받으시던 중위급상태로 병원에 입원하고 계십니다.요양병원이 아닌 시립의료원입니다.그럼에도 치료비가 만만치 않습니다.해서 등급인정서로 병원치료비 혜택은받을수 없는지 문의드립니다.받을수있는 혜택이 있다면 어느부분 받을수 있을까요?
1443,귀가 찢어질듯이 아파요ㅠ 합기도에서 부터 아팠는데요 감기걸려서 약을 먹고있구요 귀가 진짜 아프고 먹먹해요ㅠ,/qna/detail.nhn?d1id=7&dirId=70102&docId=298526585,귀가 찢어질듯이 아파요ㅠ 합기도에서 부터 아팠는데요 감기걸려서 약을 먹고있구요 귀가 진짜 아프고 먹먹해요ㅠ 엄마한테 말해서 진통제를 먹긴했어요 ㅠ 어쩌죠?중이염인가요?? 귀가 찢어질듯이 아파요ㅠ 심하면 수술해야하나요? 빠른답변 해주세요!
1444,머리를감아도 머리끝쪽에 자꾸 떡이져요ㅠㅠ 원래샴푸랑 트리트먼트?랑 에센스를바르는데 전엔괜찮다가 갑자기 말라도,/qna/detail.nhn?d1id=7&dirId=70111&docId=298526565,머리를감아도 머리끝쪽에 자꾸 떡이져요ㅠㅠ원래샴푸랑 트리트먼트?랑 에센스를바르는데 전엔괜찮다가 갑자기 말라도 정수리쪽은괜찮은데 머리끝쪽에 기름이지더라구여 그래서 샴푸랑 에센스만발랐는데도 떡이 지고요 샴푸를바꾸고 컨디셔너랑 에센즈조금발랐는데도 떡이지고요 어떻해해야하져ㅠㅠㅠ
1445,"임산부 임당 확정인데, 궁금한 점이 있습니다.",/qna/detail.nhn?d1id=7&dirId=7010106&docId=298526551,"저의 와이프가 임산부 인데, 임당 검사를 하고재검이 떠서 다시 검사를 하였는데,임당확정을 받았습니다.그래서 자가 혈당 측정을 매일 4회 해야되는데,저희 와이프가 하루에 거의 두끼 정도 밖에 안 먹습니다.그런데 자가 혈당 측정을 하기 위해서는 하루에 세끼를 다 먹어야 되는 건가요?하루에 두 끼만 먹고 자가 측정을 해도 되는 건지,,,알고 싶습니다.꼭 정확한 답변을 듣고 싶습니다."
1446,"평소 오래 서있으면 식은땀이 나면서 쓰러질 것 같고, 어지럼증을 자주 느끼고 잘 피곤해지는 경향이 있어서 저",/qna/detail.nhn?d1id=7&dirId=7010103&docId=298526519,"평소 오래 서있으면 식은땀이 나면서 쓰러질 것 같고, 어지럼증을 자주 느끼고 잘 피곤해지는 경향이 있어서 저혈압이나 빈혈이 있을 것 같다는 생각을 종종 했어요병원 갈 일이 없어서 딱히 검사받을 생각은 못하고 있었는데..얼마 전 헌혈하러 갔을때 간이혈압계로 혈압을 재봤는데처음엔 최고혈압 130 최저혈압 52가 나왔어요 이상해서 두세번 더 측정해봤는데 110/63 100/58 이렇게 나왔거든요.. 원래 120/80정도가 정상인걸로 알고있는데ㅠ근데 그날 빈혈수치 좋다고 400ml 헌혈함 ㅠㅠ 수치상으로는 저혈압이 맞는건지 궁금해서 질문합니다.."
1447,가슴팍부분에 뭐가 났어요,/qna/detail.nhn?d1id=7&dirId=70111&docId=298526515,가슴팍 부분에 이런게 한 6~7개씩 났어요ㅠㅠ이게 도대체 뭐예요?
1448,살 찌우는 방법 쉽게 살 찌는 법 알려주세요 키187에 몸무게72인데 보충제먹는거 빼구 살 찌는 음식이나 노,/qna/detail.nhn?d1id=7&dirId=70403&docId=298526510,살 찌우는 방법쉽게 살 찌는 법 알려주세요키187에 몸무게72인데보충제먹는거 빼구 살 찌는 음식이나 노하우좀요내공 100
1449,헬스초보 질문입니다. 키175 cm 몸무게 67kg 인대 상체하체는말랏는대 배랑 얼굴 목에만 살이쪗고요 .,/qna/detail.nhn?d1id=7&dirId=707&docId=298526509,헬스초보 질문입니다.키175 cm 몸무게 67kg 인대 상체하체는말랏는대 배랑 얼굴 목에만 살이쪗고요 .1.상체근육과 하체근육을키우고 살을 찌우면서 얼굴살과 뱃살을 빼고싶은대 가능한가요.???2.올챙이배라 다른곳은 다말랏고요. 근력도없어 벤치프레스도 봉으로만 듭니다. 그거조차도힘든대 그렇게계속하면 근력도키워지면서 중량도올릴수잇나요?3.제가 아침에 삶은달걀 2개 단백질스테이크 1개 점심은 일반식사 저녁은 운동전 삶은달걀 2개 단백질스테이크 운동후 단백질보충제 이렇게먹고있는대 탄수화물을 더늘려야하나요? 식단이궁금합니다 ㅠ 얼굴 살은 안찌면서 ㅠ 답변 부탁좀드립니다.
1450,펄스그립 질문,/qna/detail.nhn?d1id=7&dirId=70701&docId=298526483,지금 풀업을 5개정도밖에 못하는데요 링에서 펄스그립 훈련을 하면 일반풀업 갯수도 늘어날까요??
1451,비문증이 좀 있는데요 망막박리 라는 병이 비문증이 잇으면 무조건 걸리는 병인가요!? 아직 고딩이고 어무 무서,/qna/detail.nhn?d1id=7&dirId=70112&docId=298526474,비문증이 좀 있는데요망막박리 라는 병이 비문증이 잇으면 무조건 걸리는 병인가요!?아직 고딩이고 어무 무서워요 ㅠㅠㅠㅠㅠㅠㅠㅠ
1452,생리를 할때 원래 덩어리가 나오긴했는데 이번에는 생리혈 덩어리가 너무 많이나오네요.. 생리혈 덩어리는 왜나오,/qna/detail.nhn?d1id=7&dirId=7011404&docId=298526459,생리를 할때 원래 덩어리가 나오긴했는데이번에는 생리가 나오는게 아니라 생리혈 덩어리가 계속나오네요생리혈 덩어리는 왜나오는건가요?
1453,라식 했는데 게임같은거 티비많이 보면 또 나빠 지나요?,/qna/detail.nhn?d1id=7&dirId=70112&docId=298526455,라식 했는데 게임같은거 티비많이 보면 또 나빠 지나요?
1454,사후피임약 질문이요. 제가 남친이랑 관계하다가 남친이 조금 질내서정 했거든요. 그래서 바로 병원가서 사후피임,/qna/detail.nhn?d1id=7&dirId=7011401&docId=298526413,사후피임약 질문이요. 제가 남친이랑 관계하다가 남친이 조금 질내사정 했거든요. 그래서 바로 병원가서 사후피임약 먹었는데 질문이요1. 부작용이 얼마나 며칠정도 일어나나요2.불안해서 임테기 써볼려는데 2주 뒤에 써야하나요
1455,곤지름 치료후 운동 언제부터 가능한가요 병변이 심해서 수술한지 12일되고 또 몇개 재발해서 오늘 레이저시술,/qna/detail.nhn?d1id=7&dirId=70104&docId=298526407,곤지름 치료후 운동 언제부터 가능한가요병변이 심해서 수술한지 12일되고 또 몇개 재발해서 오늘 레이저시술 받았습니다.계속 재발해서 스트레스 너무 받네요답변들 보니까 꾸준한 운동하라는데 내일 당장 개천 걸어도 되나요?또 번질까봐 무서운데 운동 안한지 오래되서 답답하고먹고 눕기만하니까 살만 쪄서 스트레스 받네요레이저 시술하고 뛰거나 복근운동 하체운동 가능한지요..자세한 답변 부탁드려요ㅜㅜㅜㅠ
1456,안녕하세요 결혼을하고 2년이 되어가고있습니다 전 20대 후반에 성경험 을 해보았고 그때 조루진단을 받아 배부,/qna/detail.nhn?d1id=7&dirId=70113&docId=298526398,안녕하세요 결혼을하고 2년이 되어가고있습니다 전 20대 후반에 성경험 을 해보았고 그때 조루진단을 받아 배부신경차단술을 받았습니다 그때도 성기에 아무런 감각을 느끼지 못해 후회감과 억울함을 느끼고 살고 있습니다 하지만 이제는 어엿한 와이프도 있고 성생활도 하고있습니다 와이프는 수술한 사실을 모릅니다 전 부부 관계를 해도 쾌감이나 재미를 못느끼고 있습니다 어떻게 해야 관계도 재밌고 즐거운 성생활을 할수 있을까요? 관계말고 다른행위에 촛점을 맞춰야 하나요 좋은 답변 부탁합니다
1457,방사선 계측학 풀이와 답좀 부탁드릴께요,/qna/detail.nhn?d1id=7&dirId=70118&docId=298526366,방사선 계측학풀이와 답좀 부탁드릴께요
1458,젤방향제(고체) 성분에 향료가 있는데 직접 몸에 닿지않아도 공기를 통한 흡입으로 큰 문제가 될 수 있나요?,/qna/detail.nhn?d1id=7&dirId=710&docId=298526356,"젤방향제(고체) 성분에 향료가 있는데직접 몸에 닿지않아도 공기를 통한 흡입으로큰 문제가 될 수 있나요? 몸에 많이 해로울까요?아니면 영향이 아예 없을 순 없나요?(성분: 정제수,향료 외 )이렇게 적혀있습니다~"
1459,부천대 뷰티융합비지니스과에 갈려면 뭘준비해야하죠 참고로 지금고3인데 작년까진출결안좋았어요 지금은 좋습니다,/qna/detail.nhn?d1id=7&dirId=703&docId=298526340,부천대 뷰티융합비지니스과에 갈려면 뭘준비해야하죠참고로 지금고3인데 작년까진출결안좋았어요 지금은 좋습니다
1460,전주 비전대학교 간호학과 2018년 수시 평균 알 수 있을까요?,/qna/detail.nhn?d1id=7&dirId=70303&docId=298526330,전주 비전대학교 간호학과 2018년 수시 평균 알 수 있을까요?
1461,어제(1일) 밤10시에 피임약을 먹고 얼마뒤에 토를 했어요 그때는 생각을 못하고있다가 오늘 피임약 먹을때 생,/qna/detail.nhn?d1id=7&dirId=7011403&docId=298526324,어제(1일) 밤10시에 피임약을 먹고 얼마뒤에 토를 했어요그때는 생각을 못하고있다가 오늘 피임약 먹을때 생각이났어요... 피임약 먹고 토를 할 경우 재복용을 해야한다고 하는데 저 어떻게 해야하나요ㅠㅠ?
1462,생리주기가 짧아졌어요..,/qna/detail.nhn?d1id=7&dirId=7011403&docId=298526322,두달째 생리주기가 짧습니다.늘 5일씩은 했었는데 한달전이랑 이번달 생리가 2일도 안갑니다.병원에 꼭 가야하는지 궁금해요.두달째 새벽 3~5시에 잠들고 취업스트레스가 너무심해서 그런건지.. 몸의 변화인지 알고싶어요.
1463,다이어트중 채소섭취,/qna/detail.nhn?d1id=7&dirId=70601&docId=298526309,보통 다이어트 식단들 보면 샐러드가 기본적으로 들어가는데생채소로 섭취하는 식이섬유를 바나나나 사과 같은 과일로 섭취할수는 없나요?
1464,2달?3달전쯤 피부과에가서 여드름압출과 그부위에 주사를 맞앗습니다..근데 그뒤로 오른쪽볼부위에 검은색피멍같이,/qna/detail.nhn?d1id=7&dirId=70122&docId=298526297,2달?3달전쯤 피부과에가서 여드름압출과 그부위에 주사를 맞앗습니다..근데 그뒤로 오른쪽볼부위에 검은색피멍같이 피부안쪽에생겨서 없어지지않습니다..피부과에서는 곧없어지니깐 괜찮다고하는데 자세히보면 움푹파여들어갓습니다..피부하나는자신잇는편이엇는데..피부과실수인가요?돈 주고 피부과 갓더니 없던 검은색멍이랑 조그만패임..까지..한번도이런적없엇는데..어쩌죠..
1465,숨쉬기가 힘들고 답답해요 숨을 쉴려면 크게 들이마셔야 하는데 그걸 계속 해줘야 숨쉬기 답답하지가 않는데 좀,/qna/detail.nhn?d1id=7&dirId=7010101&docId=298526271,숨쉬기가 힘들고 답답해요숨을 쉴려면 크게 들이마셔야 하는데 그걸 계속 해줘야 숨쉬기 답답하지가 않는데 좀 불편해요..어떡해야하죠..ㅜㅜ
1466,영어프리토킹,/qna/detail.nhn?d1id=7&dirId=70111&docId=298526270,한국에 온지 얼마나 됫나요?부산말고 자른지역 여행할 계획잇나요?얼마나 잇다 가나요어느분이서비스빋으실건가요영어로 통역부탁드립니다
1467,잘 때 심장 압박하는 느낌 뭔가요?,/qna/detail.nhn?d1id=7&dirId=70108&docId=298526269,22살 여자입니다 심장에 무슨 이상은 없는 것 같은데 꼭 잘 때 2~7일에 한 번씩 가위눌리 듯 심장에 압박감이 느껴지고 숨을 쉴 수 없을 때가 있어요 그 느낌이 한 번 들기 시작하면 잘 때 내내 그러니까 스트레스 받습니다ㅠㅠ 특히 잠이 들락말락 하는 렘 수면상태일 때 자주 그래요 숨을 쉬지 못 하고 몸도 못 움직이고 심장이 아프게 뛰고... 의식은 있고 눈도 게슴츠레하게 떠지는데 눈동자도 굴릴 수 없는 상태입니다 몸을 움직여야한다는 생각을 강하게 하는데... 깨고 나면 진짜 지칩니다 마치 물 속에 잠기는 기분이에요가위도 경험해봤으니 그게 가위와는 별개의 느낌이라는 건 알고있습니다 평소 생활하는데에는 지장이 전혀없어서(조금 피곤한 것 외에는) 수면 도중에만 그러니 신체에 이상이 있는 건 아닌 것 같은데 왜 이럴까요...잘 때 자세는 정자세로 똑바로 누워 잡니다 카페인 전혀 안 좋아하고 성장기 한참 지난 성인입니다 도와주세요ㅠㅠㅠ 개운하게 자고싶습니다ㅠㅠ
1468,진짜 코 때문에 너무 힘듬니다ㅠㅠ복코라서 콧볼이 정말 커서 수술을 하지않으면 안될것같은 코에요 .. 그래서,/qna/detail.nhn?d1id=7&dirId=70110&docId=298526221,진짜 코 때문에 너무 힘듬니다ㅠㅠ복코라서 콧볼이 정말 커서 수술을 하지않으면 안될것같은 코에요 ..그래서 인터넷으로 찾아봤는데 중학생이라서 아직 성장이 안끝나서 뼈에 손 대면 나중에 부작용이 온다고 모두 그러시더라고요근데 저는 콧대는 바라지도 않고요ㅠㅠ정말로 콧볼만 줄여들었으면 소원이 없어요ㅠㅠㅠㅠㅠㅠ친구들도 저한테 코가 크다고 해서 스트레스가 너무 받고 자존감이 너무 낮아요 ..그리고 제가 입술이 얇고 작도 하니까 코가 더 커보이는것 같아요 ..저 지금 콧볼만 줄일수있나요 ??ㅠ
1469,허리디스크 질문입니다.,/qna/detail.nhn?d1id=7&dirId=70107&docId=298526177,"허리디스크 질문입니다.제가 약 1년전에 허리가 너무 아프고 허벅지쪽과 엉덩이쪽이 저려서 병원에가서 X레이를 찍으니 허리가 많이 휘었더라구요. 신경주사 치료받으라해서 신경주사도 맞았습니다. 좀 지나니까 허리통증은 사라졌는데 아직까지 자고 일어난 후에 허벅지, 엉덩이쪽이 찌릿거리면서 저립니다. 걸어다닐도, 허리를 숙일때도요.엄청 아픈건아니고 그냥 기분나쁘게 찌릿거리는데 이정도 증상이면 허리디스크 중에 얼마나 심각한건가요??"
1470,눈위에 뭐가났어요. 빨간색으로 동그라미 친곳에요... 뾰루지일까요 뭘까요..ㅜㅜ 중3때 피부에 혹이나서 수술,/qna/detail.nhn?d1id=7&dirId=70111&docId=298526169,눈위에 뭐가났어요.빨간색으로 동그라미 친곳에요... 뾰루지일까요 뭘까요..ㅜㅜ 중3때 피부에 혹이나서 수술한기억이있는데 그런걸까요?
1471,자기자신을 지기로 생각하지못하는 증후군 이름이무엇인가요??? 알고있었는대 기억이안나내요,/qna/detail.nhn?d1id=7&dirId=708&docId=298526126,자기자신을 지기로 생각하지못하는증후군 이름이무엇인가요???알고있었는대 기억이안나내요
1472,만성신부전증후 남은 시간,/qna/detail.nhn?d1id=7&dirId=7010105&docId=298526102,나이가 60대 여성입니다. 만성신부전증 판단을 받고 얼마지나지않아 급격히 몸이 안좋아져 투석을 받고있습니다.무기력하여 움직이거나 말할수 없을 정도에 투석이 쫌 늦어져서인지 다른 장기들도 대부분 기능을 잃었다고 해요.병원에서도 다른 수술은 못하고 투석만을 하고있습니다. 정확하게는 못들었지만 제 느낌으로는 시간이 얼마남지 않을걸로 아는데.. 이정도 상태면 시간이 어느정도 남았을까요..? 앞으로 얼마나 더 살아계실지..
1473,고래회충 뇌,/qna/detail.nhn?d1id=7&dirId=701&docId=298526092,고래회충이 뇌로도 가나요?
1474,제가 2~3년전에 코가 골절됫엇는데 모르고 그냥 냅둿다가 지금 왼쪽중간코뼈가 튀어나왓어요 그래서 이제 코골절,/qna/detail.nhn?d1id=7&dirId=70103&docId=298526091,제가 2~3년전에 코가 골절됫엇는데 모르고 그냥 냅둿다가 지금 왼쪽중간코뼈가 튀어나왓어요 그래서 이제 코골절수술할려고 하는데 혹시 실리콘이나 보형물같은거 써서 수술해야하나요?
1475,mri사진촬영,/qna/detail.nhn?d1id=7&dirId=70118&docId=298526060,어머니가 파킨슨 초기증상으로 mri를 찍으셔야하는데 여의도 성모병원는 좀 비싸더라고요저렴한 다른 병원에서 찍는후 판독사진를 가지고진료받으려는 병원으로 가도되나요?진료받으려면 꼭 해당 진료받는병원에서mri를 찍어야하나요?내공20드려요
1476,사랑니가 160도정도 뒤집혀서 나는 사람도 있나요? 2년전쯤 치과에서 x-ray를 찍었었는데 사랑니가 완전,/qna/detail.nhn?d1id=7&dirId=70205&docId=298526025,사랑니가 160도정도 뒤집혀서 나는 사람도 있나요?2년전쯤 치과에서 x-ray를 찍었었는데 사랑니가 완전 거꾸로 뒤집어져있었어요 의사선생님이 아직안빼도 된다고해서 안뺐는데 요즘 사랑니가 나고있느느낌이드는데요 근데 문제는 옆으로 누운것도아니고 2년전에본 엑스레이에서처럼 완전 뒤집혀서 아래잇몸 아래로 나는것같은데 이게 가능한가요? 인터넷에 검색해봐도 옆으로 누워있는사람밖에없는것같은데 ㅠㅠ
1477,실수로 이쑤시개로 잇몸을 약간 뚫었(?)는데 그 속에 치아가 하나 더 있어요. 참고로 저는 초6입니다..!,/qna/detail.nhn?d1id=7&dirId=70204&docId=298526021,실수로 이쑤시개로 잇몸을 약간 뚫었(?)는데 그 속에 치아가 하나 더 있어요. 참고로 저는 초6입니다..! 근데 가 이(?)에 검은색이 잇는데 충치인지요... 그리고 잇몸 아래에 있는건 이가 맞는지... 하여튼 이게 뭔지 알려주세요! 부탁드립니다 ㅠㅠ
1478,"징그러운 사진이나 장면을 봤을 때, 머리 우측부분이 찌릿찌릿하고 간질간질한 증상이 있습니다. 예를 들면 벌레",/qna/detail.nhn?d1id=7&dirId=70111&docId=298526002,"징그러운 사진이나 장면을 봤을 때, 머리 우측부분이 찌릿찌릿하고 간질간질한 증상이 있습니다. 예를 들면 벌레, 또는 피부에 수포가 포진된 사진 같은거요..항상 같은 부위에 자극이 있으며, 정확히 언제부터 이런 증상이 시작되었는지는 모르겠지만, 증상이 있다는 것을 인지하게 된지 1년정도 된 듯 합니다.자연스러운 현상인지 치료가 필요한지 알고싶습니다."
1479,구의동 헬스장,/qna/detail.nhn?d1id=7&dirId=70701&docId=298525985,구의동(강변역쪽이 더 가까움) 사는데 괜찮은 헬스장 추천 좀 부탁드려요.가격 저렴한 곳 보다 기구 많고 시설 좋은곳으로 알려주세요.헬스장이 너무 많네요~
