,0,1,2
520,닌텐도 스위치에서 프리파라 올 아이돌 퍼펙트 스테이지가 된다고 했는데 그럼 프리티 리듬&프리파라 프리파라에서,/qna/detail.nhn?d1id=8&dirId=807&docId=298546424,닌텐도 스위치에서프리파라 올 아이돌 퍼펙트 스테이지가 된다고 했는데그럼프리티 리듬&프리파라 프리파라에서 쓸수있는아이템 1450! ??암튼 그거랑 아이카츠 그 Nintendo 3DS 아이카츠 My No.1 Stage 도 스위치로 할수있나요??
521,CJ대한통운인데 오늘 도착할 가능성이 있는지 궁금합니다.,/qna/detail.nhn?d1id=8&dirId=81302&docId=298546422,위치는 대전으로 오후에 갑자기 집을 비워야할 사정이 생겨서 그런데 오늘 도착할 가능성이 지금이라도 있나요? 도척2CP는 경기도에 있더군요. 현재 대학교 옆 원룸에서 거주 중이라 경비실이 따로 없거든요. 저번에 현관문 앞에 두고 가랬더니 없어진 경험이 있습니다 --;현재 대전A에 있는 택배는 그리 중요치 않은 물건이라 없어져도 상관없는데 도척에 있는 택배는 중요합니다.
522,얼굴에 스킨로션 바를 때 일어나는 피지 및 잔털 원인,/qna/detail.nhn?d1id=8&dirId=8030101&docId=298546400,"20대 남자입니다샤워를 하고 수건으로 물기를 좀 닦아내고얼굴에 스킨로션을 바르는데그 과정에서 피부 잔털이 많이 빠져서 손에 묻어나고하얀색 피지 같은 것 들도 많이 나옵니다예전에도 저런 경험은 있었지만 이번은 이틀 째 지속되어문의 해 봅니다그런데 피부가 안좋아지는 느낌은 아니고,더 쫀쫀해지는 느낌이라 단순히 노폐물 분비가 활발한가하고 생각을 하고 있는 중입니다고수님들의 답변 부탁드리겠습니다"
523,간단한 액괴만들기 아클 이나 붕사없습니다 간단한걸루 추천해 주세요,/qna/detail.nhn?d1id=8&dirId=80603&docId=298546395,간단한 액괴만들기아클 이나 붕사없습니다 간단한걸루 추천해 주세요
524,볼보 s60 d3 견적 부탁드릴 수 있을까요? 또한 국가유공자 입니다. 면세 혜택 받을 수 있는지도 확인 부,/qna/detail.nhn?d1id=8&dirId=8110104&docId=298546372,볼보 s60 d3 견적 부탁드릴 수 있을까요?또한 국가유공자 입니다. 면세 혜택 받을 수 있는지도 확인 부탁드립니다.
525,세마리의물고기입니다 이때까지어항에서키우면서이녀석들이어떤물고기인지 모르고키웠어요 그냥납자루종류인것만알아요 혹시,/qna/detail.nhn?d1id=8&dirId=80508&docId=298546361,세마리의물고기입니다이때까지어항에서키우면서이녀석들이어떤물고기인지모르고키웠어요그냥납자루종류인것만알아요혹시요녀석들어떤물고기인지이름좀알려주세요
526,수입자동차 딜러에 관심이 많습니다.,/qna/detail.nhn?d1id=8&dirId=8110202&docId=298546343,1. 늦은 나이지만..33입니다..지금이라도 도전해보고 싶은데요 늦은 나이에도 지원이 가능한가요?2. 수세협이란 곳이 있던데요 이곳은 무조건 들어가서 강의듣고 입사해야 하는건가요?무조건이 아니라면수세협을 통해서 입사하는게 가장 좋은건가요?
527,무슨 마음이죠,/qna/detail.nhn?d1id=8&dirId=80101&docId=298546318,나를 무척이나 힘들게 했는데 그남자가 경제적으로 큰돈을 빌려준적이 있어요너무 저를 힘들게 해서 싸우면서 안좋게 제가 이별통보했는데 남자도 엄청 자존심 상한것 같은데 돈은 갚지말라네요무슨 마음이죠
528,일반 휴대용 가스렌지와 나사식가스 연료 사용하는 것중에 어떤게 라면이 더 잘끓여질까요? 캠핑때 쓰려구요,/qna/detail.nhn?d1id=8&dirId=8110202&docId=298546299,일반 휴대용 가스렌지와 나사식가스 연료 사용하는 것중에 어떤게 라면이 더 잘끓여질까요? 캠핑때 쓰려구요
529,"시내버스 승차 시 버스요금이 1,200원인데 2,400원으로 찍혔습니다. 후불교통카드 이용해서 결제내역확인해",/qna/detail.nhn?d1id=8&dirId=81201&docId=298546276,"시내버스 승차 시 버스요금이 1,200원인데 2,400원으로 찍혔습니다. 후불교통카드 이용해서 결제내역확인해보니 이용인원은 1인인데 요금이 많이나갔어요. 어디로 어떻게 처리해야할까요?"
530,이렇게 되있는데 오늘오는거 맞나요?? 오늘 꼭받아야해서요 ㅜㅜ 내일 오거나 그러는경우도 많은가요?,/qna/detail.nhn?d1id=8&dirId=81302&docId=298546271,이렇게 되있는데 오늘오는거 맞나요?? 오늘 꼭받아야해서요 ㅜㅜ 내일 오거나 그러는경우도 많은가요?
531,luminox colormark 3050 vs gshock mudmaster,/qna/detail.nhn?d1id=8&dirId=8040304&docId=298546260,luminox colormark 3050 vs gshock mudmaster쥐샥은 gg10001a3dr 모댈이구루미녹스는 파랑 초록 주황 아주 다양한 색중 고민입니다용도는 그냥 여름에 가볍게 차고다닐것 플러스외국여행가서 액티비하몀서 물에서 차고 헤엄치면서 놀 생각입니다둘다 방수 같은 스펙은 비슷한걸로 알고잇규 가격면에서만 루미녹스가 조금 더 비싸더라구요시계엔 영 문외한이라 고수님들께 질문드립니다추천하시는 이유와 반대하시는 이유 알려주시면 시계구매에 큰 도움이 되겠습니다
532,겔럭시j7에서 구글(아래) 검새창을 홈화면에 나오게 하려면,/qna/detail.nhn?d1id=8&dirId=8020505&docId=298546243,겔럭시j7에서 구글(아래) 검새창을 홈화면에 나오게 하려면
533,보이차 질문좀ㅜ,/qna/detail.nhn?d1id=8&dirId=8020306&docId=298546231,보이차 질문인데요먹다보면 정말 괜찮을까요
534,호주에 사는 친구한테 필요한 약 (소화제 소염제 등) 을 보내려고 하는데 우체국 해외택배로 보낼 수 있나요?,/qna/detail.nhn?d1id=8&dirId=81301&docId=298546228,호주에 사는 친구한테 필요한 약 (소화제 소염제 등) 을 보내려고 하는데 우체국 해외택배로 보낼 수 있나요?우체국에 물어보니깐 안된다그러고 블로그에서는 된다그러는데 누구 말이 맞는지 궁금합니다.정확한 근거 바탕으로 정보좀 주세요
535,해몽 부탁드립니다! 제가 시골에 혼자사는데 어느날 학교끝나고 아는형(꿈에서 처음봄)이랑 술을 마시고 제가 사,/qna/detail.nhn?d1id=8&dirId=801&docId=298546198,해몽 부탁드립니다!제가 시골에 혼자사는데 어느날 학교끝나고 아는형(꿈에서 처음봄)이랑 술을 마시고 제가 사는 집으로 들어가는중에 집앞에 두꺼운 검은색 독사가 있는겁니다저는 쪽문으로 피해서 들어갔는데 그 형이 잡는다고 까다가 물려서 제가 다시 나와서 독사 목을 졸라서 죽였습니다여기까지입니다.. 부탁드릴게욥
536,자동차 썬팅 추천좀요. 회사에 그늘진 곳이 없어 항상 햇볕이 잘드는 곳에 주차를 해놓는데요. 퇴근할때 차내부,/qna/detail.nhn?d1id=8&dirId=81103&docId=298546197,자동차 썬팅 추천좀요.회사에 그늘진 곳이 없어 항상 햇볕이 잘드는 곳에 주차를 해놓는데요. 퇴근할때 차내부가 뜨거워서.. 문제있을거같아 걱정이네요. 그래서 썬팅을 하려고 알아보고 있는데열차단 잘되고 가성비 좋은 반사 필름 찾아봅니다.지나친 광고나 홍보는 싫어요.
537,남자 여자 친구없다고 하는데?,/qna/detail.nhn?d1id=8&dirId=80101&docId=298546194,이성적 감정이 없다면 될 수도 있지 않을까육체적 관계였던 사이나 그런 사이라면 친구가 될 수 있을까요?
538,청주 유기견 보호소,/qna/detail.nhn?d1id=8&dirId=8050101&docId=298546191,청주에 유기견 보호소 있나요..급합니다 되도록 빨리 알려주세요ㅠㅠㅠ자세한 위치도 알려주시면 감사하겟습니다(봉사활동 하러 가는거라 봉사시간 주는 곳으로 알려주세요)내공 30드려요
539,중고차질문입니다.,/qna/detail.nhn?d1id=8&dirId=8110101&docId=298546188,http://www.encarmall.com/car/info/car_info_imported_detail.do?i_sCarCd=EC22052615중고차 질문입니다.혹시 이차 구매할까 생각중인데... 괜찮나요?닛산 알티마 유지비 많이 드나요?AS나 관련해서 질문합니다.
540,중고차질문입니다.,/qna/detail.nhn?d1id=8&dirId=8110101&docId=298546188,http://www.encarmall.com/car/info/car_info_imported_detail.do?i_sCarCd=EC22052615중고차 질문입니다.혹시 이차 구매할까 생각중인데... 괜찮나요?닛산 알티마 유지비 많이 드나요?AS나 관련해서 질문합니다.
541,광양중고차 매매업체가 있긴한데..,/qna/detail.nhn?d1id=8&dirId=81102&docId=298546187,전남 광양에 살고 있습니다.광양중고차 매매업체가 조그만하게 있긴한데친구들 얘기로는 위쪽으로 올라가서 사는게더 좋다라고들 얘기하는데 인터넷으로 좀 알아보다 보니업체도 너무 많고 허위매물 같은것도 조심해야 한다고 하는데도통 모르겠습니다.. 이쪽 전문가분들의 자세한 답변 부탁드립니다!감사합니다
542,허리가 자주아프면 침대시용이 안좋다는데 시실인지? 아니라면 어떤침대가 허리에 좋은지 알고 싶어요(돌침대나일반,/qna/detail.nhn?d1id=8&dirId=8080101&docId=298546180,허리가 자주아프면 침대시용이 안좋다는데 시실인지?아니라면 어떤침대가 허리에 좋은지 알고 싶어요(돌침대나일반침대 어떤침대가 허리에 좋나요)참고로 mry도 찍어봤는데 이상이없음 아침에 일어나면허리가 자주아픔
543,이 옷은 어떻게 빨래해야할까요 손빨래인건 알겠는데 산소표백가능한지... 또 어떤세제 사용해야하는지 모르겠어요,/qna/detail.nhn?d1id=8&dirId=80903&docId=298546166,이 옷은 어떻게 빨래해야할까요손빨래인건 알겠는데 산소표백가능한지... 또 어떤세제 사용해야하는지 모르겠어요 ㅠㅠ 도와주시면 감사하겠습니다
544,강아지 약 먹일때 강아지 약 먹일 때 저희 개가 대형견이라 약 한번 먹일때 쉽지가 않아서 기관지염으로 처방받,/qna/detail.nhn?d1id=8&dirId=80511&docId=298546159,강아지 약 먹일때강아지 약 먹일 때 저희 개가 대형견이라 약 한번 먹일때 쉽지가 않아서 기관지염으로 처방받은 약을 바나나랑 소세지에 꽂아서 주고있는데 그래도 괜찮은건가요?
545,코필러재시술 잘하는곳,/qna/detail.nhn?d1id=8&dirId=8030103&docId=298546130,반영구필러 받은지 1년넘었는데요.모양이 맘에들지 않아서 제거하려고 하는데코필러재시술 잘하는곳 추천해주세요.
546,반려견상식사전 마감되었던데 구매할수 있는 방법은 없나요??ㅠㅜ 며칠째 뒤져봐도 안나오네요,/qna/detail.nhn?d1id=8&dirId=8050105&docId=298546123,반려견상식사전 마감되었던데구매할수 있는 방법은 없나요??ㅠㅜ며칠째 뒤져봐도 안나오네요
547,차량 범퍼 긁힘 기스 제거,/qna/detail.nhn?d1id=8&dirId=8110301&docId=298546114,"안녕하세요.렉스턴 구형차량에, 주차로 인한플라스틱으로된 범퍼쪽에 기스가 많습니다.사진과같이 노란색 페인트 자국도 있고각종 긁힌 자국이 있는데혹시 이런 자국들은 어떻게하면 잘 지울 수 있을까요?"
548,람보르기니 아벤타도르 로드스터 sv로드스터 s 로드스터 차이점을 이야기해주세요 그리고 가격들도 알려주세요 가,/qna/detail.nhn?d1id=8&dirId=8110103&docId=298546103,람보르기니 아벤타도르 로드스터 sv로드스터 s 로드스터 차이점을 이야기해주세요그리고 가격들도 알려주세요 가격 말씀 못해주시면 비싼 순서대로 나열해주세요
549,배송조회 부탁드립니다.,/qna/detail.nhn?d1id=8&dirId=81302&docId=298546090,UPAAA000000268463167지금 한국에 도착한건가요?아니면 오기전인가요??언제쯤 도착할까요..?
550,이거언제올까요옹,/qna/detail.nhn?d1id=8&dirId=81302&docId=298546078,이거언제올까요옹
551,"벤츠 c클래스, cla 나 bmw 3시리즈 견적좀 받아보고 싶은데 가능 할런지요? 올 현금 가능하고 현재 6",/qna/detail.nhn?d1id=8&dirId=8110201&docId=298546070,"벤츠 c클래스, cla 나 bmw 3시리즈 견적좀 받아보고 싶은데 가능 할런지요? 올 현금 가능하고 현재 6세대 골프(13년식 7만5천키로) 오너입니다. 현재 트레이드인 할인도 가능 한지 궁금합니다. newage183@naver.com"
552,이사를 해야 하는데 대장방위가 남쪽이라는데 이사해도 되는지 알려주세요. ㅜㅜ 86.6.7일 (여) 86.5.,/qna/detail.nhn?d1id=8&dirId=81001&docId=298546052,이사를 해야 하는데 대장방위가 남쪽이라는데 이사해도 되는지 알려주세요. ㅜㅜ86.6.7일 (여)86.5.2일 (남)13.8.6(남)15.4.24(여)입니다작은 점에서 큰 점으로 갑니다이사 날짜나 뭐 살신 어쩌고 하는 것도 있던데 자세히 좀 봐주세요~ 내공 있어요 ㅜ
553,"산타페 더스타일 2009년 11월식입니다 엔빈오일 교체뒤 오일이 누유된다고 하여 ""파이프 어셈블리 - 오일피",/qna/detail.nhn?d1id=8&dirId=811&docId=298546042,"산타페 더스타일 2009년 11월식입니다토요일 엔진오일 교체 뒤 오일이 누유된다고 하여""파이프 어셈블리 - 오일피드"" 교체를 했습니다정비사가 즉석에서 160,000원.. 이렇게 부르더군요수리가 급해서 우선 결재하고 차를 가져왔지만영~ 찝찝하네요 내역서를 달라고 하니금액을 짜 맞추듯이부품값은 14,000원인데 기술료가 131,460원으로배보다 배꼽이 더 크네요H사 지정 AS업체이지만 수리비를 즉석에서 얼마..이건 아닌것 같네요신뢰가 떨어지다 보니 금액도 불신이 생기네요꼭 나쁜 카센타 같이...자동차 고수님들 ..기술료가 이게 적당한가요 ?정비명세서 첨부합니다"
554,cj대한통운 614925341455 지금 상품 이동중인데 오늘안에 받을 수 있을까요??,/qna/detail.nhn?d1id=8&dirId=81302&docId=298546038,cj대한통운 614925341455 지금 상품 이동중인데 오늘안에 받을 수 있을까요??
555,허벅지 타투,/qna/detail.nhn?d1id=8&dirId=803&docId=298546031,허벅지 전체를 감싸는 타투는 가격 어느정도 하나요
556,아파트 리모델링 질문이요 15년쯤산 아파트 리모델링 생각중인데요 15년살았으면..말다했죠 너무구질구질하더라구,/qna/detail.nhn?d1id=8&dirId=80801&docId=298546014,아파트 리모델링 질문이요15년쯤산 아파트 리모델링생각중인데요15년살았으면..말다했죠너무구질구질하더라구요어디까지나생각중인거라궁금했던거만질문드릴게요1.리모델링 시작하면집에못들어오잖아요?그러면 숙식은 어디서해결하나요?4인가족이라치면근처 모텔에가나요다른분들께선어떻게하시는지 궁금하네요키우는 반려견도있고해서..2.원래배치했던가구는어떻게처리하나요?빼긴해야하는건데집에있는물건들을공사전 남김없이 다른곳으로 옮겨놔야하나요?3.가구도 새로사야할텐데업체에서 디자인에맞게끔가구도 맞춰주나요?4.집은42평 정도되는데가격이대략(풀셋팅기준)어느정도나올지 궁금하네요..
557,써마지 아플까요??,/qna/detail.nhn?d1id=8&dirId=8030103&docId=298546006,써마지 너무 아플까요? ㅠㅠ어떻게 해야 할지써마지 주름 쫙좍 펴지고의사님 써마지 통증 괜찮나요?
558,우드타공판 시멘트벽에 시공 질문,/qna/detail.nhn?d1id=8&dirId=8080101&docId=298545999,사진처럼 벽면에 고정 뭘로 하나요?요번에 기존벽지 냄새나서방하나 타공판 제작주문해서 벽지제거 하고 벽지 대신으로 타공판으로시공하려 합니다.집이라서 벽지 위에 해야하나요?벽지제거 하고 시멘트벽에 바로 설치하면 유해성분 나오나요??
559,자고 일어나면 항상 itunes store 로그인 알림이 와있어요. 내 애플 ID에 대한 암호를 입력해달라고,/qna/detail.nhn?d1id=8&dirId=807&docId=298545983,자고 일어나면 항상 itunes store 로그인 알림이 와있어요. 내 애플 ID에 대한 암호를 입력해달라고요. 이거 해킹당한건가요? 이중보안까지 설정해놓았는데 왜자꾸 이런 알람이 뜨는걸까요?
560,오늘올까요ㅜㅠ,/qna/detail.nhn?d1id=8&dirId=81302&docId=298545979,오늘올까요ㅜㅠ
561,애견미용 주말반 어디있을까요?,/qna/detail.nhn?d1id=8&dirId=8050105&docId=298545976,애견미용 주말반 어디있을까요?
562,외국인 한국대학교 입학 (유학원),/qna/detail.nhn?d1id=8&dirId=816&docId=298545951,"인도인 친구가 중국에서 의대를 다니고 있는데한국에서 성형수술/피부미용 쪽으로 교환학생 같은 코스로 유학을 오고 싶어합니다.어떤 학교가 유명한지, 어떻게 전형접수를 해야하는지이런 부분을 한번에 해결 해 주실 만한 유학원이 있는지도 검색이 잘 되지 않아서 문의 남깁니다.알려주세요~"
563,한국산업인력공단 자격증 발급 신청 후 얼마 안에 가져가야 하는 기한이 있나요? 큐넷 어플로 내방수령 발급 신,/qna/detail.nhn?d1id=8&dirId=80306&docId=298545942,한국산업인력공단 자격증 발급 신청 후 얼마 안에 가져가야 하는 기한이 있나요?큐넷 어플로 내방수령 발급 신청하고 결제까지 했는데 가까운 시일 내에 가지러 못 갈 것 같아서요
564,아우디구입 18년A6 프리미엄과 콰트로프리미엄 견젹요. 1300이외 중고차(그랜저HG) 딜러할인. 등 할부,/qna/detail.nhn?d1id=8&dirId=8110201&docId=298545917,"아우디구입 18년A6 프리미엄과 콰트로프리미엄 견젹요. 1300이외 중고차(그랜저HG) 딜러할인. 등 할부 선수금 2500 이율과 48개월,60개월 둘다요. 메일로 주세요. meungsoo8@gmail.com"
565,"화분을 선물받았는데 이식물의 이름,꽃말 키우는 방법이 궁금합니다.",/qna/detail.nhn?d1id=8&dirId=80604&docId=298545880,"화분을 선물받았는데 이식물의 이름,꽃말 키우는 방법이 궁금합니다."
566,제가 귀뚫은지 6달됐는데요 두달전에 귀가 살짝 찢어졌는데 그 후부터 염증생긴거 같고 너무 아파서 어제 뺐더니,/qna/detail.nhn?d1id=8&dirId=814&docId=298545859,제가 귀뚫은지 6달됐는데요 두달전에 귀가 살짝 찢어졌는데 그 후부터 염증생긴거 같고 너무 아파서 어제 뺐더니 뒷쪽에만 몽우리가 생겼더라고요 일자도 아니거 위치도 마음에 안들어서 막을려고 하는데 흉터 최대한 안남게 하는법좀 알려주세요ㅠㅠ약같은거..그리고 몽우리는 어떻게 없애요..? ㅠㅠㅠ
567,써마지 효과어때?,/qna/detail.nhn?d1id=8&dirId=8030103&docId=298545853,써마지 라는게 주름 개선에 효과 좋은거라더라구요 확실한건지 써마지효과가 바로 나타나는건지 의사님 써마지 효과나 써마지 대해서 정보 공유 부탁드려요 ㅠ~
568,피어싱 귀랑 입술 이어져잇는 피어싱을 뭐라고하나요 ㅠㅠ???,/qna/detail.nhn?d1id=8&dirId=8040301&docId=298545836,피어싱 귀랑 입술 이어져잇는 피어싱을 뭐라고하나요 ㅠㅠ??? 살려고하는데 이름을모르겟어요
569,면 비린내 없애는 방법,/qna/detail.nhn?d1id=8&dirId=80201&docId=295952085,집에서 면 요리를 자주 만들어 먹습니다만유독 냉면이나 스파게티를 만들 때 유독 면 비린내가 납니다밀가루 비린내라고 하죠요리를 꽤 긴 시간동안 해와서 요리에 자신있다 생각하는 편입니다만 유독 면 요리는 그러내요밖에서 냉면이나 스파게티를 사먹을 땐 잘 안나는데 집에서 해먹으면 면 비린내가 나는 이유는 무엇일까요?이리저리 해봐도 도통 비린내가 사라지질 않내요
570,미용한지 5년되었는데 일 그만두고 뉴질랜드 이민가려 서류를 준비하다보니 경력 증명을 위해 근무한곳 사업자등록,/qna/detail.nhn?d1id=8&dirId=80106&docId=298545822,미용한지 5년되었는데 일 그만두고 뉴질랜드 이민가려 서류를 준비하다보니 경력 증명을 위해 근무한곳 사업자등록증을 준비하라는데 그게 맞는건지..이미 그만둔 상태에서 사업자등록증을 받아도그곳에 피해는 없는건지 궁금합니다ㅜㅜ
571,이 꽃 이름이 뭘까요?,/qna/detail.nhn?d1id=8&dirId=80604&docId=298545812,이 꽃 이름이 뭘까요?
572,걸그룹주사 부작용은??,/qna/detail.nhn?d1id=8&dirId=8030404&docId=298545769,"걸그룹주사 부작용 같은건 있을까요? 걸그룹주사 이게다이어트 주사용이던데,, 부작용있을지 ... 의사님걸그룹주사 부작용 있나요?"
573,블루스택 오류,/qna/detail.nhn?d1id=8&dirId=80704&docId=298545750,모바일 게임을 즐겨하는 사람입니다 근데 제가 얼마전에 블루스택으로 게임을 하던도중 어느날은 마우스가 인식을 안하고 어느날은 키보드 인식이 안되고 참..  이것떄문에 녹스를 사용하다가 녹스는 별로여서 블루스택으로 다시왓는데 이러네요 ㅠㅠ 왜그럴까여 제가 led 키보드를 쓰고있고 마우스도 led 쓰고있는데 불은 들어오는데 먹통이네요 산지도 얼마안됫는데 어떻게 고치나요알려주신데로 해봐서 고쳐지면 내공100드리겟습니다친절한 답변부탁드립니다....
574,무사고 차량 구입이후 사고 확인시 대처방법,/qna/detail.nhn?d1id=8&dirId=8110202&docId=297522237,"무사고 차량이라고 (단순 판금, 교환 등은 제외) 대화하고 차량을 구입했는데,차량 상세조회를 하니 사고로 꽤 많은 부분을 수리했더군요이런 경우에는 어떻게 해야 하나요??"
575,홈텍스에 교통카드 등록 어떻게 하나요??,/qna/detail.nhn?d1id=8&dirId=81201&docId=298545736,홈텍스에 교통카드 등록 어떻게 하나요?? 팝카드 쓰고 있어요ㅠㅠ
576,전자레인지안에 곰팡이가 폈어요 저번에 닦아냈는데 또생기고 안에 물도 많이맺혀있고 해결법좀요 ㅠㅠㅠㅠㅜ 자취생,/qna/detail.nhn?d1id=8&dirId=8020101&docId=298545714,전자레인지안에 곰팡이가 폈어요저번에 닦아냈는데 또생기고 안에 물도 많이맺혀있고 해결법좀요 ㅠㅠㅠㅠㅜ 자취생이라 햇반도돌려먹는데
577,안녕하세여 현재 미국에 살고있는 한국나이로 6학년이 된 여자 입니다 제가 한 5학년때는 한국에서 같은 초등학,/qna/detail.nhn?d1id=8&dirId=80101&docId=298545682,"안녕하세여 현재 미국에 살고있는 한국나이로 6학년이 된 여자 입니다제가 한 5학년때는 한국에서 같은 초등학교를 다녔던 남자애가 있었어요..근데 걔랑 저랑 좀 친한..? 사이였거든오 근데 제가 그때 주말에 너무 심심해서 걔한테 장난고백을 했었어요..진짜 정말 리얼리 장난으로여...근데 걔가 진짜로 받아드리고 저희반 애들은 그걸 다 알아버렸죠 근데 또 시간이 지나니까 그 소문도 잠잠했는데 어느날 걔한테 '야','나 할 말 있어' 이러고 온거에여..!! 그래서 제가 뭔데? 하고 보냈는데 사실 저때는 저도 호감(?) 정도 있는 상태라 기대를 하고 있었는데 안알려주는거에여..ㅠㅠ 근데 몇 달 뒤에 제가 미국으로 오게 되었어요..그래서 지금은 별로 연락도 잘 않하고...그런데 전 걔를 아직 잘 모르겠어요..막 남친이랑 어쩌구저쩌구 했다 라는 썰같은거 보면 자꾸 걔랑 이걸 하면 어떨까..이렇게 생각하고 또 생각하면 설레고..근데 제가 6월에 한국에 들어가는데 걔랑 또 어떻게 마주해야 될까요..?1) '야','나 할 말있어' 라고 보내고 안알려준 이유는 그냥 짐작가는 이유 있음 알러주세요..2) 그리고 제가 썰 같은거나 남친이랑 스킨쉽 했을때 이런 영상을 봤을때 자꾸 걔가 생각나는 이유가 뭔가요..? 이거 좋아하는 건가요?3) 제가 한국 들가면 걔를 봤을때 어색할것 같은데.. 안 어색해 하고 친구 처럼 다시 친한 친구로 계속 연락할 수 느는 방법 없을까요.?4) 그리고 걔가 장난기도 많고 그런대 보통 그런 남자들은 무슨 스타일 좋아하나여..?질문이 눔 만조..ㅠ죄송해여..꼭 다는 아니더라도 아는 거나 짐가느는 것 아시면 댓 남겨주세여 참고로 자세하게아알려주시공 내공냠냠 신고 합니다;; 내공100 걸어여"
578,이번 봄에 이사를 할 계획입니다. 그런데 이사하려고 하는 동네가 저희집으로부터 북쪽에 있어.. 부모님께서 올,/qna/detail.nhn?d1id=8&dirId=809&docId=298545668,이번 봄에 이사를 할 계획입니다.그런데 이사하려고 하는 동네가 저희집으로부터북쪽에 있어.. 부모님께서 올해는 북쪽으로 이사하는게 좋지않다고 하시는데.. 어떤가요?
