,0,1,2
1027,인터넷 유머중에 '저희와 일할 수 없습니다',/qna/detail.nhn?d1id=8&dirId=80702&docId=298183682,내용이 대충 청년 일자리에 대한 4~5줄문자 형식의 사진이었나? 아마 그렇게 기억하고 있네요(네이버 카페에서 그걸 봤던 것 같은데)어렴풋이 기억하는 부분)>대학을 안 나왔는데요?네 그럼 저희와 일할 수 없습니다<원본이나 사진 어떻게 구하는지 알고싶네요 궁금합니다(홍보나 다른 의도 없어요유머로 활용하고 싶어서 그럽니다)
1028,소유물반환청구에 관해서 자연력으로 물건을 취득한 자에게는 소유물반화청구를 행사할 수 있나요?,/qna/detail.nhn?d1id=8&dirId=81302&docId=298540127,소유물반환청구에 관해서 자연력으로 물건을 취득한 자에게는 소유물반화청구를 행사할 수 있나요?
1029,자기전에는 배가고픈데 참고 그냥 자고 일어났을때 배가 부른건 왜그런건가요? 자면서 위나 장에는 무슨 일이 일,/qna/detail.nhn?d1id=8&dirId=8020101&docId=298540110,자기전에는 배가고픈데 참고 그냥 자고 일어났을때 배가 부른건 왜그런건가요?자면서 위나 장에는 무슨 일이 일어나는건가요?
1030,언더아머 트레이닝복 세트 이름 뭔가요?,/qna/detail.nhn?d1id=8&dirId=8040103&docId=298540098,언더아머 트레이닝복 세트 이름 뭔가요?
1031,제가 시킨 택배를 오늘까지 받아야하는데요!!! 대한통운에서 오는것 같은데 .... 딴 택배랑 다르게 도척2C,/qna/detail.nhn?d1id=8&dirId=81302&docId=298540087,제가 시킨 택배를 오늘까지 받아야하는데요!!!대한통운에서 오는것 같은데 ....딴 택배랑 다르게 도척2CP라는 곳에 있어서요...오늘안에 받을 수 있나요??택배번호는 6416611633입니다!!추가내공 300드립니다!!
1032,트로트중에애기가머슴옷에 술잔그거요제목이,/qna/detail.nhn?d1id=8&dirId=80205&docId=298540085,트로트중에애기가머슴옷에 술잔그거요제목이
1033,1년 가까이 만났고 싸운적도 없이 잘 지내다가 둘다 힘든 상황에 남자친구가 먼저 헤어져야 될 거 같다고 해서,/qna/detail.nhn?d1id=8&dirId=80101&docId=298540072,1년 가까이 만났고 싸운적도 없이 잘 지내다가 둘다 힘든 상황에 남자친구가 먼저 헤어져야 될 거 같다고 해서 저도 지쳤을 때라 헤어지게 됐습니다.만날 수 없는 상황이라 전화로 헤어졌었는데 삼일만에 새벽에 전화가 왔고 자고 있어서 못 받았더니 전화 달라고 문자까지 남겼어요.그거보고 전화했는데 받지도 않고 하루종일 연락도 없네요.이건 무슨 의미일까요...?
1034,원룸인데요 옆집에서자꾸 카악퉤 카악퀘 카악~~~퉤 하는 이유가 뭐죠??,/qna/detail.nhn?d1id=8&dirId=814&docId=298540052,원룸인데요 옆집에서자꾸 카악퉤 카악퀘 카악~~~퉤 하는 이유가 뭐죠??
1035,라라랜드 city of star 풀버전 원본 악보좀 주세요!!,/qna/detail.nhn?d1id=8&dirId=80703&docId=298540048,라라랜드 city of star 풀버전 원본 악보좀 주세요!!
1036,소녀나라 고민이에요 ㅠㅠ 배송중이라길래 운송장 번호를 딱 쳤는데 4개를 시켰었는데 1개만 상품인수라고 뜨더라,/qna/detail.nhn?d1id=8&dirId=81302&docId=298540046,소녀나라 고민이에요 ㅠㅠ배송중이라길래 운송장 번호를 딱 쳤는데 4개를 시켰었는데 1개만 상품인수라고 뜨더라고요.... 4개 다 오는거 일까요 아니면 1개만 오나요?? ㅠㅠ
1037,꽃이름이 뭐예요??,/qna/detail.nhn?d1id=8&dirId=80604&docId=298540023,꽃이름이 뭐예요??
1038,안녕하세요. 전선을 제조하는업체입니다. 제가 지나가는말로 들은게있어서 여쭤봅니다. 장애인협회로 납품을 하는게,/qna/detail.nhn?d1id=8&dirId=81104&docId=298540015,안녕하세요.전선을 제조하는업체입니다.제가 지나가는말로 들은게있어서 여쭤봅니다.장애인협회로 납품을 하는게 있다고 하던데있다먼 조달청같은건지 알고싶어서요~
1039,택배6687435506 언제올까요,/qna/detail.nhn?d1id=8&dirId=81302&docId=298540001,택배6687435506언제올까요
1040,골든구스 같은 제품인가요?,/qna/detail.nhn?d1id=8&dirId=8020306&docId=298539988,골든구스 같은 제품인가요?
1041,여자친구와 다시 사귀게 되었습니다,/qna/detail.nhn?d1id=8&dirId=80101&docId=298539983,저에게는 대학생활 4년동안 사귄 여자친구기 있었습니다 데이트를 하면 비용도 다 자기가 부담할려하고제가 아플때 간호도 해주고 제가 힘들때 옆에 있어주었던 정말 착하고 다정한 여자친구 였습니다 그런데 제가 그때 살짝 머리가 돌았는지 이 여자친구가 지겹고 다른 여자가 눈에 들어왔습니다 저는 그때 착하고 다정한 여자친구를 찼습니다제가 다시 사귄 여자는 사실 김치녀 였습니다맨날 저한테 돈만 뜯어가고 조금이라도 마음에 안들면때리고 그랬습니다 나저는 그때 다시 제 전여자친구가 생각났습니다 어느 날 저는 길을 걷다가 커피를 마시러카페에 들어갔습니다 근데 익숙한 얼굴이 카페에 들어와서 제 옆에 앉았습니다 바로 제 전여자친구 였어요제 전여자친구는 제 옆에 앉아 이런 애기를 하더군요나 다시 오빠랑 사귀고 싶어 오빠랑 같이한 4년 동안의 추억은 잊을 수가 없어라고 말했습니다저도 제 전여자친구와 다시 사귀게 됫습니다여자친구한테 미안한게 많아요 그래서 여자진구한테 잘 해주고 싶은데 어떻게 해야 되죠?
1042,고양이 캔 유통 기한좀 봐주세요 ㅜㅜ,/qna/detail.nhn?d1id=8&dirId=80502&docId=298539975,고양이 캔 유통 기한좀 봐주세요 ㅜㅜ
1043,곱슬인데 매직을 하고싶어요,/qna/detail.nhn?d1id=8&dirId=8030202&docId=298539967,"제가 유전으로 곱슬머리를 그대로 받아왔는데, 곱슬머리를 너무 피고싶어서 찾아봣는데 매직이란게잇더라구요 근데 잘 모르겟어서..블루클럽같은 일반 미용실에서 매직을하려고하는데, 머리가 지금 좀 기른상태여서 ..머리를 자르고 매직을 해야하나요 아니면 안자르고해도되나요 그리고 매직을 하고나서 머리를 자르면 어떻게되나요 그리고 매직이 정확하게 무엇이고 얼마나 필수잇나요.. 부탁드립니다 중학교 2학년입니다..ㅠㅠ"
1044,CJ 택배가 3일째 안옵니다.,/qna/detail.nhn?d1id=8&dirId=81302&docId=298539957,"문제가 심각한것 같습니다. 3월30일에 주문했는데 당일배송이면 31일와야되고 아무리 주말이 껴있다고 해도 월요일에는 와야되는데 안왔고 배송 상태를 보니깐, 오늘도 안온다는건 문제가 있는건데... 어떻게 해야되나요?"
1045,어제 방송된(생활의달인)부산오징어김밥의달인 어디있읍니까,/qna/detail.nhn?d1id=8&dirId=814&docId=298539949,어제 방송된(생활의달인)부산오징어김밥의달인 어디있읍니까
1046,Cj 614928959313 오늘까지 도착하나요?,/qna/detail.nhn?d1id=8&dirId=81302&docId=298539945,Cj 614928959313 오늘까지 도착하나요?
1047,오늘까지 꼭 받아야하는 택배인데용 ㅠㅠ 대한통운 614906823596 입니당 ..ㅠ,/qna/detail.nhn?d1id=8&dirId=81302&docId=298539942,오늘까지 꼭 받아야하는 택배인데용 ㅠㅠ대한통운 614906823596 입니당 ..ㅠ
1048,정말 왜저러지요?,/qna/detail.nhn?d1id=8&dirId=80101&docId=298539937,카톡 스토리 사귈때 기록들 다 지워달라고 했는데 저에 관련된 사진들만 지우고 사귈당시 자신의 감정이 담긴 글귀들은 안지웠어요저한테 미련없는척 정떨어진척 하면서 왜저는거죠?
1049,후드티 얼룩,/qna/detail.nhn?d1id=8&dirId=80903&docId=298539918,흰색 후드티에 아이스티? 같은게 묻었었는데 바로 빨지를 못해서 얼룩이 손빨래로 해도 안지워진다는데 지울 방법이 있나요 ㅠㅠ
1050,부산오징어김밥의달인 어디갔을까 요,/qna/detail.nhn?d1id=8&dirId=814&docId=298539913,부산오징어김밥의달인 어디갔을까 요
1051,미국에서 타던 차 한국으로 가져오고 싶습니다.,/qna/detail.nhn?d1id=8&dirId=8110201&docId=298539899,찾아봐도... 답답함을 해결해주지 못했습니다. ㅜ.ㅜ 도와주세요!!!!현재 미국 애틀란타에 2년째 거주중이며 한달후 한국으로 귀국합니다.타고 다니던 차량 볼보XC60 3.2 (빈넘버 4로 시작)를 이사화물로 보내고 싶은데총 비용이 궁금합니다. 이곳에서 보내는 운반비부터 한국에서 등록하는 시점까지내야하는 대략적인 금액을 알려주세요~~현재가격으로  7000불정도 하는 것으로 알고 있습니다.
1052,저는 어떤 비비나 파운데이션을 써도 조금만 발라도 떡칠한것처럼 겉돌고 그러는데 엄마는 같은 화장품을 많은양을,/qna/detail.nhn?d1id=8&dirId=8030301&docId=298539891,저는 어떤 비비나 파운데이션을 써도 조금만 발라도 떡칠한것처럼 겉돌고 그러는데 엄마는 같은 화장품을 많은양을 발라도 아주 자연스럽고 화장안한 원래 깨끗한 피부처럼 되던데 둘이 기초도 똑같은 거 쓰는데 왜 그런걸까요ㅠ
1053,언제쯤 도착할까요?? 내일까지 받을수 있나요? 운송장번호는 6864009276341입니다.,/qna/detail.nhn?d1id=8&dirId=81302&docId=298539886,언제쯤 도착할까요?? 내일까지 받을수 있나요? 운송장번호는 6864009276341입니다.
1054,택배 조회,/qna/detail.nhn?d1id=8&dirId=81302&docId=298539876,울산 범서읍에 거주하고 있는데 택배가 오늘 올까요?롯데택배 228755232311
1055,좋아하는 남자애,/qna/detail.nhn?d1id=8&dirId=814&docId=298539872,2년 전(4학년)에 같은 반에 어떤 남자애 (그땐 5월달쯤이였고 같은 반이 된적이 없어서 모르는 사이였슴)가 저한테 고백을 한거에요.그땐 별로 남자애들에 대해서 관심이 없었고 한번도 남친이 있었으면 좋겠다......는 생각이 1도 없었기 땜에 찻습니다.근데 그러고 2개월뒤에 제가 걔를 좋아한 거에요!! 그래서 4학년이랑 5학년때 앉는 자리가 자유였기 땜에 1년 반 동안 걔랑 짝을 했습니다. 근데 6학년 때 반이 갈라져서.........마음 비울라고 했는데 안비워지더라고요........ 근데 학교에서 저랑 얘랑 완전히 다른 무리거든요........전 공부 잘하는 편에 속해있고 얘는 못하는건 아니지만 다른 남자애들이랑 어울려 다니는 애입니다....어떻게 할까요...........??
1056,오락실에서,/qna/detail.nhn?d1id=8&dirId=80101&docId=298539869,오락실에서 오락하는사람들과 게임을 같이하면 정말 친해지나요? 오락실에서 오락하는사람들과 자주게임을 하면 친해지는이유가 뭔가요?
1057,상처있는곳이 좀 시간이 지나니까 이렇게 생깁니다 둘다 입체감있는모양이고 이것을 없앨수있을까요? 정말 치마 꼭,/qna/detail.nhn?d1id=8&dirId=80505&docId=298539863,상처있는곳이 좀 시간이 지나니까 이렇게 생깁니다둘다 입체감있는모양이고이것을 없앨수있을까요?정말 치마 꼭입고싶습니다없앨수있다면 없애는방법좀 알려주세요..
1058,저는 방송어떤방송요 카카오TV에서 또오늘어떤방송요 강퇴당했어요 욕설이랑성드립이나패드립안했는데,/qna/detail.nhn?d1id=8&dirId=814&docId=298539847,"저는 방송어떤방송요 카카오TV에서 또오늘어떤방송요 강퇴당했어요 욕설이랑성드립이나패드립안했는데내용에무슨말하다가요다른방송중에서 꼬미 님 방송인가 -_-;; ㅠㅠ 채팅이렇게남겼는데요 글메모장에다가복사해놓고내용에말하는거인데요채팅 도배, 태그 사용 등 비정상적으로 채팅을 이용하는 사용자는 서비스 규제 및 민형사 책임을 물을 수 있습니다.본방에 입장하였습니다.119님이 입장하셨습니다.원들님이 퇴장하셨습니다.tooHong님이 퇴장하셨습니다.한민족 미모의 경지 오현아Wls업이?장지환내일출산Wls메르시보꾸님이 퇴장하셨습니다.추천추천뭐운영조까치하네?히오스오현아사랑해님이 퇴장하셨습니다.한민족 미모의 경지 오현아Wls고든람쥐뭐 뭐 뭐코오자자아님이 퇴장하셨습니다.H88님이 퇴장하셨습니다.튀기듯구운만두님이 퇴장하셨습니다.달러멘디Wls심삐삐님이 퇴장하셨습니다.비내려님이 입장하셨습니다.장지환내일출산Wls...마콘도님이 입장하셨습니다.마콘도님이 퇴장하셨습니다.수시험테스트게임컴들어오다궁금해서와봤는데요 방송제목요..2015년 죽장맞던꼬미 보기가무슨말인가요바람의 말님이 입장하셨습니다.샤로수주민님이 입장하셨습니다.운영조까치하네ㅋㅋㅋㅋㅋㅋㅋㅋㅋㅋㅋㅋㅋㅋ한민족 미모의 경지 오현아ㅋㅋㅋㅋㅋㅋㅋㅋㅋㅋㅋㅋㅋ헤카림벤제마'꼬'아라프님이 퇴장하셨습니다.장지환내일출산조건반사가 또뱀이나와님이 퇴장하셨습니다.유세윤꼬지컬 ㅆㅅㅌㅊ쉑쉑몬드님이 입장하셨습니다.타코님이 퇴장하셨습니다.한남대생 한남춘(페미니스트)님이 입장하셨습니다.대변공장님이 퇴장하셨습니다.가스뱀장어노렷네..나사로zzzzzzzzzzzzzz샤로수주민꽃을든달러멘디꼬지컬 ㅆㅅㅌㅊ파스팟수님이 입장하셨습니다.현새우님이 퇴장하셨습니다.디귿님이 퇴장하셨습니다.추천추천꼬출들어버림ㅋㅋㅋㅋ수미닝님이 퇴장하셨습니다.신율띠님이 입장하셨습니다.장지환내일출산꼬출든고든람쥐이걸 살리네 ㅋㅋ수시험테스트게임컴들어오다아 카카오TV에서 죽창맞았다는이야기인가요...くろがね님이 입장하셨습니다.미초이님이 입장하셨습니다.mixer님이 입장하셨습니다.엘츠꼬출든 ㅋㅋㅋㅋㅋChanelro님이 입장하셨습니다.진팟임팔라피지컬 개쩐다 ㅋㅋㅋㅋㅋㅋ탈모인 김광규님이 퇴장하셨습니다.ABC 초콜릿님이 퇴장하셨습니다.샤로수주민이때는 100이었네 ㅋㅋ눈치없는새끼인데 이해좀꼬ㅊ 혐오증생기셨네mixer님이 퇴장하셨습니다.정잉택님이 퇴장하셨습니다.ϱ( > έ < ) ⎠님이 퇴장하셨습니다.Zopago님이 퇴장하셨습니다.Chanelro님이 퇴장하셨습니다.판람차님이 퇴장하셨습니다.상어뚜루님이 입장하셨습니다.진팟임팔라궁맞기전에 플쓰는 느낌인데 ㅋㅋㅋㅋ고진강래님이 입장하셨습니다.찐찬님이 퇴장하셨습니다.찐찡막님이 퇴장하셨습니다.공식성립또 실컷 웃고 올리네반타블랙님이 입장하셨습니다.데닝님이 입장하셨습니다.새가난다요~님이 입장하셨습니다.망겜만하는사람지금도 쟈피지컬가능?장우우우우웅님이 입장하셨습니다.수시험테스트게임컴들어오다저는다른방송요 욕설같은거나성드립이나패드립안했는데요 ㅠ.ㅠ 다른방송요 Lra 엘라방송이랑 엘레베르마음치료방이랑 햇쵸방 강퇴당하거나채팅금지당하기도고진강래꼬하~바람의 말님이 퇴장하셨습니다.반타블랙님이 퇴장하셨습니다.119?탐욕욕심자만님이 퇴장하셨습니다.수시험테스트게임컴들어오다님이 신고된 횟수 1회, 닉네임(추천추천)님에 의해 신고되었습니다. 7회 누적시 채팅이 금지됩니다.수시험테스트게임컴들어오다님이 신고된 횟수 2회, 닉네임(망겜만하는사람)님에 의해 신고되었습니다. 7회 누적시 채팅이 금지됩니다.한민족 미모의 경지 오현아?채팅 서버와 연결이 끊어졌습니다.<< 채팅서버 재연결 >>수시험테스트게임컴들어오다님이 신고된 횟수 3회, 닉네임(유세윤)님에 의해 신고되었습니다. 7회 누적시 채팅이 금지됩니다.장지환내일출산속노사 ㅋㅋㅋ벌레수시험테스트게임컴들어오다님이 퇴장당하였습니다.글이렇게나오지만요 ㅠㅠ어쨋든긴글읽을사람도없지만요질문이삭제될지모르는것외에이곳확인상에글썼읍니다내용에말이많아졌네요그리고글못썻다면은죄송합니다 그리고 제가 수시험테스트게임컴들어오다 였어요어떤 이전엔다른방송 강퇴당한방중에서 요플래 , 뇌성마비 , 배도리 , 어떤남자게임PD여러명있는방그리고외에 DMC김근현 , 누구신디?? , 테디스틱 , 나이스게임TV , 엘라 Lra , 엘라벨르마음치료방 ,이어서 빤호 , 포빗 ,케이트튠 방송등등이나 이어서 꼬미인 어떤다른방송 꼬미zzang 방송요 강퇴당했어요욕설안했는데요 일단 긴글장문쓰면은 답변이랑댓글이하나도없는것외에없어도상관없어요그리고 무슨어떤사람은 나에게 조선족이냐고하던대 저 조선족아닌데이어서 내용에답변채택수1,000개이상작성자비공개답변자가답변할지모르는것외에그리고이어서전글확인상에내용에글썼어요제목은그리고저는 방송어떤방송요 카카오TV에서 제목인데... 무슨말인지모르게썼다면은죄송하고요내용에질문이바로삭제될지그리고모르지만요 일단 답변하기짜증나거나곤란한분들답변안해주셔두되요 어떤답변이올지모르지만요"
1059,나무이르이 뭘까요? 도감엔 안보이네요.,/qna/detail.nhn?d1id=8&dirId=80604&docId=298539836,나무이르이 뭘까요?도감엔 안보이네요.
1060,나무이르이 뭘까요? 도감엔 안보이네요.,/qna/detail.nhn?d1id=8&dirId=80604&docId=298539836,나무이르이 뭘까요?도감엔 안보이네요.
1061,안녕하세요 저는중1남학생입니다 제가 지금키는 165정도되고 몸무게는 55정도되는데 뱃살이너무많은것같아서 자전,/qna/detail.nhn?d1id=8&dirId=814&docId=298539827,안녕하세요 저는중1남학생입니다제가 지금키는 165정도되고 몸무게는 55정도되는데 뱃살이너무많은것같아서 자전거를 타면서 빼고싶습니다 저희집앞에 자전거 도로가있어서 그곳에서새벽6시에 시작해서 30분에서 1시간정도 자전거타려고하는데 과연 뱃살이빠지는지 궁금합니다
1062,화성시 팔탄면 이장님 명단,/qna/detail.nhn?d1id=8&dirId=8020112&docId=298539822,화성시 팔탄면 이장님 명단
1063,제가 어제 피미를 헀는데 다 풀렸는데 어떡하죠 As가 그거는 무료인가요?,/qna/detail.nhn?d1id=8&dirId=8030204&docId=298539812,제가 어제 피미를 헀는데 다 풀렸는데 어떡하죠As가 그거는 무료인가요?
1064,꿈해몽좀 해주세요,/qna/detail.nhn?d1id=8&dirId=80105&docId=298539808,여행을 갔는데 숙소가 맨 윗층이엇고 지붕이 뚫려있었어요. 그런데 옆건물이 무너지면서 제방으로 덮쳤고 저는 그 그조물들을 손으로 밀어서 밖으로 던저냈구요.강아지 2마리를 깨끗하게 목욕시켰어요.길을가다 물가에서 수영을 했는데 나와서 뒤돌아보니 흙탕물이었구요.생생하니 찝찝한데 해몽좀 해주세요.
1065,Qm3견적문의 합나수리기간과가격대즘알고싶어요,/qna/detail.nhn?d1id=8&dirId=811&docId=298539793,Qm3견적문의 합나수리기간과가격대즘알고싶어요
1066,안녕하세요 저는 중2여학생입니다. 저는 지금 좋아하는 남학생이 있습니다. 저는 그 남학생을 1년 넘게 좋아하,/qna/detail.nhn?d1id=8&dirId=80101&docId=298539784,안녕하세요저는 중2여학생입니다.저는 지금 좋아하는 남학생이 있습니다.저는 그 남학생을 1년 넘게 좋아하고 있는 것 같습니다.저는 그 남학생을 좋아하는데 친구들이 막 사귀라고하는 데 그 남학생과 사귀고 싶은 맘은 없는 데그냥 그 남학생이 남자로 좋습니다.이럴 땐 어떻게 해야하나요?정말 잊지도 못하겠고....좋고 도움이 되는 글만 올려주세요
1067,숨타일과 폼블럭 비교,/qna/detail.nhn?d1id=8&dirId=80801&docId=298539752,"봄철이 되어서 셀프 리모델링을 해보고 싶은데벽지로 친환경적인 숨타일과 폼블럭이 셀프 시공으로 많이 나오네요~습기와 곰팡이, 환경은 숨타일이 우수한거 같은데...곰팡이, 결로만 보면 폼블럭도 괜찬은거 같네요...가격은 폼블럭이 우수하고 시공도 보다 간편해 보이긴 하는데~~폼블럭은 소재에 대한 예측이 되는데 숨타일은 소재 예측이 어렵네요~~숨타일과 폼블럭에 대해서 잘 알고 계신분 있으면 좀 알려주시면 감사하겟습니다..추가로 하나 더 궁금하네요~~저희 집은 타일을 깔아놓은 상태인데 다이켄 마루로 덧 시공이 가능한지도 궁금합니다..인테리어에 대해서 잘 아시는 분 있으시면 알려주시면 감사하겟습니다.. 시공포함 비용도 궁금해요"
1068,리터급 바이크 궁금증입니다.,/qna/detail.nhn?d1id=8&dirId=8110105&docId=298539740,"MT-10GSX S1000FCBR1000RRCB1000RZ1000SX이와 같은 모델들을 보면서 궁금한 점이 있어 문의드립니다.현재 가장 마음에 드는 모델은 MT-10과 GSX S1000F 입니다.1. 리터급 차이고, 연 주행거리가 5천도 안될 것으로 예상되는 상황에서 연비를 따진다는 것이 아이러니 합니다만, 현재 국내에 출시되지 않은 CB1000R을 제외하고 나머지 모델끼리 놓고 볼 때(당연히 얼마나 땡기냐에 따라 개인차가 많을 것이라고 생각됩니다만 그런 점은 배제하고 같은 사람이 같은 방식으로 바이크를 탄다는 전제 하에서) 혼다 R차인 CBR과 나머지 차 들 중 어느 모델이 연비가 가장 좋을까요?2. 자가정비에 가장 편한 모델이 어떤 모델일까요?3. 찾아간 딜러들 마다 자신들의 바이크 수리비가 가장 저렴하다고 합니다.(가와사키는 안가봤습니다)스즈키, 혼다, 야마하. 부품 종류가 한두개도 아니고 단순 비교는 어렵다 생각됩니다만, 통상 주기로 교체가 필요한 소모품성 부품들의 경우 어느 브랜드가 저렴하다고 인식되나요?(정식 서비스 센터 통한 구매 기준)4. Z1000SX의 경우 사이드박스 포함한 가격이 얼마인지 아시나요?(가와사키 홈페이지는 왜이렇게 안들어가지는걸까요;)5. 바이크 프로모션이 가장 좋은 시점은 통상 년중 어느 시점인가요? 새 모델 출시하면서? 연식 바뀌기 전?6. MT-10에는 뎀퍼가 있는데, GSX 에는 뎀퍼가 없다고 들었습니다. 고속 주행 시 뎀퍼의 역할이 정말 중요한가요?질문이 두서가 없습니다.질문 중 한두개라도 답변을 부탁드립니다."
1069,제가 지금 너무 어이없게도 싸웠는데요 오묘하게 비웃는 사진을 배사 아님 프사 하려는데 뭐가 좋을까요? 추천해,/qna/detail.nhn?d1id=8&dirId=8010502&docId=298539709,제가 지금 너무 어이없게도 싸웠는데요오묘하게 비웃는 사진을 배사 아님 프사 하려는데 뭐가 좋을까요? 그 사람이 모를만큼 아님 헷갈려할만큼이요 그냥 대놓고말고 약간 비스무리하게요추천해주세요
1070,오늘 도착할까요?? Cj 운송장번호 342673556185,/qna/detail.nhn?d1id=8&dirId=81302&docId=298539693,오늘 도착할까요?? Cj 운송장번호 342673556185
1071,버스왔는데 횡단보도에 신호가 걸렸었어요 버스가 버스정류장에 걸쳐있음에도 불구하고 버스기사아저씨가 문을 안열어,/qna/detail.nhn?d1id=8&dirId=81201&docId=298539692,버스왔는데 횡단보도에 신호가 걸렸었어요 버스가 버스정류장에 걸쳐있음에도 불구하고 버스기사아저씨가 문을 안열어주시고 손짓으로 저리가라는 식으로 하셨는데 이거ㅜ승차거부로 신고가능한가요
