,0,1,2
1477,"자동차 차 하부 긁힘 오일 , 물 이 샌거 같아요",/qna/detail.nhn?d1id=8&dirId=8110301&docId=298533428,안녕하세요오늘 운전을하다가 길을잘못들어서도로에서 인도로 차가 이동할수잇게 단차가 낮게 되어잇는것처럼그런곳에 들어가서 후진으로 다시 방향을 틀고 나오다가어두워서 제가 오른쪽왼쪽 을 안맞추고 나왓나봅니다단차 높이 차이가 잇어서 그런지자동차 차 하부가 긁힌것 같아요4명중에 운전한 저만 소리를 느꼇구요 드르륵 소리가 살짝이 낫습니다.운행하는중에 브레이크가 문제가 잇을까 브레이크 도 체크해봣는데문제는 없엇구요다만 2시간정도 주차를 하고 차를 빼고 주차 자리를 확인을 해봣는데원래 물이 잇엇던건지주차자리에 운전석과 조수석 사이쪽에 물인지 오일인지 샌것처럼 물이 고여잇더라구요손으로 만지고 냄새맡아봣을떄 냄새는안낫습니다 .자동차 하부가 긁혓을때 오일이나 물이 안샌다면 문제가 없는걸로 아는데만약 물이나 오일이 샛다면큰 문제일까요?정비를 해야한다면 어떤부분이며 비용이 어느정도 나올까요??자동차 좁은곳을 지나가더라도 한번도 긁히고 박거나 한적이없는데이렇게 하부가 긁혀버려서 많이 불안하네요차를 잘 알지 못해서 이런부분 하나로 운행하다가 큰 문제가 되어큰사고가 나진않을까 하는 불안함이 생기네요요새 저뿐만아니라 가족들이 제가 운전하다가 무슨일생기는 꿈자리를 많이 꿉니다..
1478,토이푸들이 처음으로 토했어요.. 5개월정도된 토이푸들 암컷인데요 평소랑 똑같이 잘지내다가 오늘 제가 퇴근하고,/qna/detail.nhn?d1id=8&dirId=8050105&docId=298533427,토이푸들이 처음으로 토했어요..5개월정도된 토이푸들 암컷인데요평소랑 똑같이 잘지내다가오늘 제가 퇴근하고 왓는데 별 이상없이 잘있엇어요저녁밥은 엄마가줫대구..그래서 불끄고 잘려고 누워서 핸드폰하는데강아지가 꾸억 꾸억 소리를 앉아서 내는거에요놀랫구 먼가 토하려는거같아서 등을 쳐줫어요그러니까 초록색같은걸 토하더라구요토하구 다시 눕긴했는데 왜이럴까요...멀잘못먹은건지 ..너무 걱정되요 ㅠㅠ
1479,겔랑 인천공항 면세점에도 있나요?,/qna/detail.nhn?d1id=8&dirId=81205&docId=298533424,파운데이션을 살려고하는데 겔랑이 인천공항 면세점에도 있는지 궁금해요!
1480,현재 중3이고요 친구들의 비해 머리숱이 적어서 걱정입니다. 외가 쪽으로는 숱이 많긴 한데 친가는 머리숱이 많,/qna/detail.nhn?d1id=8&dirId=8030206&docId=298533410,현재 중3이고요 친구들의 비해 머리숱이 적어서 걱정입니다. 외가 쪽으로는 숱이 많긴 한데 친가는 머리숱이 많이 적어요 특히 할아버지는 거의 없으시구요..그래서 정수리부분이 살짝 머리가 빠지는 느낌이 드는 것 같기도 하네요ㅠㅠ 아직은 꽤 있지만 걱정되네요근데 궁금한게 있는데 머리 많이 감으면 탈모를 유발하고 그러나요? 보통 하루에 한번은 무조건 씻고 어떤날은 두번씩도 감는데 궁금합니다. 참고로 제 머리는 건성에 가까워요. 답변부탁드려요^^
1481,질문이 있습니다 저희집에 강아지 2마리 있는데 토이 푸들 10개월 7개월 이렇게 있어요 근데 7개월이 좀 많,/qna/detail.nhn?d1id=8&dirId=8050104&docId=298533394,질문이 있습니다 저희집에 강아지 2마리 있는데 토이 푸들 10개월 7개월 이렇게 있어요 근데 7개월이 좀 많이 짖어요 사람들 보고 그래서 제가 여자친구한테도 산책나가면 사람들보고 안짖게 하라도 해요 제가 산책 나가면 이제 사람들보고 안짖게 목줄 당기면서 안되 라고 머즐도 한번씩 잡아서 안되 하고 사람들 딱 옆에 지나갈때부터 미리 목줄로 인되 하고 못짖게 하거든요 근데 이번에 여자친구가 애들산책을 나갔다 왔는데 7개월 애가 사람들보고 막짖다가 지나가는 고딩들 한테 짖으니꺼 고딩들 중 한명이 저희 개 앞까지와서 발을 땅에 막치면서 왔대요 그걸 저한테 얘기를 하는데 저는 여자친구 한테 뭐라했죠 강아지 짖게 나두지 말라니까 강아지가 짖는거 알면서 못짖게 해야지 항상 말 하지 않았냐 사람들보고 못짖게 하라고 우리야 뭐 이쁘니까 짖든 괜찮을수 있지만 다른사람들은 무서워할수 있다고 이렇게 말해도 왜 내편 안들어주냐고 뭐라하고 우리 강아지가 밟힐뻔 했다니까? 이러는데 솔직한 감정으로는 그쪽도 그런식으로 한건 화가 나죠 당연히 화가나는데 반려견을 키우는 주인으로써는 책임감이 있어야 하잖아요 남한테 피해주면 안되니까 애초에 못짖게 해야되는데 주인이면 내가 강아지가 이쁘다고 다 괜찮다고 생각하지말고 우선 다른사람에게 피해를 주면 안된다고 생각하거든요 전 그래서 여자친규한테 뭐라하니 왜 그쪽 편 드냐고 싸웠거든요 이게 제가 질못일까요? 제가 만약 그상황이라면 그쪽한테 화가 많이 날수도 있지만 오히려 전 제 자신한테 화가 날거같아요 내가 주인인데 우리강아지가 이렇게 짖을동안 나둔 저한테 화가 날거같아요 애초에 못짖게 하면 이런일은 없으니까 다른사람이 봤을땐 어떤가요??
1482,대구 수성못에 냉면/고기집 추천해주세요,/qna/detail.nhn?d1id=8&dirId=80208&docId=298533391,더워서 냉면 먹으려는데 고기집 말고는 안 팔잖아요~그래서 은근슬쩍 고기도 먹으려는데 엄마랑 가려구요추천해주세요
1483,50대 남성 선물,/qna/detail.nhn?d1id=8&dirId=80107&docId=298533387,안녕하세요 저는 16살 돈이 많지 않은 학생입니다 아버지가 곧 생신이세요 그래서 검색해보니 넥타이 지갑 이런 것들이 많이 나오더라구요 저희 아버지는 공장에 다니셔서 넥타이 이런 거 안하시고 얼굴에 뭘 바르는 걸 귀찮아하세요 지갑이랑 면도기 이런 건 저번에 다 선물해드리거나 이번에 어머니께서 사오셨구요 그래서 뭘 선물해드려야 할지 모르겠어요 학생이라 지갑사정도 고려해야 하구요ㅜㅜ 추천 좀 부탁드려요
1484,중1인데 이번주 금요일이 개교기념일이라 학교를 안가는데 금요일에 귓볼을 뚫는다면 뚫고나서 어떻해야하나요 ?막,/qna/detail.nhn?d1id=8&dirId=814&docId=298533361,중1인데 이번주 금요일이 개교기념일이라 학교를 안가는데 금요일에 귓볼을 뚫는다면 뚫고나서 어떻해야하나요 ?막 소독이나 몇일까지 냅두거나 그런거요
1485,강냉이엿술에 대해,/qna/detail.nhn?d1id=8&dirId=80201&docId=298533330,강원도 강냉이엿술에 대해서 네이버에 나와 있는 지식 외에 다른 정보를 좀 더 자세하게 알려주세요강냉이엿술의 유래라던가 만드는 방법이라던가 강냉이엿술만의 효능이라던가 자세히 알려주세요! 급해요ㅠㅠ추가내공 100겁니다.
1486,단추는 무엇으로 닦나요?,/qna/detail.nhn?d1id=8&dirId=80903&docId=298533329,인터넷으로 블라우스를 구매해서 오늘 배송 받았는데 옷을 확인하는데 단추가 하얀색인데단추를 바닥에 돌아 다녔는지 뭐가 묻어 있어요.반품하자니 배송비가 아깝네요.무엇으로 닦나요?
1487,고양이 구토,/qna/detail.nhn?d1id=8&dirId=80511&docId=298533326,고양이가 토를 해요한달에 한번씩은 사진처럼 노란색 액체에 하얀 거품이 있는 토를 합니다.. 토를하기전에 몸이 꿀렁꿀렁 앞뒤로 움직이고 토를한다음엔 평소처럼 잘지내긴해요 근데 걱정되요병원에 물어보니까 그냥 평소처럼 지내는지 잘 살펴보라고 할뿐인데.. 걱정이되서그런데 정밀검사를 해봐야하나요?주기적으로 토를하는 이유가뭘까요?
1488,1.0이면,/qna/detail.nhn?d1id=8&dirId=80701&docId=298533266,얼마야???
1489,노래방에서 본 뮤비 노래 제목,/qna/detail.nhn?d1id=8&dirId=80701&docId=298533238,어느 노래방인진 기억이 안 납니다.두 세번정도 본 뮤비인데뮤비만 봐서 노래 제목을 모르겠네요기억나는 장면으로는초반~ 후반 남자가 택시에서 노래하는 장면(후반부에 택시 기사가 샘 해밍턴으로 나옴.미터기 말이 뛰는 장면중간에 개그맨 유민상씨와 김준현씨가 남자 양 옆에 앉아있는 장면도 있더라구요)쇠고랑을 찬 듯한 손 동작을 좌 우로 기울이는 안무가 있음중간중간 넓은 칸 화장실에 앉아있는 장면도 있던..(벽이 주황색이였음)대충 기억나는건 요정도인데 아는 분 계시나요...?내공 80 드려여
1490,"2006년식 NF소나타 휘발유 현재 순정 흡기에서 오픈흡기로 바꾸려는데요, 인테이크 안짜고 순정파이프에 연결",/qna/detail.nhn?d1id=8&dirId=8110301&docId=298533226,"2006년식 NF소나타 휘발유현재 순정 흡기에서 오픈흡기로 바꾸려는데요,인테이크 안짜고 순정파이프에 연결시키면 따로 돈안들어가나요?사진과 같이 저거만 구매하여 순정파이프에 연결시킨다는 가정하에 공업사가면 얼마정도 나올까요?"
1491,저희 집 강아지가 사료만 먹으면 화를내요 ㅠㅠ 종은 비숑이고 15개월정도됐어요. 사료만 먹으면 막 몸을 비비,/qna/detail.nhn?d1id=8&dirId=8050103&docId=298533210,저희 집 강아지가 사료만 먹으면 화를내요 ㅠㅠ종은 비숑이고 15개월정도됐어요. 사료만 먹으면 막 몸을 비비고 화를 내내요 ㅠㅠ 왜그런거죠?
1492,계기판키로수 질문,/qna/detail.nhn?d1id=8&dirId=8110202&docId=298533196,자동차계기판이 고장나서 계기판은 저렴하게 구입하여 집에서 직접교환했습니다... 현재 키로수는 0이며 원래 키로수가 32만키로 인데 0인 계기판을 원래 키로수로 바꾸고 싶은데 어떻게 하나요?
1493,안녕하세요 고3 여학생입니다 제가 살을 빼고싶은데요 학교에 다니다보니 수업듣는다고 앉아있을 시간이 많고 배도,/qna/detail.nhn?d1id=8&dirId=814&docId=298533195,안녕하세요 고3 여학생입니다제가 살을 빼고싶은데요 학교에 다니다보니 수업듣는다고 앉아있을 시간이 많고 배도 금방 고파서 밥도 많이 먹게돼요 진짜 허벅지에 살 붙고 배에 튜브가 하나 늘어난 게 느껴질 정도로 살이 쪘습니다 ㅠㅠㅠ운동은 학교 끝나면 7시부터 11시까지 계속 앉아서 수업 들어야하기 때문에 할 시간이 전혀 없습니다 ㅠㅠ학교 다니면서 다이어트 할 수 있는 방법 알려주세요그리고 운동을 좀 많이 하고 싶은데 시간이 없어서 틈틈이 할 수 있는 운동도 알려주세요
1494,베란다에서 몇달전부터 잊어버릴만하면 애벌레가 1~3마리씩 나오는데요 ㅠㅠ 무슨 벌레고 어떻게 퇴치하는지 좀,/qna/detail.nhn?d1id=8&dirId=80901&docId=298533183,베란다에서 몇달전부터 잊어버릴만하면 애벌레가 1~3마리씩 나오는데요 ㅠㅠ 무슨 벌레고 어떻게 퇴치하는지 좀 알려주세요 ㅠㅠ
1495,배우 최예슬 폰케이스,/qna/detail.nhn?d1id=8&dirId=80403&docId=298533178,이 케이스 어디껀지 아시나요ㅠㅠ?
1496,잔머리 없애는 법,/qna/detail.nhn?d1id=8&dirId=80302&docId=298533168,요즘에 이마 쪽(앞머리가 자라는 부분)에 잔머리가 자라서 거의 앞머리(처피뱅 길이정도) 수준으로 길었어요 그래서 진짜 보기 싫은데 이걸 어떻게 숨기죠 이거 말고도 정수리쪽이라 해야하나 아무튼 그런 쪽에도 조금 잡초처럼 자랐어요. 따로 없애는 방법은 없나요... 앞머리는 없고 긴 생머리입니다
1497,1. 만19세 이상부터 친권 소멸 되는거 맞죠? 2.주민등록상 친권이 있던 사람들이 만19세 이상의 자녀에,/qna/detail.nhn?d1id=8&dirId=80102&docId=298533153,1. 만19세 이상부터 친권 소멸 되는거 맞죠?2.주민등록상 친권이 있던 사람들이 만19세 이상의 자녀에 대해 가출 또는 실종 신고를 했는데 그 자녀가 친권이 있던 사람들을 만나길 원치 않을경우 자녀는 본인의 소재지를 밝힐 의무는 없는거죠?3.2번의 경우에 대해 경찰에 미리 난 실종이 아니라 그 사람들로부터 잠적한거다 라고 밝혀놓으면 그렇게 조치를 취해 주나요?
1498,찐배그에서 이름을 바꿀려고 하는데 왜 안되는건가요 저 중국어가 뭐라는지 모르겠네요,/qna/detail.nhn?d1id=8&dirId=806&docId=298533117,찐배그에서 이름을 바꿀려고 하는데 왜 안되는건가요저 중국어가 뭐라는지 모르겠네요
1499,여드름 흉터질문이요 중3인데 제 인중쪽엔 여드름이 많이 나요 그래서 어머니께서 가끔씩 짜주시는데용 근데 짜다,/qna/detail.nhn?d1id=8&dirId=8030102&docId=298533101,여드름 흉터질문이요중3인데 제 인중쪽엔 여드름이 많이 나요그래서 어머니께서 가끔씩 짜주시는데용근데 짜다보면 인중주면에 검은색(?)과 붉은 흉터라고 해야할까 쨋든 그런게 있습니당피부가 좀 깨끗해보이고 싶은데 인중땜에좀 드러워보입니다. 메디큐브 후기가 좋아보여서살려하는데 어떤가요결론만 좀...
1500,여드름 흉터질문이요 중3인데 제 인중쪽엔 여드름이 많이 나요 그래서 어머니께서 가끔씩 짜주시는데용 근데 짜다,/qna/detail.nhn?d1id=8&dirId=8030102&docId=298533101,여드름 흉터질문이요중3인데 제 인중쪽엔 여드름이 많이 나요그래서 어머니께서 가끔씩 짜주시는데용근데 짜다보면 인중주면에 검은색(?)과 붉은 흉터라고 해야할까 쨋든 그런게 있습니당피부가 좀 깨끗해보이고 싶은데 인중땜에좀 드러워보입니다. 메디큐브 후기가 좋아보여서살려하는데 어떤가요결론만 좀...
1501,탈색 후 애쉬퍼플 염색했는데 일주일만에 밝은 갈색이 되었어요. 색이 너무 맘에 안들어서 탈색 직후의 노란색을,/qna/detail.nhn?d1id=8&dirId=8030203&docId=298533086,탈색 후 애쉬퍼플 염색했는데 일주일만에 밝은 갈색이 되었어요.색이 너무 맘에 안들어서 탈색 직후의 노란색을 다시 원한다면 탈색을 다시 해야할까요?
1502,EMS택배EV863072062CN 3월26일에 국제물류센터에 도착했다는데 아직도 안오네요 언제 받을수 있을까,/qna/detail.nhn?d1id=8&dirId=81301&docId=298533074,EMS택배EV863072062CN 3월26일에 국제물류센터에 도착했다는데 아직도 안오네요 언제 받을수 있을까요?
1503,안녕하세요 중고로 티볼리 아머 lx 가솔린 17년 2월 식 18800km 2050만원달라는거 1970만원주고,/qna/detail.nhn?d1id=8&dirId=8110201&docId=298533072,안녕하세요중고로티볼리 아머 lx 가솔린 17년 2월 식 19000km2050만원달라는거 1970만원주고 샀습니다전액현금으로 주고 샀는데 국세청에들어가보니 현금영수증이 1700만원만 되어있었습니다화가나서 딜러에게 물어보니 깎아줘서 남는게 없었다며 이전비를 1970만원에 8% 낸걸1700 만원에 8%계산해서 돌려준다고하고 신고하지말아달라고합니다.신차 가격이 2300만원(부가세제외)이라 비싸게주고 산 거같아 화가났었는데 이런 상황에 어떻게해야하나요..??소비자고발센터에 신고하면되나요??돈 돌려받을수있나요??
1504,매일 매일 행복해,/qna/detail.nhn?d1id=8&dirId=80701&docId=298533057,나 너무 행복해 내 자랑 좀 들어줄 수 있어?
1505,엘지 벽걸이 에어컨입니다 모델명은 LM-V320RSF 이구요 2004년 1월제조입니다 2월에 오피스텔로 이사,/qna/detail.nhn?d1id=8&dirId=80902&docId=298533045,엘지 벽걸이 에어컨입니다 모델명은 LM-V320RSF 이구요 2004년 1월제조입니다 2월에 오피스텔로 이사왔는데 에어컨 냉방 램프가 2초간격으로 두번씩 깜빡거려요 리모컨 건전지 사서 운전 버튼누르면 에어컨 날개부분이 한번 열렸다가 닫히면서 작동이 안되네요 무슨 문제일까요?
1506,제빵에들어가는재료들 성분이뭐가들어잇는지궁금해요 예를들어서밀가루는뭐뭐 설탕은뭐뭐같이요,/qna/detail.nhn?d1id=8&dirId=80201&docId=298533041,제빵에들어가는재료들 성분이뭐가들어잇는지궁금해요 예를들어서밀가루는뭐뭐 설탕은뭐뭐같이요
1507,인바디좀봐주세요,/qna/detail.nhn?d1id=8&dirId=8030402&docId=298533033,바지25 26 입고요옷사이즈44에서 44반입는데왜이렇게나오는거죠?가슴도70E컵인데뭐죠?
1508,형이 맨날 엄마한테 쌍욕을 하고 집 벽을 지금 4군데 정도 부시고 그래서 빛이 2000만원 쌓일 예정입니다,/qna/detail.nhn?d1id=8&dirId=814&docId=298533016,형이 맨날 엄마한테 쌍욕을 하고집 벽을 지금 4군데 정도 부시고그래서 빛이 2000만원 쌓일예정입니다텔레비전이나 컴퓨터를 부십니다가끔 형이랑 싸우기도 하는데정말로 치고 박고 싸우는게 아니라죽일듯이 싸웁니다어머니는 매일 형때문에 뛰어내리고 말하십니다저도 더이상 형때문에 살기 싫어지네요형을 신고 가능할까요
1509,나쁜 손 전남친,/qna/detail.nhn?d1id=8&dirId=80101&docId=298533013,안녕하세요 올해 중2인 여중생입니다한 몇주 전 저는 남친을 사귀었는데요저도 그 아이에게 관심이 있어서 페이스북 메세지도 하고 그랬는데어느날 그 아이가 자기가 저한테 키스를 하면 어떠하냐고 물어서저는 그냥 장난으로 맞장구를 쳐 줬었어요 그러고 나서 한 8시 쯤에 어디서만나자고 하는거에요그래서 전 가가지고 만나서 얘기를 하는데 걔가 자기는 내가 좋은데 사귈지 말지에 대해 고민을 하는거에요그래서 저는 사귀자고 하고 얘기를 했는데 얘기를 하다 걔가 절 약간 으슥한 곳에 데리고 가서 갑자기 키스를 하는거에요 당황스러웠지만 밀칠 수가 없어서 그대로 있었는데 윗옷으로 손을 넣어서 가슴을 만지더군요 아래로도 손을 넣으려고 하는걸 제가 겨우 막았습니다어쨌든 그러고도 한 5일 정도 만났는데 만날 때 마다 키스하고 하지말라고 하는데도 해서 결국 제가 찼스빈다. 그때 제가 어떻게 했어야 옳은 행동이었을까요?
1510,중고차를 구매했습니다. 인천에서! 그것도 아주 비싸게! 14년식 bmw 520d 를 5100만원에 샀습니다.,/qna/detail.nhn?d1id=8&dirId=81103&docId=298533011,"중고차를 구매했습니다. 인천에서! 그것도 아주 비싸게! 14년식 bmw 520d 를 5100만원에 샀습니다. 같은 급으로 벤츠도 5000만원이 넘고 같은급에 재규어 13년식도 4천중반이 넘고 대체 인터넷있는 3천대 차량들은 뭔가요? 인천중고매장에서는 4000천대도 침수차량, 사고차량, 불량차량들이라고 하는데 진짜 맞는건가요?"
1511,탈색후에염색한후 머리색변화,/qna/detail.nhn?d1id=8&dirId=8030203&docId=298533008,제가 머리 밑부분을 탈색을하고 레드계열로 염색을 했었어요 그러고 나서 색이 빠져서 같은 브랜드 같은색상인데 컬러트리트먼트로 나온제품으로 색을 입혔는데 색이빠지면서 탈색한부분 머리색이 초록색이되었어요...근데 그리고나서 점점 초록색이 탈색하지않은 머리위로올라오는데... 해결방법이없을까요...
1512,목재 흡음판 가공법 및 단타공 이중타공 라인타공의 특징이 뭔지 알고싶어요,/qna/detail.nhn?d1id=8&dirId=80802&docId=298532977,목재 흡음판 가공법 및 단타공 이중타공 라인타공의 특징이 뭔지 알고싶어요
1513,버츠비 립밤 향 추천 해주세요! 바닐라빈이랑 자몽중에 어떤거 살까 고민중인데 둘중 뭐가 더 나을까ㅇ요,/qna/detail.nhn?d1id=8&dirId=814&docId=298532974,버츠비 립밤 향 추천 해주세요!바닐라빈이랑 자몽중에 어떤거 살까 고민중인데 둘중 뭐가 더 나을까ㅇ요
1514,이니스프리 노세범 파우더 사용질문,/qna/detail.nhn?d1id=8&dirId=8030104&docId=298532968,이니스프리 노세범 파우더 사용질문
1515,안녕하세요 358회 신동엽이 입은 옷 어디껀지 알수있을까요ㅠㅠㅠ,/qna/detail.nhn?d1id=8&dirId=8040101&docId=298532967,안녕하세요 358회 신동엽이 입은 옷 어디껀지 알수있을까요ㅠㅠㅠ
1516,아침은 학교다니느라 바빠서 못먹고 점심엔 고구마1개 사과1개 두유 먹고 저녁엔 바나나1개 삶은계란1개 우유,/qna/detail.nhn?d1id=8&dirId=8020101&docId=298532941,아침은 학교다니느라 바빠서 못먹고점심엔 고구마1개 사과1개 두유 먹고저녁엔 바나나1개 삶은계란1개 우유 먹으려 하는데식단 괜찮나요 ?
1517,집가는길에 강아지,/qna/detail.nhn?d1id=8&dirId=80501&docId=298532923,집에가는길에 항상 저녁8시쯤에 가는데 집가는데 주인 있는건지 없는건지 암튼 개가 있어가지고 맨날 돌아가요 ㅠㅠ 이럴때는 경찰에 말해야 하나요 119에 도와달라고 하나요 아니면 마을회관 가나요 어쩌죠 ㅠ
1518,다이소 방묘문(현관에 펜스) 만들려고 하는데 재료구매목록 알려주세요!!! 자꾸 현관문 열때 나가려고해서 하나,/qna/detail.nhn?d1id=8&dirId=8080105&docId=298532902,다이소 방묘문(현관에 펜스) 만들려고 하는데 재료구매목록 알려주세요!!!자꾸 현관문 열때 나가려고해서 하나만들려고 합니다.가로 108cm 세로 67cm 로 ㄴ자로 만들어야 하는데 재료 알려주세요!!
1519,지금 현재 제 팀단점이나보완해야할부분또는선수등조언이나충고해주세여 좋은답변내공100드립니다,/qna/detail.nhn?d1id=8&dirId=8030207&docId=298532901,지금 현재 제 팀단점이나보완해야할부분또는선수등조언이나충고해주세여 좋은답변내공100드립니다
1520,코주변이나 코나 화농성 여드름이나 색소침착 이랑블렉헤드 모공까지 넓으면 코 더 부어 보여요??,/qna/detail.nhn?d1id=8&dirId=8030101&docId=298532888,코주변이나 코나 화농성 여드름이나 색소침착 이랑블렉헤드 모공까지 넓으면 코 더 부어 보여요??
1521,탈색한번 한 머리이고 손상된편인데 6개월 전에 s컬했었다가 이번에 레이어드 c컬펌으로 했어요. 근데 오늘 머,/qna/detail.nhn?d1id=8&dirId=8030202&docId=298532836,탈색한번 한 머리이고 손상된편인데6개월 전에 s컬했었다가 이번에 레이어드 c컬펌으로 했어요. 근데 오늘 머리 감았더니 다 풀려있고 부시시해졌는데 원래 이런건가요?원래 있던 s컬펌도 그대로 남아있었어요
1522,갈바 간판 제작 비용 문의!,/qna/detail.nhn?d1id=8&dirId=808&docId=298532834,갈바 간판 제작 비용 문의드립니다!현장에서 견적 받아야 정확하게 아는게 맞긴한데..대략적으로라도 좀 알고 싶어서요!이미지상으로는 굴곡?물결 이미지인데가능하면 이미지대로인 굴곡있는거랑 민자랑 두가지로 비용이 어떻게 될지 알고 싶어요~~!출입문도 전체적으로 생각하고 있습니다.답변 부탁드립니다^^!
1523,아디다스 반바지 질문드립니다!!!,/qna/detail.nhn?d1id=8&dirId=8040105&docId=298532829,아디다스 트레이닝 반바지 찾고 있는데요원래 입고 있던게 BK7468 입니다면 70%에 폴리 30% 재질의 옷 입니다폴리 100입을려니 너무 불편해서 못입겠더라구요 ㅠㅠBK7468 처럼 아디다스 면 반바지 추천좀 부탁드립니다!!!되도록이면 바지옆에 삼선 없는것좀 부탁드리겠습니다.내공 500 겁니다!
1524,골반이 틀어지면 골반 좁아보이나요..?,/qna/detail.nhn?d1id=8&dirId=8030402&docId=298532800,안녕하세요키는 160이 조금 안되고 골반이 94cm 거든요예전엔 주변에서 골반이 하도 크다해서 너무 스트레스였어요일부러 긴 상의로 엉덩이쪽 가리고 다니고 치마도 h라인은 부담스러워서 안입고..하체 다이어트하면 골반도 빠질까싶어서 하체운동만 하고..아무튼 그랬는데 점점 글래머러스한 몸매로 미의 기준이 바뀌고저도 글래머러스한 몸매를 좋아하게 되었는데요즘엔 제가 봐도 골반이 커보인다는 생각이 전혀 안들어요..그리고 몇년 전부터 골반이 접지르는 느낌?이 들면서 아프고치마나 바지 심지어 팬티까지 한쪽으로 돌아가서 너무 불편해요골반이 많이 틀어진거 같아서 이제 교정을 해보려고 하는데혹시 골반이 틀어지면 골반이 좁아보일수도 있는건가요??
1525,이색으로 염색 하고 싶은데 현재 모발은 탈색후 입니다 일반염색약 사서 하려고 하는데 섞어야 한다고 하더라구요,/qna/detail.nhn?d1id=8&dirId=8030203&docId=298532789,이색으로 염색 하고 싶은데 현재 모발은 탈색후 입니다일반염색약 사서 하려고 하는데섞어야 한다고 하더라구요~혹시 어떤색끼리 섞어야 하는지 아시는분 계실까요??
