,0,1,2
948,가로수 이름이 뭐죠 고속도로에도 잇고 집 주변에도 잇어여 잎은 굉장히 커요 손바닥보다 크고 약간 캐나다 국기,/qna/detail.nhn?d1id=9&dirId=90102&docId=298457245,가로수 이름이 뭐죠 고속도로에도 잇고 집 주변에도 잇어여 잎은 굉장히 커요 손바닥보다 크고 약간 캐나다 국기 나뭇잎 모양이고 나무도 엄청 크고 높아요
949,군 복무가 끝났는데 ibk 나라사랑카드로 롯데월드 할인을 받을수 있나요?,/qna/detail.nhn?d1id=9&dirId=90103&docId=298457202,군 복무가 끝났는데 ibk 나라사랑카드로 롯데월드 할인을 받을수 있나요?
950,이과 홍대 들어가려면 등급 얼마나 되야하나요 정시입니당 낮은과도 알려주세요,/qna/detail.nhn?d1id=9&dirId=90107&docId=298457196,이과 홍대 들어가려면 등급 얼마나 되야하나요 정시입니당 낮은과도 알려주세요
951,태국 철근조사,/qna/detail.nhn?d1id=9&dirId=9020103&docId=298457110,"제가 지금 태국 철근조사 하고있습니다.규격,사이즈 혹시 알수 있는사이트 알수 있을까용 ???알려주시면 좋겠습니다 ^^"
952,이과 홍대 들어가려면 등급 얼마나 되야하나요(정시) 낮은과라도 괜찮아요,/qna/detail.nhn?d1id=9&dirId=90107&docId=298457077,이과 홍대 들어가려면 등급 얼마나 되야하나요(정시)낮은과라도 괜찮아요
953,99년생이고 생일 안 지났는데 혼숙 가능한가요? 부산여행 가려고 하는데 혹시나 입실이 불가할까봐오ㅠㅠ,/qna/detail.nhn?d1id=9&dirId=9011401&docId=298456990,99년생이고 생일 안 지났는데 혼숙 가능한가요?부산여행 가려고 하는데 혹시나 입실이 불가할까봐오ㅠㅠ
954,허블의 법칙에 따르면 우주의 팽차은 두 물체 사이의 거리와 비례한다는 것이잖아요. 그렇다면 공간이 늘어난다는,/qna/detail.nhn?d1id=9&dirId=90102&docId=298456820,허블의 법칙에 따르면 우주의 팽차은 두 물체 사이의 거리와 비례한다는 것이잖아요. 그렇다면 공간이 늘어난다는게 아닌가요? 만약 공간이 늘어난다면 서울이랑 부산도 언젠가는 1000km가 된다는 말 아닌가요?
955,이런 링바인더 찾아요! 구멍 뚫린 부분 가려져있어요,/qna/detail.nhn?d1id=9&dirId=90111&docId=298456669,이런 링바인더 찾아요! 구멍 뚫린 부분 가려져있어요
956,중국 상하이 교통편 문의,/qna/detail.nhn?d1id=9&dirId=9020102&docId=298456628,"오는주 4월 6일 ~ 9일까지 상해 출장이 있습니다. 13일까지도 될수 있구요.예전 상해에서 지하철로 고생한 경험이 있어 문의를 드립니다.푸동공항 도착인데... 오는편이 아침 8시 30분 푸동공항 출발이라...목적지가 安亭(Anting) 인데 공항과 매우 떨어져있는 11호선 끝이네요 ㅠㅠ도착이야 오전이라 상관은 없지만...오는편 비행기때문에 어찌해야할지 고민입니다. 새벽에 일어나서 출발을 해야할것 같구요.자신이 없으면 택시라도 타면 될거 같은데,,,같은 호선이라도 갈아타는 그런 경험이 있어서...지하철로 빠른 환승구간이나 빠른 교통편 부탁드립니다.그리고 安亭쪽 지낼만한 괜찮은 호텔도 부탁드립니다.우리나라 5만원 모텔급이면 좋은데... 상해는 호텔이 비싸서...10만원~15만원은 되어야겠죠?출장이라도 실비정산이라 비싸면 곤란한 입장이라 ㅠㅠ추가적으로 시간날때 짬을내서 1-2군데 관광도 할려고합니다.와이탄이나 갈만한곳 추천해주세요.문의드립니다."
957,면세점에서 현금으루 상품권으로 바꾸면 싸다든데 상품권은 어디서 바꾸는건가요? 그러고 상품권으로 물건을사고 남,/qna/detail.nhn?d1id=9&dirId=902&docId=298456442,면세점에서 현금으루 상품권으로 바꾸면 싸다든데 상품권은 어디서 바꾸는건가요? 그러고 상품권으로 물건을사고 남으면 현금으로 다시 바꿀수 잇나요?
958,용인에서 예산,/qna/detail.nhn?d1id=9&dirId=90109&docId=298455983,용인에서 예산가는 방법 뭐가 있을까요...? 직통으로요!!!!..
959,롯데월드 매직패스 티켓 안녕하세요 학교에서 롯데월드나 에버랜드로 현체 간대서 알아보고 있는데 롯데월드에 매직,/qna/detail.nhn?d1id=9&dirId=90103&docId=298455937,"롯데월드 매직패스 티켓안녕하세요 학교에서 롯데월드나 에버랜드로 현체 간대서 알아보고 있는데롯데월드에 매직패스가 있잖아요 근데 그걸 들어보니까 일찍 아침에 미리가서 10만원 정도 주고 사면 놀이기구 기다리지 않고 다 탈 수있다고 하더라구요 그래서 롯데월드 매직패스 티켓 어떻게 사는지 알려주시구 어디서 살 수있는지 알려주세요에버랜드도 큐패스 티켓을 어디서 어떻게 구매해서 뭘 탈 수있는지 자세히 알려주세요롯월,에버 둘다 구체적으로 자세히 알려주시면 내공 10더드림"
960,후쿠오카 빵집에서 빵을 사가고 싶은데 보안검색대에서 걸릴까요? 만약에 위탁수화물로 하면 가능한지 알려주세요ㅠ,/qna/detail.nhn?d1id=9&dirId=9020102&docId=298455732,후쿠오카 빵집에서 빵을 사가고 싶은데보안검색대에서 걸릴까요?만약에 위탁수화물로 하면 가능한지 알려주세요ㅠ
961,한국농수산식품유통공사 체험형 인턴 말고 정규직 채용할때 고졸도 지원가능한가요?? 농고 농과 나왔습니다..,/qna/detail.nhn?d1id=9&dirId=9020101&docId=298455725,한국농수산식품유통공사 체험형 인턴 말고 정규직 채용할때 고졸도 지원가능한가요?? 농고 농과 나왔습니다..
962,보성 대한다원의 윤리적관점이랑 사회적관점이랑 시간적관점 공간적관점좀 알려주세요 빨리요ㅠㅠ,/qna/detail.nhn?d1id=9&dirId=90102&docId=298455681,보성 대한다원의 윤리적관점이랑 사회적관점이랑 시간적관점 공간적관점좀 알려주세요 빨리요ㅠㅠ
963,캐리비안베이에서 위에 기능성입고 아래는 래쉬가드 입으면 놀이기구?같은거 못타나요?,/qna/detail.nhn?d1id=9&dirId=90103&docId=298455387,캐리비안베이에서 위에 기능성입고 아래는 래쉬가드 입으면 놀이기구?같은거 못타나요?
964,미국에 가는데요. 이모드릴려구 떡1킬로정도를 비행기 위탁수화물로 부칠려구 하는데 혹시 금지 품목일까봐 궁금해,/qna/detail.nhn?d1id=9&dirId=90207&docId=298455328,미국에 가는데요.이모드릴려구 떡1킬로정도를 비행기 위탁수화물로 부칠려구 하는데 혹시 금지 품목일까봐 궁금해서요.그리고 떡볶이와 떡볶이 소스도 괜찮나요?
965,일본여행 편도 항공권 입국심사,/qna/detail.nhn?d1id=9&dirId=90207&docId=298454858,제가 이번에 일본여행을 친구와 함께가는데 시간이 잘 안 맞아서 어쩔수 없이 편도로 갈때는 제주 항공 올때는 피치항공을 끊었습니다 갈때는 인천공항가서 제주 항공에서 발권을 받아서 가겠지만돌아오는 피치항공 e티켓은 제가 대표자로 되어있고 한장에 2명에 이름이 다 들어가 있습니다일본 입국심사할 때 한국으로 돌아오는 항공편을 보여달라고 한다던데 그러면 저희는 2명인데 어떻게 보여줘야하나요?e티켓을 2장 출력해서 각각 보여줘도 되나요?저는 스마트폰에 저장을 해뒀는데 나머지 한명은 어떻게 보여줘야할지 궁금합니다
966,아프리카 프릭샷 질문,/qna/detail.nhn?d1id=9&dirId=90205&docId=298454835,아프리카 게임bj들 보면 게임화면안에 캠영상넣어서 보잖아요? 그거 어떻게 하는건가요?저는 pc 화면 캡쳐+ 캠화면 추가 해서 하는데 자꾸 pc화면뒤로 캠이 사라집니다.
967,일반여행과 공정여행 비교하는 것에는 어떤 것이 있을까요? 예)서유럽 내공100!!,/qna/detail.nhn?d1id=9&dirId=9020304&docId=298454699,일반여행과 공정여행 비교하는 것에는 어떤 것이 있을까요?예)서유럽내공100!!
968,제가 초6여인데 수학여행을 6월달에 갑니다 강원도에 가구여~~ 질문하겠습니당 1.강원도 가면 코스가 어떻게,/qna/detail.nhn?d1id=9&dirId=90108&docId=298454694,"제가 초6여인데 수학여행을 6월달에 갑니다강원도에 가구여~~질문하겠습니당1.강원도 가면 코스가 어떻게 되나요?(첫째날,둘째날,셋째날 전부 대충 뭐하는지)2.콘도는 아마 어디로 갈까요??3.옷은 뭐 입고 가면 좋을지 적어주세요(치마 넣어서 코디해주시면 좋겠습니댜)(친구들과 맞출거도 적어주세요)(첫째날,둘째날,셋째날 이런식으로)옷은 살겁니당4.사진에 제가 필요한거 다 적어봤는데 이정도면 되는지 알려주세요(사야할 것은 그냥 무시하세용)내공30이구여 광고,이상한 글 신고합니다."
969,인천->일본 후쿠오카 갈때 향수 100ml초과 면세 세금얼마나 내야하나요?? 인터넷 면세점에서 향수 100m,/qna/detail.nhn?d1id=9&dirId=90201&docId=298454557,"인천->일본 후쿠오카 갈때 향수 100ml초과 면세 세금얼마나 내야하나요??인터넷 면세점에서 향수 100ml 115000원에 구입했습니다.(적립금포함금액)향수는 60ml까지만 면세한도라고 하는데 일본으로 입국할때, 한국으로 입국할때 두번 관세를 물어야 하나요??향수는 60ml넘는게 이번이 처음이라 급하게 문의드립니다."
970,오사카 도톤보리 거리,/qna/detail.nhn?d1id=9&dirId=90206&docId=298454507,요즘 오사카 도톤보리 거리에 빠져서 그 거리 사진 배경화면으로 주실수 있으신가요?? (750x1334로 부탁 드립니다 !)
971,삼척 유채꽃밭 가려고 하는데 5월5일날 가도 잘 피어 있을까요?ㅠㅠ 급해용ㅜ,/qna/detail.nhn?d1id=9&dirId=90108&docId=298454461,삼척 유채꽃밭 가려고 하는데 5월5일날 가도 잘 피어 있을까요?ㅠㅠ 급해용ㅜ
972,크리스탈코브 투어없이가는법없나요?,/qna/detail.nhn?d1id=9&dirId=9020104&docId=298454293,수영을못하고 호핑투어는비싸서 ..개인적으로 섬갈수있는방법은없나요?
973,이번에 일본 후쿠오카에서 운세를 뽑앗는데 해석좀 부탁드릴께요..!!,/qna/detail.nhn?d1id=9&dirId=9020101&docId=298453862,이번에 일본 후쿠오카에서 운세를 뽑앗는데 해석좀 부탁드릴께요..!!
974,늦은시간에 면세 관련 질문좀 드리려고합니다 죄송합니다!이번에 일본 오사카 여행을 가려고 하는데 찾아보니 면세,/qna/detail.nhn?d1id=9&dirId=9020104&docId=298453717,늦은시간에 면세 관련 질문좀 드리려고합니다 죄송합니다!이번에 일본 오사카 여행을 가려고 하는데 찾아보니 면세점 할인 쿠폰이 있다는 글을 봐서요!혹시 정보좀 얻을수있을까요~?
975,오사카 일정중 주유패스 구입질문이요 첫째날 교토 둘째날 유니버셜 셋째날 오사카 넷째날 오사카 총3박4일인데,/qna/detail.nhn?d1id=9&dirId=9020101&docId=298453699,오사카 일정중 주유패스 구입질문이요첫째날 교토둘째날 유니버셜셋째날 오사카넷째날 오사카총3박4일인데 주유패스나 교통관련 잘아시는분 도움좀 주세요 ㅠㅠ
976,홍콩/마카오 4박5일 여행코스 및 꿀팁좀,/qna/detail.nhn?d1id=9&dirId=9020102&docId=298453524,"꿀팁및 4박5일 코스좀 짜주세요액태비티 즐기고싶고,맛집투어,쇼핑도 조금 하고,볼거리등 챙기고,트렘타고 스카이 챙기고 등등.."
977,초5남자 여드름,/qna/detail.nhn?d1id=9&dirId=90112&docId=298453303,이제 막 초5인 남학생인데요 사춘기여서그런지여드름이 나네요 이것도 짜면 안돼고 관리 잘 해줘야됀다고 들었는데 관리 어떻게하나요 엄마는 세수할때폼클렌저 인가 뭔가를 하라는데 이게 맞는방법인가요(참고로 제주 탄산 머드 폼 클렌저였을거임)진짜 옷도 막입고 외모도 신경 안쓰는데 피부는신경쓰이네요자세히 설명해주세요
978,저는 중3이구요 이번주 에 썸녀랑 데이트 약속 잡았는데 당진 데이트 장소 추천해주세요!!,/qna/detail.nhn?d1id=9&dirId=90111&docId=298453134,저는 중3이구요 이번주 에 썸녀랑 데이트 약속 잡았는데당진 데이트 장소 추천해주세요!!
979,유럽 여행 기차 질문 드립니다!!!! 도와주세요,/qna/detail.nhn?d1id=9&dirId=90203&docId=298453051,유럽여행을 가고 싶은데 만약 이렇게 가게 된다면 기차표를 어떻게 해야하는지 알고 싶습니다.영국에서 프랑스로 가는 기차는 유로스타 예매 했구요.그 다음 나라부터 너무 어려워서 꽉 막혔어요 ㅠㅠㅠㅠ유레일 패스를 해야할지.. 아님 직접 일일히 예매를 해야할지 그렇다면 어떤 사이트에서 어떤기차를 해야하는지 너무 막막하네요 . 해외사이트 기차 등급별 이름별로 가격도 너무 다른데 뭐가 다른건지..처음이라 전혀 감이 잡히질 않아서 좀 자세히 알려주시면 너무 감사하겠습니다!!ㅜㅜ
980,시베리아 횡단열차,/qna/detail.nhn?d1id=9&dirId=9020309&docId=298452449,1월쯤에 블라디보스톡 가서 열차타고 모스크까지 간 뒤 상트페테르부르크 가서 다시 편도로 올려고 하는데 여행 비용은 어느 정도까지 들까요...?우선 비행기는 알아보니 총 50정도 하는데 나머지를 모르겠네요
981,안녕하세요. 급하게 지식인에 글 올려요. 에어서울 항공권을 익스피디아에서 구매를했는데 특가운임인줄 모르고 결,/qna/detail.nhn?d1id=9&dirId=90207&docId=298452385,안녕하세요. 급하게 지식인에 글 올려요.에어서울 항공권을 익스피디아에서 구매를했는데 특가운임인줄 모르고 결제를 해버렸어요.에어서울 사이트에서 예매한게 아니라서 사전 위탁수화물 구매가 안되는것 같아요 공항에서 구매하면 얼마인지 알 수 있을까요?가격을 확인한다고 누르는과정에서 와이파이 상태가 잠시 이상했고 버퍼링 상태에서 바로 결제로 넘어가 버렸어요 ㅠㅠㅠ환불도 못하고...싼게 비지떡이 되버렸네요 ㅜㅜ 한국에서 오사카 가는 편도구요 공항에서 구매시 얼마인지 아시는분 답변 부탁드립니다
982,나바호킴님~ 샌프란시스코 일정 조언부탁드립니다. 5월3일 목요일 10시40분 오전 도착입니다. 숙소는 유니온,/qna/detail.nhn?d1id=9&dirId=9020201&docId=298452374,"나바호킴님~샌프란시스코 일정 조언부탁드립니다.5월3일 목요일 10시40분 오전 도착입니다.숙소는 유니온스퀘어입니다.2박3일일정이고 5월 5일 3시 비행기로 라스베가스로 갑니다^^피셔맨와프 , 금문교, 롬바르도길, 소샬리토, 알베크루즈 투어, 트윈픽스, 피어 등 명소들을 보고싶습니다. 스탠포드대학은 멀어서 뺄려고합니다.가장 무난한 루트와 교통편 조언 부탁드립니다.감사합니다~^^"
983,외국 서양 영환데 막 여자아이랑 남자아이 나오는데 맨날 강?계곡을 줄타고 넘어가다가 어느날 여자아이가 죽고,/qna/detail.nhn?d1id=9&dirId=90104&docId=298452369,외국 서양 영환데 막 여자아이랑 남자아이 나오는데 맨날 강?계곡을 줄타고 넘어가다가 어느날 여자아이가 죽고 남자아이가 물감 계곡에 다 짜버리는 영화였어요ㅜㅜ 부탁드립니다
984,친구랑 5월달에 에버랜드 가려는데요 스마트예약 가입이 04부터 되더라고요저는 05라서 부모님정보로 가입해도,/qna/detail.nhn?d1id=9&dirId=90103&docId=298452202,친구랑 5월달에 에버랜드 가려는데요스마트예약 가입이 04부터 되더라고요저는 05라서부모님정보로 가입해도 제가 갈 수 있나요?
985,미국 동부지역 볼거리좀요 내공200 빨리주세요,/qna/detail.nhn?d1id=9&dirId=9020201&docId=298451800,미국 동부지역을 조사해오는 숙제인데 빨리 주세요.....채택까지 해드림니다 볼거리 좀요 자유의 여신상이나 타임즈 스퀘어나 그런거좀 정보주세요. 영어 번역이랑 한글로도 주세요 내공 200드림
986,양산범어고 등교,/qna/detail.nhn?d1id=9&dirId=9011401&docId=298451794,등교시간이 어찌되나요? 1학년들 상태는 어떤가요? 야자는 자유인가여?
987,국제전화 계속 통화중은 차단인건가요,/qna/detail.nhn?d1id=9&dirId=902&docId=298451737,"폴란드로 여행간 분과 연락이 되지 않는데요.유심은 다른 동유럽국에서 선불폰 유심 구매해서 끼고 다니는데 폴란드 도착 직후 카톡 한번 이후 연락이 안되더라구요.처음에 제 번호로 전화를 하니 신호음이 갔는데 몇시간 뒤부터는 제 번호로 걸면 무조건 통화중이라고 하더라구요.이틀째 걸면 무조건 통화중이라고 안내가 나옵니다.스카이프로 거니 똑같이 9번 신호음 이후 사용할 수 없는 번호 라고 창이 뜨면서 전화가 끊기구요.집으로 국제전화를 연속적으로 하니 신호가 가다 안받는다고 하고, 그러더니 또 전원이 꺼져있거나 인터넷에 연결이 안되있다고 하는 두 가지 상태를 텀 없이 계속 반복합니다..제 번호로 걸때만 통화중이라며 신호음 자체가 안가는데 제 번호를 차단해서 이러는건가요?"
988,경상북도 포항 쪽 폐모텔 흉가 위치가 궁금합니다.,/qna/detail.nhn?d1id=9&dirId=90114&docId=298451698,https://blog.naver.com/gigangbo/220545801725https://www.youtube.com/watch?v=UkueWlfFTAU위 링크의 사진과 동영상 모두 같은 곳입니다.댓글 등을 보니 포항 쪽이라고 하는데 전혀 위치를 모르겠네요......혹시 정확한 위치가 어디인지 알 수 있을까요? 궁금합니다.
989,87세아버지가 치매이고 귀도잘안들리면서 다리에힘도없으신상태라면 요양원이나요양병원어디가좋은지 강원도 평창원주횡,/qna/detail.nhn?d1id=9&dirId=90108&docId=298451480,87세아버지가 치매이고 귀도잘안들리면서 다리에힘도없으신상태라면 요양원이나요양병원어디가좋은지 강원도 평창원주횡성인근에 시설좋은곳아시는분 추천부탁합니다
990,부산 서면이나 수영 이 사이에 무인텔 추천 해주라. 가능하면 좌표도 같이 찍어주면 좋겠어 지도로 부탁합니다ㅎ,/qna/detail.nhn?d1id=9&dirId=9011401&docId=298451386,부산 서면이나 수영 이 사이에 무인텔 추천 해주라.가능하면 좌표도 같이 찍어주면 좋겠어 지도로부탁합니다ㅎ
991,간사이공항에서 루나솔있나요? 루나솔 파운데이션 구매하려고 합니다,/qna/detail.nhn?d1id=9&dirId=9020101&docId=298451059,간사이공항에서 루나솔있나요? 루나솔 파운데이션 구매하려고 합니다
992,교토 2일 여행 동선 및 교통편좀 부탁드려요 고베에서 교토로 넘어갈 계획이구요 교토 2일 관광하고 교토에서,/qna/detail.nhn?d1id=9&dirId=9020101&docId=298450963,"교토 2일 여행 동선 및 교통편좀 부탁드려요고베에서 교토로 넘어갈 계획이구요교토 2일 관광하고 교토에서 오사카로 넘어 올 계획이에요관광지는아라시야마(아침에 갈 예정)청수사,산넨/니넨자카금각사,철학의길후시미이나리기온거리 이렇게 가려는데 루트가 너무 복잡해서요어디 어디를 묶어서 가면 좋을지 부탁 드려요!숙소는 기온시조역 근처 입니다"
993,필리핀이나 베트남 여행가보려합니다,/qna/detail.nhn?d1id=9&dirId=902&docId=298450765,"우리나라돈으로 현금 100만원에서 150만원정도 들고 영어 아예 인되는 상태로 혼자 베트남이나 필리핀여행가려하는데 20후반 남성이고요 직업이라든가 여러가지가 힘들다보니 여행가서 (1)생각도 하고 맛있는 먹고 재밌게 즐기거나 (2)조용한곳에서 적당하게 한국인 맞는음식으로 먹으며 생각해보려하는데 몇일정도 머물수있을까요 14일 머물고 싶은데 금액이 적으니 1주일이나 10일정도로 가고 싶습니다그 나라마다의 금액단위가 있기에 그 금액이 그 나라에서 얼만큼 금액인지 알려주심 감사하겠습니다비행기값 포함 150으로 가정하고 말해주세요(1번+2번 말해주시면 감사하겠습니다1. 12. 23 1+2전 3번을 원해요 1,2번도 대답해주신다면 고맙구요)비행기는 제일싼 비행기고 제일 싼 좌석으로 하고 간다는 가정하에 알려주시면 감사하겠습니다지식인 질문후에도 쪽지나 1대1 질문으로 질문을 더하게 될 예정인데 그런분들 답변 부탁드립니다그냥 답변주시면서 1대1쪽지 1대1 은 싫어요 하면 답변듣고 말겠지만 ㅎㅎㅎ"
994,사진상의 데상트 티 파는곳 아시는분..2016ss로 기억합니다,/qna/detail.nhn?d1id=9&dirId=90111&docId=298450397,사진상의 데상트 티 파는곳 아시는분..2016ss로 기억합니다
995,롯데월드 단체 티켓 환불,/qna/detail.nhn?d1id=9&dirId=90103&docId=298450387,롯데월드 단체 티켓 환불 할수 있을까요?내일 학교에서 반에서 16명 정도가 단체로 1명당 2만6000원 정도로 내가지고 롯데월드를 가는데제가 당일 아침에 저 혼자만 안가서 티켓 환불가능한가요? 그러면 얼마정도 환불이 가능한가요?
996,미국 여행 질문,/qna/detail.nhn?d1id=9&dirId=9020201&docId=298450315,1. 머리커트용 가위 캐리어에 넣어서 미국여행 가는 캐리어에 넣어가져가도 되나요?2. 혹시라도 갑자기 캐리어 열어보려고 하면 어떡하죠3. 짐은 몇kg가 안넘어야 의심 안하나요4. 미성년자는 호텔 예약어떻게하죠 입국심사때 호텔옝약 됐는지 확인하나요?
997,인도네시아 출장시 핸드폰을 어떻게 하면 좋을까요?,/qna/detail.nhn?d1id=9&dirId=9020106&docId=298450246,제가 이번 4월달에 인도네시아 자카르타에 출장가서 1달가량 일하다 옵니다. 그런데 핸드폰을 어떻게 해야할지 모르겠네요. 사실 가서 데이터를 그렇게 많이 쓸 것 같지는 않습니다. 한 3~4g면 충분할 것 같습니다. 그리고 통화는 아무래도 인도네시아 내에서의 국내 통화만 거의 하게 될 것 같습니다. 이럴때는 어떻게 상황에 대처하는게 좋을지 모르겠습니다.일단 한국에서 지금 쓰는 스마트폰 말고 예전에 쓰던 공 스마트폰이 한개 있긴 한데 그것을 활용하라는 선배도 있는데 무슨 말인지 잘 모르겠네요.사무실에서 일할 날이 많을테니 와이파이나 실내 인터넷을 자주 쓴다고 가정했을 시 싸게 한달간 인도네시아에서 핸드폰 쓰는 방법 좀 가르쳐주세요. ^^
998,"유럽에 포함되는 나라, 유럽 여행",/qna/detail.nhn?d1id=9&dirId=90203&docId=298450212,유럽에 포함되는 나라들 다 알려주세요!! 그리고 보통 유럽 여행이라 하면. 유럽에 포함되는 나라를 모두 여행하는 건가요? 유럽 여행 말고 또 무슨 여행이 있나요?
999,"남중국해 분쟁국가들 중국,베트남,필리핀,말레이시아,부루나이의 입장과 분쟁과정 및 해결방안좀 자세히 써주세요!",/qna/detail.nhn?d1id=9&dirId=9020104&docId=298450119,"남중국해 분쟁국가들 중국,베트남,필리핀,말레이시아,부루나이의 입장과 분쟁과정 및 해결방안좀 자세히 써주세요!!내공드려요(내공냠냠 신고합니다)"
1000,냉장고 소리 집에 원래부터 붙어있는 김치냉장고가 언제부터 갑자기 소리가 나는데 이게 어떻게 할 수 가 없는것,/qna/detail.nhn?d1id=9&dirId=90203&docId=298449949,냉장고 소리집에 원래부터 붙어있는 김치냉장고가 언제부터 갑자기 소리가 나는데 이게 어떻게 할 수 가 없는것 같아서요코드를 뽑을 수 도 없는데 소리를 멈추게 할 수 있는 가장 빠르고 쉬운 방법이 없나요? 사람 부르는거? 그런거 말고요
1001,스튜어디스,/qna/detail.nhn?d1id=9&dirId=90113&docId=298449789,"안녕하세용!!전 지금 중3인 여학생인데요지인 분의 말씀으로 스튜어디스를 생각하게 되었어요그래서 대학을 알아보고 있는 중인데요지금 인하공전, 한서대, 아세아항공직업전문학교, 한국항공직업전문학교를 골랐는데요아세아랑 한국이 내신으 안보는 걸로 알고 있거든요??흠.. 어디로 가면 좋을까요?4개 학교의 장단점과 특징? 등 더 가르쳐 주시고 싶으신거 더 알려주세요!!잘 부탁드립니다~!!"
1002,롯데월드 이거 남여만인가요....친구랑 가려는데,/qna/detail.nhn?d1id=9&dirId=90103&docId=298449715,롯데월드 이거 남여만인가요....친구랑 가려는데
1003,Ebookers에서 중국동방항공 비행기를 예매했는데 중국 동방항공 홈페이지에서는 그 비행기가 없는 것으로 나,/qna/detail.nhn?d1id=9&dirId=90207&docId=298449462,"Ebookers에서 중국동방항공 비행기를 예매했는데 중국 동방항공 홈페이지에서는 그 비행기가 없는 것으로 나오는데 어떻게 된 일인가요. 그리고 예약시 생년월일, 여권번호는 하나도 등록 안하고 영문이름만 등록하게 되어있던데 이렇게 해도 되는건가요?? 사기가 아닐지 걱정이 되네요!!"
