,0,1,2
1441,유럽 여행에 대해 여쭤보려 합니다. 일단 코스는 뮌헨 - 프라하 - 뉘른베르크 - 루체른 - 인터라켄 - 디,/qna/detail.nhn?d1id=9&dirId=9020303&docId=298386633,"유럽 여행에 대해 여쭤보려 합니다. 일단 코스는뮌헨 - 프라하 - 뉘른베르크 - 루체른 - 인터라켄 - 디종? - 파리이런식으로 계획을 하고 뮌헨 인 파리 아웃으로 항공권도 예매를 했습니다. 이것저것 알아본 결과 뮌헨에서 프라하, 프라하에서 뉘른베르크, 뉘른베르크에서 루체른은 DB 버스를 이용하려고 합니다. 그리고 루체른에서 인터라켄은 골든패스라인을 이용하려고 하구요. 일단 여기까지만 계획을 해놨는데1. 독일 철도청에서 예매를 하게 되면 버스를 예매하는거죠? 기차가 아니라? 그리고 ""여행을 그리다"" 홈페이지에서 예매해도 되나요?2. 루체른에서 인터라켄은 골든패스라인을 이용할건데 어디서 보니까 스위스패스나 유레일패스가 없으면 안된다고 하던데 진짜인가요? SBB 홈페이지(스위스 철도청)에서 예매 안되나요? 이건 기차 맞나요?3. 나라에서 나라를 이동할 때 뿐만 아니라 나라 안에서도 대중교통을 이용해야 하는데 교통패스 카드를 충전식으로 하는게 나을까요 아니면 그냥 유레일 4개국 선택하는 걸로 해서 나라간 이동까지 혜택 받는게 나을까요?질문이 긴데 답변 부탁드립니다. 유럽여행 코스짜기가 너무 힘들어요..."
1442,이번 여름에 키르키즈스탄으로 여행을 가는데 키르키즈스탄 돈(단위 : 솜)으로 한국에서 환전할 수 있나요??가,/qna/detail.nhn?d1id=9&dirId=902&docId=298386623,이번 여름에 키르키즈스탄으로 여행을 가는데 키르키즈스탄 돈(단위 : 솜)으로 한국에서 환전할 수 있나요??가능하면 어떤 은행에서 가능한가요?
1443,무등산 입석대에 대해서 알려주세요,/qna/detail.nhn?d1id=9&dirId=90102&docId=298386501,무등산 입석대에 대해서 아주아주 자세하게 설명해주세요 무슨 돌로 이루어져있고 천연기념물 몇호이며 어떻게 생겨나게 되었는지 등 등 같은 아주 자세하게요.
1444,일본 돈키호테 모자 사진이랑 일본 가격좀 알려주세요ㅠㅠ 최대한 많이요!,/qna/detail.nhn?d1id=9&dirId=9020101&docId=298386420,일본 돈키호테 모자 사진이랑 일본 가격좀 알려주세요ㅠㅠ 최대한 많이요!
1445,여름에 베트남 다낭 여행을 다녀오려고합니다 2인이서 3박 4일로 다녀오려구하는데 알차게 보내는 방법좀 알려주,/qna/detail.nhn?d1id=9&dirId=9020107&docId=298386197,여름에 베트남 다낭 여행을 다녀오려고합니다2인이서 3박 4일로 다녀오려구하는데알차게 보내는 방법좀 알려주세요~!(맛있는 음식 먹는곳과 구경하기 좋은곳들 등등)그리고 전체적인 2인기준 총 비용은 어느정도드는지궁금하네요~!비행기는 일반석과 비즈니스석 중 고민되는데가격차이는 얼마나 나는지도 궁굼합니다~!
1446,여기 어딘지 좀 알수있을까요..? 해외인거같은뎅,/qna/detail.nhn?d1id=9&dirId=902&docId=298386193,여기 어딘지 좀 알수있을까요..?해외인거같은뎅
1447,일본으로 4박 5일 여행 갈 건데 넣을 것도 많고 일본에서 사 올 것도 많은데 캐리어가 어느 정도 해야 충분,/qna/detail.nhn?d1id=9&dirId=902&docId=298385673,일본으로 4박 5일 여행 갈 건데 넣을 것도 많고 일본에서 사 올 것도 많은데 캐리어가 어느 정도 해야 충분하고 넉넉하게 갈 수 있을까요??
1448,미국인데 중이염 약은 어떤거 사야 할까요?,/qna/detail.nhn?d1id=9&dirId=9020201&docId=298385564,미국인데 중이염 약은 어떤거 사야 할까요?
1449,현대에스나비sj9400,/qna/detail.nhn?d1id=9&dirId=90102&docId=298385380,현대에스나비sj9400을 등록하려면 어디로가야합니까?
1450,제가 스튜어디스가 꿈인데 이제 면접노트를 준비하려고 하는데 어떤 면접책이 좋을까요 추천 부탁드려요ㅠㅠ,/qna/detail.nhn?d1id=9&dirId=90113&docId=298385354,제가 스튜어디스가 꿈인데 이제 면접노트를 준비하려고 하는데 어떤 면접책이 좋을까요 추천 부탁드려요ㅠㅠ
1451,이스타항공에 기내반입수화물로 캐리어7kg하나랑 노트북을 넣은 백팩을 가져가려고 하는데 괜찮을까요? 백팩안에는,/qna/detail.nhn?d1id=9&dirId=90207&docId=298385144,"이스타항공에 기내반입수화물로 캐리어7kg하나랑 노트북을 넣은 백팩을 가져가려고 하는데 괜찮을까요? 백팩안에는 노트북 뿐만아니라 책이랑 거울,보조배터리 등 넣어가는데 무게를 잴까 걱정이에요ㅠㅠㅠ 어떤 글보면 가로세로 합 80cm-90cm인 보조가방은 7kg 규정에 포함안되고 무게안잰다는데 항공사 화물규정에는 따로 나와있지 않네요ㅠㅠ"
1452,행동주의이론의 성과와한계 가 뭔지 알려주세요..,/qna/detail.nhn?d1id=9&dirId=90205&docId=298385104,행동주의이론의 성과와한계 가 뭔지 알려주세요..
1453,사운드 오브뮤직 노래 My favorite things 하고 도레미송 빼고 유얼 식스팅 고잉온 세븐틴 이러는,/qna/detail.nhn?d1id=9&dirId=9020401&docId=298385100,사운드 오브뮤직 노래 My favorite things 하고 도레미송 빼고 유얼 식스팅 고잉온 세븐틴 이러는거 하고쏘 롱 페어 그러는거 두개 위에 쓴것 처럼 콩글리쉬로 써주세요. 내공 50 겁니다
1454,4월중순 일주일 내로 커플여행가려구요 활동적인것도좋아하지만 조용한경치도좋아요 오래걷는건별로구요 쇼핑보다는체험,/qna/detail.nhn?d1id=9&dirId=9020104&docId=298384855,4월중순 일주일 내로 커플여행가려구요활동적인것도좋아하지만조용한경치도좋아요쇼핑보다는체험이좋아요이미가본곳제외(일본.중국.괌.필리핀.말레이시아)이전과는 다른 느낌을받고싶어요경비는 둘이합쳐서 150~250이내로 찾고이써요많이알려지지않은 특이한곳 가고싶어요
1455,난바에서 간사이공항 편도 문의,/qna/detail.nhn?d1id=9&dirId=9020101&docId=298384844,닛폰바시역에 숙소가 있어요돌아오는날 난바에서 간사이 공항 편도 티켓 문의 드립니다.일요일에 귀국이라.. 미리 표를 끊어가면 좋을꺼 같은데.. 방법 문의드려요
1456,일본 오키나와 위도,/qna/detail.nhn?d1id=9&dirId=9020101&docId=298384366,일본 오키나와 위도 좀 알려주세요
1457,중국 문화체험 할 수 있는곳!!,/qna/detail.nhn?d1id=9&dirId=9020102&docId=298384365,안녕하세요! 제가 이번에 중국어 동아리를 만들게 되었는데요! 부원들과함께 중국 문화 체험을 하러가는 활동을 하고싶은데 쳐보니까 잘 안나오네요ㅠㅠ 인천 차이나타운도 좋을것같은데 일단 차이나타운 제외한 중국문화 체험할 수 있는곳좀 알려주세요!! 수도권이면 더좋을것같아요!! 내공 30 겁니다!
1458,미국 플로리다 위도 좀 알려주세요,/qna/detail.nhn?d1id=9&dirId=9020201&docId=298384307,미국 플로리다 위도 좀 알려주세요
1459,오사카 3박4일 여행가려고 하는데요 주유패스를 사는게 이득인지 아닌지 모르겠어요 ㅠㅠ 덴노지동물원) - 오사,/qna/detail.nhn?d1id=9&dirId=9020101&docId=298384270,오사카 3박4일 여행가려고 하는데요주유패스를 사는게 이득인지 아닌지 모르겠어요 ㅠㅠ덴노지동물원) - 오사카성 - 주택박물관 - 도톤보리 리버크루즈 - 시간 남으면 우메다 공중정원이 코스인데 사는게 좋을까요?
1460,일본 후쿠오카 여행을 가려고 합니다만.. 궁금합니다..,/qna/detail.nhn?d1id=9&dirId=9020101&docId=298384158,"제 목표는 일본의 지방쪽, 예컨데 큐슈 쪽으로 여행을 가서온천 코스와 후쿠오카 시내 등 먹거리도 즐겨볼 예정인데이 두가지를 충족 시키려면, 후쿠오카 시를 가면 안되는건가요?대충 알고있기로는 큐슈라는 섬 안에 후쿠오카현이 있고,후쿠오카 현 안에 후쿠오카 시가 있는 것으로 알고 있습니다만..첫날은 온천도 즐길겸 료칸에 숙박을 하고 싶고, 나중엔 일반 도심지에 숙박하듯이후쿠오카 시 정도에.. 호텔 예약을 해서 적절히 쉬면서 놀고 싶은데요...그런데, 일본에는 개인 자가용도 없기 때문에전부 대중교통을 이용해야한다는 점이 있기 때문에... 왠지 불안한 점이 많아서 말입니다.예를 들면, 후쿠오카 시의 도심지에 온천욕을 즐길 료칸이 있진 않을 것 같고더 다른쪽으로 이동을 해야한다는 문제가 있는 것 같던데그렇다면 또 이동에 번거로움이 있을 것 같아서요...다른분들은 어떻게 즐기셨는지 너무 궁금합니다.------------------------------아참, 추가 질문..혹시 기타큐슈랑 후쿠오카랑 알고 계시는 차이 점도 궁금합니다..예컨데, 놀곳이나 숙박시설 등 이런 위주로...기타큐슈와 후쿠오카는 거리가 많이 먼 편인가요?체감상 잘 모르겠네요...기타큐슈도 좋았다는 분들이 많아서 말입니다...하지만, 항공편을 고를때 이미 기타큐슈나 후쿠오카 둘중에 하나만 택일해야하는 상황이라...뭔가 복잡하네요."
1461,오키나와 위도,/qna/detail.nhn?d1id=9&dirId=9020101&docId=298384149,오키나와 위도가 어딘가요?
1462,김해공항 패스트트랙,/qna/detail.nhn?d1id=9&dirId=902&docId=298384091,5월 초 팔순 두 분 모시고 김해공항 이용하는데 패스트트랙 이용할 수 있나요?총 여섯명 이용합니다. 그리고 아시아나 김해-오키나와행 비즈니스석이 경유만 나오던데 직항도 있나요
1463,부산에서 학폭이 가장 심한학교가 어디인가요? 갑자기 궁금해서 올려봅니다,/qna/detail.nhn?d1id=9&dirId=90111&docId=298384041,부산에서 학폭이 가장 심한학교가 어디인가요?갑자기 궁금해서 올려봅니다
1464,에펠탑 철거 안 하게 된 이유,/qna/detail.nhn?d1id=9&dirId=9020302&docId=298383776,에펠탑이 원래 철거되야되는건데 철거 안 했잖아요 근데 그게 사람들한테 유명해져서인가요?아니면 왜 인지 알려주세용
1465,서울 홍은동에서 상명대학교로 짐을 옮겨야 하는데 짐이 세로 2미터정도 가로 1미터정도 되는 제일 큰 박스랑,/qna/detail.nhn?d1id=9&dirId=90109&docId=298383753,서울 홍은동에서 상명대학교로 짐을 옮겨야 하는데짐이 세로 2미터정도 가로 1미터정도 되는 제일 큰 박스랑다른 큰 박스들을 옮겨야 해서요 ㅠㅜ택배로 붙이고 싶은데 어떠케 할 수 있을까요??
1466,기온거리에서 난바역,/qna/detail.nhn?d1id=9&dirId=9020101&docId=298383560,당일치기 교토여행 후 다시 오사카로 넘어갈 계획입니다.쿄토에서 마지막으로 기온거리를 둘러보고 갈 난바역으로 넘어갈 것 같은데지하철 노선 좀 알려주세요!
1467,여자사람 혼자 홍콩&마카오 자유여행가려고하는데요. 어떤가요? 그리고 홍콩&마카오 두곳이다보니 비행기가 고민인,/qna/detail.nhn?d1id=9&dirId=9020102&docId=298383403,"여자사람 혼자 홍콩&마카오 자유여행가려고하는데요. 어떤가요?그리고 홍콩&마카오 두곳이다보니 비행기가 고민인데, 홍콩으로들어갔다가 마카오로나오는게나을까요, 그반대가나을까요?그부분이 여행에서 중요한부분일까요?"
1468,도와주세요ㅠㅠ프랑스 관광객에게 한국을 알리는 방법,/qna/detail.nhn?d1id=9&dirId=90205&docId=298383255,프랑스 관광객에게 한국을 알리는 홍보방법이 뭐가 있을까요?적어도 내일 까지는 조사해야 되는 데 어떤식으로 조사해야 할지 모르겠어요 ㅠㅠㅠㅠㅠ도와주세요ㅠㅠㅠㅠ
1469,지상직 승무원을 꿈꾸고 있는데 신체적 조건으로 팔 한쪽이 장애가 있어도 지원이 가능한가요 빠른 답변 부탁드려,/qna/detail.nhn?d1id=9&dirId=90113&docId=298383183,지상직 승무원을 꿈꾸고 있는데 신체적 조건으로 팔 한쪽이 장애가 있어도 지원이 가능한가요 빠른 답변 부탁드려요
1470,한강이 보이는 전망대같은 곳인거같은데 여기 어딘지 알수있을까요ㅜㅠㅠㅠ,/qna/detail.nhn?d1id=9&dirId=90111&docId=298382997,한강이 보이는 전망대같은 곳인거같은데 여기 어딘지 알수있을까요ㅜㅠㅠㅠ
1471,유레일패스 2달이내,/qna/detail.nhn?d1id=9&dirId=902&docId=298382946,"유레일패스 2달이내 4일사용 이라고 하면,결제 당일로부터 2달이내인가요 아니면 패스권 개시일로부터 2달이내인가요?"
1472,부산벚꽃축제 둘중하나 골라주세요,/qna/detail.nhn?d1id=9&dirId=90111&docId=298382749,"부산에사는 평범한 중학생입니다친구랑 벚꽃축제를 가려고 하는데 강서낙동강변30리 벚꽃축제랑 삼락벚꽃축제이둘중에서 고민이되는데 어떤게 좋을까요?강서낙동강변30리는 벚꽃타투스티커 네일아트 보석십자수 vr카드보드만들기 가죽팔찌만들기 연필꽃이 데코파주 압화, 열쇠고리만들기 향기나는 캘리그라피 다육공예,벚꽃비즈팔찌,드라이플라워 전구병만들기 전통 연만들기 및 전시 캐리커쳐 스트링아트등있고  벚꽃무료 사진인화도해준답니다.삼락벚꽃축제는 위에처럼 이케 행사를 안하는거같은데 제가못찾는건지..있으면 알려주시고요둘중고민되는게 꽃은 삼락벚꽃축제가 젤이쁘다고 인터넷으로 봤습니다.ㅠ1.둘중 어느곳이 더좋을까요? 근거도 부탁합니다^^2.삼락벚꽃축제는 행사가 없나요? 강서낙동강변30리처럼 저런게?3.강서낙동강변30리에 행사들 모두 무료인가요? 무료가 아닐거같긴한데 한다면 얼마정도하는지 알수있을까요?긴글 읽어주셔서 감사합니다^^ 참고로 내일가구요 2명입니다~~"
1473,일본노래 추천해주세요 많이! 많이 알려주시는분 채택해드릴께요!!,/qna/detail.nhn?d1id=9&dirId=9020101&docId=298382683,일본노래 추천해주세요 많이! 많이 알려주시는분 채택해드릴께요!!
1474,에버랜드 중고등 우대쿠폰,/qna/detail.nhn?d1id=9&dirId=90103&docId=298382275,에버랜드 중고등 우대쿠폰을 다운받아서 가서 그거 보여주고 돈내고 들어가도 되죠? 무조건 인쇄해야되나요? 아니면 그냥 핸드폰으로 보여줘도 되죠?
1475,4월 여행지 추천 바랍니다!,/qna/detail.nhn?d1id=9&dirId=901&docId=298382129,여자친구와 4월 중순쯤 여행갈 생각입니다 우선 면허가 없으므로 대중교통 이용할거구요! 수도권에서 출발합니다 여태 버스와 도보로 아침부터 빡세게 돌아다니면서 하는 여행을 많이 했는데 이번에는 한두군데 둘러보고 경치좋고 공기좋고 물있으면 좋고 그런곳에 초저녁즘 숙소들어와서 밥해먹고 고기 구워 먹고 놀고싶은데요! 힐링 여행느낌?! 섬도 좋고.. 어디가 좋을까요
1476,제가 베트남 갤8을 받았는데요 렉이심해서 그런데 해결못하나요?,/qna/detail.nhn?d1id=9&dirId=9020107&docId=298381501,제가 베트남 갤8을 받았는데요 렉이심해서 그런데 해결못하나요?
1477,인천공항에 KEB하나은행 환전 ATM기 있나요?? 있으면 위치좀 알려주시구요 사이버환전신청하면되는건지??,/qna/detail.nhn?d1id=9&dirId=90206&docId=298381346,인천공항에 KEB하나은행 환전 ATM기 있나요??있으면 위치좀 알려주시구요사이버환전신청하면되는건지??
1478,노래 제목점요,/qna/detail.nhn?d1id=9&dirId=9020101&docId=298381335,일본 갔을때 상가에서 들음일본음악.m4a내PC 저장네이버 클라우드 저장
1479,일본에 가지말아야할 위험한 장소도 있나요?,/qna/detail.nhn?d1id=9&dirId=9020101&docId=298381308,일본에 가지말아야할 위험한 장소도 있나요?
1480,발목을 접질러서 발등에 피멍?들고 발 왼쪽에 멍들고 복숭아뼈 부우면 어디를 다친거죠? 어디 다쳣는지 까먹어서,/qna/detail.nhn?d1id=9&dirId=90108&docId=298381278,발목을 접질러서 발등에 피멍?들고 발 왼쪽에 멍들고 복숭아뼈 부우면 어디를 다친거죠? 어디 다쳣는지 까먹어서..
1481,20세기 스페인의 패션,/qna/detail.nhn?d1id=9&dirId=9020308&docId=298381222,20세기 스페인의 패션에 대해서 알려주세요.성인도 성인이지만남자 아이들은 주로 무슨 옷을 입었나요 ??
1482,암스테르담 교통 질문이요!,/qna/detail.nhn?d1id=9&dirId=90203&docId=298381023,"저희가 7월7일부터 9일까지 암스테르담에 머무는 여정인데, 교통권을 뭘해야할지 고민입니다ㅜㅜ저희 일정은7일숙소 체크인->점심->잔세스칸스->운하투어->담광장->저녁에 맥주 먹으면서 운하 야경 보기8일아침->반고흐 미술관->암스테르담 국립 박물관& I Amsterdam ->잔디광장Museumplein -> cafe loetje에서 점심(스테이크 맛집) ->알버트 카위프 마켓(재래시장) ->버스->담광장->저녁&맥주 먹기9일바로 브뤼셀로 출발이렇게 일정을 짯는데, 그냥 ov chip을 사용할지 I amsterdam을 사용할지 고민입니다ㅜㅜ 조언 부탁드려요ㅜㅜ"
1483,여권만 있고 시민권없이 미국 여행가서 권총 하나를 구입할 수 있을까요?,/qna/detail.nhn?d1id=9&dirId=9020201&docId=298380993,여권만 있고 시민권없이 미국 여행가서 권총 하나를 구입할 수 있을까요?
1484,부산사투리 1) 쌔리 -고마쌔리 마 도잇고 쌔리부까 이러거니 쌔리 내삐라같은것도 잇는데 쌔리의 뜻이뭔가요 2,/qna/detail.nhn?d1id=9&dirId=90102&docId=298380888,부산사투리1) 쌔리 -고마쌔리 마 도잇고 쌔리부까 이러거니 쌔리 내삐라같은것도 잇는데 쌔리의 뜻이뭔가요2)공구다의 정확한뜻이 뭔지 헷갈리네요 공구다의표준어 뭔가요
1485,미국행 항공편을 구매했는데 중국 베이징을 경유해서 가게 되었네요~.. 어떻게 해야 하는지..,/qna/detail.nhn?d1id=9&dirId=9020102&docId=298380861,미국행 항공편을 구매했는데중국 베이징을 경유해서 가게 되었네요~..처음인데..짐도 다 다시 찾고 부치고.. 출입국 심사도 해야한다고 들었는데..김포에서 베이징 공항에 내리면 미국으로 가는 비행기를 타기까지 해야할 일과 가야할 곳을 순서대로 알려주실 수 있으신가요 ㅠㅠ그리고 베이징에 도착 후에 3~4시간 후 미국행 비행기인데 시간은 충분할까요??
1486,태국 기본어 사진 화질좋게 부탁해요,/qna/detail.nhn?d1id=9&dirId=9020103&docId=298380749,태국 기본어 사진화질좋게부탁해요
1487,지금 김천 연화지에 벚꽃 피었나요?ㅠ,/qna/detail.nhn?d1id=9&dirId=90111&docId=298380647,지금 김천 연화지에 벚꽃 피었나요?ㅠ
1488,유럽여행 레이오버 관련 질문합니다.,/qna/detail.nhn?d1id=9&dirId=90203&docId=298380513,KLM항공타고 암스테르담경유 해서 프라하 갈예정인데암스테르담에서 14시간 시간이 떠서 레이오버 할 예정입니다.여기서 궁금한건 수화물은 인천에서 프라하로 바로 가고암스테르담에서 나갓다가 탑승을위해선 다시 입국심사를 거쳐야한다고 하는데요.인천면세에서 구매한 면세품중 액체류 100미리 넘는 제품은 암스테르담에서 입국심사시 문제가 안되나요?아니면 미리 기내용 캐리어를 준비햇다가 추가로 부쳐야할까요?? ㅠㅠ?
1489,제주도 기후에 따라 변화하는 사람들의 의식주 좀 알려 주세요.,/qna/detail.nhn?d1id=9&dirId=90112&docId=298380420,안녕하세요 전 5학년인데요. 숙제로 제주도의 기후에 따라 변화하는 사람들의 의식주를 알아 오라고 하셨는데 좀 알려 주세요. 사진도 부탁해요.
1490,어떻게 남녀가 소개팅한 지 일주일 만에 모텔 가서 성교까지 할 수 있죠?,/qna/detail.nhn?d1id=9&dirId=9011401&docId=298380359,어떻게 남녀가 소개팅한 지 일주일 만에 모텔 가서 성교까지 할 수 있죠?
1491,"안녕하세요 저희가족 3인 (성인2명, 6세아이 1명)이 12월21일경 4박5일로 태국여행가려합니다. 우선 저",/qna/detail.nhn?d1id=9&dirId=9020103&docId=298380239,"안녕하세요 저희가족 3인 (성인2명, 6세아이 1명)이 12월21일경 4박5일로 태국여행가려합니다. 우선 저희가 꼭 가고자하는곳은 코사무이,카오락사파리투어, 후아힌, 카오야이동굴사원, 방콕, 파타야수상시장 정도는 가보고 싶구요. 총경비랑 예약등을 상담받고 싶습니다. 남편이 걸어다니고 버스타고 이런걸 싫어해서ㅜ 교통편이 편리해야할거같구요 (지난 일본여행때 버스투어했다가 엄청싸웠어요ㅠ) 자세한 상담부탁드립니다."
1492,친구랑 다음주 주말에 석촌호수 벚꽃축제 보러 가기로 했는데 몇시에 시작하는지 알려주세요.좀 빨리만날거거든요,/qna/detail.nhn?d1id=9&dirId=901&docId=298380113,친구랑 다음주 주말에 석촌호수 벚꽃축제 보러 가기로 했는데 몇시에 시작하는지 알려주세요.좀 빨리만날거거든요
1493,8.5 유로면 한화얼마인가요?,/qna/detail.nhn?d1id=9&dirId=9020303&docId=298380064,8.5 유로면 한화얼마인가요?
1494,태국 여행 준비 방법,/qna/detail.nhn?d1id=9&dirId=9020103&docId=298379670,"태국 여행시반드시 필요한 서류가 뭐가 있나요? (비자, 여권, 티켓 정보 프린트 등등)저는 3주 정도 머무를 예정입니다."
1495,인천공항 에어서울 카운터어딨죠?,/qna/detail.nhn?d1id=9&dirId=90207&docId=298379499,3박4일 동안 오사카 여행을 가는데 항공사를 에어서울로 구매했거든요 근데 탑승수속을 해야하는데 에어서울 카운터가 인천공항 어디에있는지 알려주세요
1496,홍콩 지하철 홍콩역이랑 센트럴역이랑 이어져있나요???,/qna/detail.nhn?d1id=9&dirId=9020102&docId=298379215,홍콩 지하철홍콩역이랑 센트럴역이랑 이어져있나요???
1497,"액션, 판타지 옷",/qna/detail.nhn?d1id=9&dirId=9020301&docId=298379210,"액션, 판타지 옷 알려주세요...제가 그림을 그리려고 하는데 옷 찾아보는게 어려워서 못그리고 있어여.. 액션 장르 옷이랑 판타지 장르 옷 사진(그림) 올려주세요... 둘중에 하나만 해주셔도 괜찮아여^^"
1498,수학여행준비물,/qna/detail.nhn?d1id=9&dirId=90111&docId=298379187,제가 남해로 5월 말에 수학여행을 가는데요 궁금한 사항이 있어서요!1)수학여행 준비물2)사복입게 해주겠죠?3)수학여행팁
1499,제가 현재진행형으로 일본유학을 와 있습니다 (교환학생으로ㅇㅂㅇ) 1년인데 휴대폰 계약건으로 고민이 있어 질문,/qna/detail.nhn?d1id=9&dirId=9020101&docId=298379072,제가 현재진행형으로 일본유학을 와 있습니다(교환학생으로ㅇㅂㅇ)1년인데 휴대폰 계약건으로 고민이 있어 질문 합니다.원래 아실지 모르지만 유학생은 보통 1년단위라 도코모나 소프트뱅크를 쓰기가 곤란해요 2년계약인지라그래서 저가 통신사를 쓰려하는데 무엇이 좋은지 몰라알아본거는IIJmio랑 U-mobile을 알아보긴했는데데이터를 많이 쓰고 통화는 필요할때만 쓸생각이라......어느곳이 나을까요? 아니면 이것보다 더 좋고 괜찮은걸로 추천주세요(듣자하니 다 유명통신사의 선을 빌려온다하는데 어디엔 안되고 어디엔 데이터가 된다길래ㅇㅅㅇ..... 참고로 전 아오모리에 있습니다)그리고 또다른건 이 통신사에 가입하기위해선 크레딧 카드로써 비자/마스터 /그이외 로 쓰는 카드가 필요한데전 체크카드지만 비바G카드와 플래티넘을 들고있어요그럼 이걸 사용해서 계약이 되는지도 알고싶습니다
1500,해외여행지 추천해주세요,/qna/detail.nhn?d1id=9&dirId=902&docId=298378818,안녕하세요. 스무살 대학생입니다.죽기 전에 한 번 해외여행 가보고 싶습니다.딱히 같이 갈 사람 없어서 혼자 갈 예정이구요.물가 저렴한 곳으로 알려주세요.1. 저는 예쁜 옷이 많은 쇼핑몰을 좋아합니다2. 저는 굍장히 맛있는 음식을 좋아합니다3. 저는 끝내주게 멋있는 야경을 좋아합니다.위 세 군데도 추천해주세요.근데 음식은 1인분만 시켜도 되는 식당으로 알려주세용
1501,수학여행에서 필요한 준비물,/qna/detail.nhn?d1id=9&dirId=90111&docId=298378712,"제가 5월 말에 남해로 수학여행을 가는데 필요한 준비물과 남해에서 뭐하는 지, 수학여행팁좀 알려주세요!"
1502,봉원중 질문,/qna/detail.nhn?d1id=9&dirId=90105&docId=298378096,서울 봉원중 질문이요1.교복 예쁜가요2.교칙 센가요3.시험 쉽게 나오나요4.날라리 많나요
