,0,1,2
490,야유회 추천,/qna/detail.nhn?d1id=9&dirId=90109&docId=298507289,안녕하세요.다름이 아니라 제가 조 총무를 맡고 있는데 이번 6월15일 ~6월30일 사이에 남자 34명 야유회를 추친을 하려고 합니다.무엇을 해야할지 고민이 많이 됩니다. 저희가 당진에서 교대 근무자다 보니 2017년 야유회는 1근 근무 맞치고 16시 정도에 서산쪽에서 도착 해서 당일날은 족구 하고 밥먹고 맞추고 다음날 서바이벌을하고 점심먹고 각자 집으로 1박 2일 씩으로 했습니다. 올해에도 6월달에 할 예정이고 작년과 동일 하고 1근 맞추고 16시정도에 출발해서 다음날 집에 오늘걸로 할것 같습니다....제가 처음 하다 보니 많이 부족한데 당진에서 출발 하다 보니 엄청 멀리 까지는 못갈것 같아요.그리고 6월말에 진행을 해서 레프팅말고 생각이 아나서 다른 여러 가지 야유회에서 무엇을 하는지 궁금 하고 합니다.레프팅 포함해서 여러분들이 당진에서 가까운 여러가지 알려주시면 감사드립니다..꼭 부탁드립니다 ㅜ참고고 남자 34명이라 기업 공부나.... 듣는것을 싫어해서 이런것은 추천 해주시면 안됩니다!!!당일 오후에 출발해서 조금 활동하고 밥먹고 다음날 일어나서 2시간~4시간 안쪽에 끝나는거면 좋겟네요.꼭좀 부탁드립니다 여러분!!!!!
491,일본에 한국은행이 있나요?,/qna/detail.nhn?d1id=9&dirId=9020101&docId=298507101,"일본에서 한국은행(농협, 신한 등…)과 같이 공통으로 사용가능한 은행이 있나요?듣기에는 씨티은행이 있다고 들었는데 혹 다른 은행이 더 있는지.."
492,중국비자 문의 드립니다. 1.한국에서 상용비자 1년 90일체류 또는 여행비자 단수90 비자발급받고 중국현지출,/qna/detail.nhn?d1id=9&dirId=9020102&docId=298507072,"중국비자 문의 드립니다.1.한국에서 상용비자 1년 90일체류 또는 여행비자 단수90 비자발급받고 중국현지출입국관리소에서 90일만기후 중국현지에서 연장가능 한지요?2.한국에서 여행단수90일체류 비자를 신청하려면 필요한 서류가어떤것들이 있을까요?중국인 초청하는 초정장를 적어야 한다고 들었는데요. 초청장외 왕복항공권, 중국인초청자의 신분증복사본이 맞나요?그리고 중국에서 생활하다 이번에 한국으로 들어왔기에 중국에서 왕복항공권을 구매해서 현재는 중국으로 들어가는 항공권밖에 없습니다.어떻게해야하나요?"
493,에어아시아 항공권 예약 변경하는거요 지금 필리핀 세부에서 일정을 더 연장해서 있으려고 하는데 에어아시아 홈페,/qna/detail.nhn?d1id=9&dirId=9020104&docId=298506998,에어아시아 항공권 예약 변경하는거요지금 필리핀 세부에서 일정을 더 연장해서 있으려고 하는데에어아시아 홈페이지나 앱에서 예약 번호로도 조회가 안되고예약 변경도 안되더라구요막탄 공항에 있는 에어아시아 데스크에서 예약 변경이 가는하겠죠? 당장 내일이 예약한 출국날짜인데... 혹시 아시는 분 알려주세요ㅠㅠ
494,도쿄 4박 5일 자유여행 일정 질문드려요,/qna/detail.nhn?d1id=9&dirId=902&docId=298506704,"도쿄 4박 5일 자유여행 일정 질문드려요5월 중순즈음에 친구랑 가는데 친구는 관광 저는 쇼핑, 덕질 하려는거라 일정짜기가 어렵네요ㅠ가려는 곳은도쿄근교 사이타마현 쪽에있는 시바자쿠라 꽃축제타치가와역 쇼와기념공원코마고메역 후루카와정원디즈니랜드아사쿠사신사 산자마쓰리, 에도성점프샵, 제이월드, 아키하바라, 이케부쿠로, 나카노입니다정 안되겠으면 하루정도는 일정 따로 소화할거같아요숙소도 한곳에만 머물거라 어디 역 근처가 편할지도 알려주시면 감사하겠습니다!!광고는 사절이요!"
495,(국내) 꼭한번 가봐야할 좋은 국내여행지들좀 추천 해주세요.,/qna/detail.nhn?d1id=9&dirId=901&docId=298506643,"내년에 30살을 앞두고머리도 식히고 새로운 마음가짐도 갖을겸5월초에 7일 정도로 혼자 국내여행을 하려고 합니다.일단 거주지가 서울이라 서울에서 출발해서대전,대구쪽을 지나 부산을 거쳐 속초까지지역마다 두세곳 정도씩 가려고 합니다.일단 제가 찜해놓은 한곳은 담양 메타세콰이어길 하나인데요지역마다 꼭 가봐야할 곳 이나 명소 한두곳씩 추천좀 부탁드립니당.주변 맛집정보도 알려주시면 감사할게요.아 그리고,고속버스와 열차등 대중교통을 이용해서 갈 수 있는곳으로 추천부탁드립니다."
496,닛폰바시 역에서 치쿠린 가는길 문의해요 한큐패스와 오사카 1일 승차권을 사용할거구요 갈때는 치쿠린으로 바로,/qna/detail.nhn?d1id=9&dirId=9020101&docId=298506399,닛폰바시 역에서 치쿠린 가는길 문의해요한큐패스와 오사카 1일 승차권을 사용할거구요갈때는 치쿠린으로 바로 갈거고 올때는 우메다 들러서 공중정원갔다오려고 해요패스권써서 가는 방법이 궁금해요내공이 없어서 조금밖에 못걸었어요ㅜㅜ도와주세여ㅜㅜ
497,에버랜드 가는 방법 알려주세요 정확하게 드는 비용이랑 어디서 내리는지 저는 초등학생이구요 출발지역은 정왕입니,/qna/detail.nhn?d1id=9&dirId=90103&docId=298506100,에버랜드 가는 방법 알려주세요 정확하게 드는 비용이랑 어디서 내리는지 저는 초등학생이구요 출발지역은 정왕입니다
498,면세점에 대해 잘 아시는분 내공100드립니다,/qna/detail.nhn?d1id=9&dirId=90201&docId=298505984,제가 일본으로 출국하기전에 롯데백화점 면세점에서 상품을 사서 김해공항에서 찾고 일본여행을 하고일본 간사히공항 면세점을 둘러보던중 한국백화점에서 본 제품(667불 / 71만5천)을 주고 산 제품이일본 간사히공항 면세점에서는 ( 65만 ) 이였습니다. 일본간사히 공항에서 제품을 사고 한국으로 입국하면세금이 붙는게 있나요 ? 600불 넘는 세금 붙어봐야 1만원도 안되는데 가격차이가 많이 나서 질문 드립니다
499,파판14 직업별 시작마을 다르면 같이 못하나요? 친구들이랑 같이 퀘스트 하면서 랩업 하고 싶은데 궁금합니다.,/qna/detail.nhn?d1id=9&dirId=9020303&docId=298505952,파판14 직업별 시작마을 다르면 같이 못하나요?친구들이랑 같이 퀘스트 하면서 랩업 하고 싶은데 궁금합니다.가능하다면 랩 몇부터 가능한가요?
500,비바2체크카드남자들도많이발급받나요?디자인이좀여성스러운데,/qna/detail.nhn?d1id=9&dirId=90203&docId=298505950,비바2체크카드남자들도많이발급받나요?디자인이좀여성스러운데
501,부산에 인도 비자 대행 업체 있나요?? 네팔에서 인도로 육로 이동하면 전자 비자가 아닌 관광 비자가 필요하다,/qna/detail.nhn?d1id=9&dirId=9020105&docId=298505733,부산에 인도 비자 대행 업체 있나요?? 네팔에서 인도로 육로 이동하면 전자 비자가 아닌 관광 비자가 필요하다고 해서 ㅠ 서울 까지 가기엔 시간과 돈이.. 그래서 부산에서 대행하려는데 업체 소개 좀 해주실 수있나용
502,4인가족 해외여행 추천 부탁드립니다,/qna/detail.nhn?d1id=9&dirId=90201&docId=298504760,"4인가족 해외여행 추천 부탁드립니다6세딸과 13세아들 이렇게 4명이고다낭,푸켓,괌,마카오,홍콩,일본등등 알아보고 있었는데결정이 쉽지가 않아서요"
503,아람단에대해서,/qna/detail.nhn?d1id=9&dirId=90103&docId=298504732,제가 아람단 을 처음 신청했는데 제친구도하길래(?)신청했거든요? ( 하고싶기도해서 ) 근데 제친구는 이번 에버랜드만 간다고하더라구요.. 근데 그 저는 이번 4월달에하는거 다신청했거든요? 근데 어떻게하나요? 팀을짜서(?)갓이다니나요? 아님 그냥 밥먹을때도 뭘하든 개인(?)으로다니나요 ㅠㅠ 제친구도 에버랜드만 신청했다길래 좀 그래서요... 저는 그 2개를 신청했는데( 에버랜드하고 무슨 체험 ).. 근데 에버랜드말고 무슨그 체험(?)할때 도시락먹고할때 팀(?)짜서 갔이먹나요?아님 개인으로 혼자먹나요 아님 그냥 먹고싶은 사람이랑 먹나요? ㅠㅠㅠ
504,진주교대 엠티 언제에요?,/qna/detail.nhn?d1id=9&dirId=90111&docId=298504728,진주교대 엠티 언제에요?
505,볼리비아 우유니 소금사막의 인문 관광자원?,/qna/detail.nhn?d1id=9&dirId=9020203&docId=298504591,"볼리비아 소금 사막의 대표적 인문 관광자원에 대해서 조사하려고 하는데 네이버에 잘 나와있지 않은 것 같아서요, 우유니 소금사막에서 볼 수 있는 인문 관광자원에 어떤 것이 있는지좀 알려주세요 ㅠ"
506,중학교에서 현장학습을 인사동으로 가는데 거의 자유시간이래용 인사동에 대해 아는게 하나도 없어서 질문합니당 (,/qna/detail.nhn?d1id=9&dirId=90111&docId=298504492,중학교에서 현장학습을 인사동으로 가는데 거의 자유시간이래용 인사동에 대해 아는게 하나도 없어서 질문합니당 (내공30)1. 인사동에서 한복 대여하려고 하는데 가격 좀 싼곳 알려주세용2. 간단하게 밥 먹을데 있나용 ?3. 이쁘고 싼 옷 파는곳 있나용 ?4. 귀찌 파는 곳 있나용 ?5. 뭐하고 노는게 좋을까요..
507,경주월드가는데키는135고요 어디부터가야효율적일까요? 내공30걸께요,/qna/detail.nhn?d1id=9&dirId=90103&docId=298504310,경주월드가는데키는135고요어디부터가야효율적일까요?내공30걸께요
508,시즈오카 미호노마츠바라에서 도쿄 신주쿠or요코하마 가는법좀 알려주세요!,/qna/detail.nhn?d1id=9&dirId=9020101&docId=298504266,시즈오카 미호노마츠바라에서 도쿄 신주쿠or요코하마 가는법좀 알려주세요!신칸센은 제외하고요. (금액문제)
509,남양주시 화도읍 이안아파트 주변 가장 가까운 유도도장이 어디있나요? 잘 가르쳐 주는곳으루...,/qna/detail.nhn?d1id=9&dirId=90109&docId=298504239,남양주시 화도읍 이안아파트 주변 가장 가까운 유도도장이 어디있나요? 잘 가르쳐 주는곳으루...
510,11월10일 예비신부 입니당~~~ 신혼여행 고민중입니다 코사무이 랑 발리 중에 어떤곳이 나을까요?ㅜ,/qna/detail.nhn?d1id=9&dirId=90201&docId=298504233,11월10일 예비신부 입니당~~~신혼여행 고민중입니다코사무이 랑 발리 중에 어떤곳이 나을까요?ㅜ
511,일본여행에서 돌아올때 목검은 위탁수하물로 보내지나요? 대한항공입니다.,/qna/detail.nhn?d1id=9&dirId=90207&docId=298504087,일본여행에서 돌아올때 목검은 위탁수하물로 보내지나요? 대한항공입니다.이게 길어서 캐리어에 안들어가지네요.물론 날은없고 나무소재인거같네여
512,다음주 서울 금욜쯤에 벚꽃 질까요?,/qna/detail.nhn?d1id=9&dirId=90111&docId=298504077,다음주 서울 금욜쯤에 벚꽃 질까요?
513,중국 비자 질문,/qna/detail.nhn?d1id=9&dirId=9020102&docId=298504006,"4월 말에 중국에 갑니다.저 포함 3명이 가는데요,중국을 한 번도 가본적이 없어 비자를 어떻게 해야할지 잘 모르겠습니다.3명이서 일주일내외로 갈 계획인데,이 때 어떤 비자를 어디서 발급받아야하는지 알려주세요"
514,여름 훗카이도 7박8일 루트 추천이요!!,/qna/detail.nhn?d1id=9&dirId=90201&docId=298503722,"6/26 ~ 7/3 자유여행으로 가는데 훗카이도 여행 루트랑숙소는 한 곳에 머무는 게 좋나요 아니면 나뉘어서 머무는게 좋나요?그리고 랜트카는 안할꺼라서거리가 좀 되는 곳은 JR 패스권 사용하려고 하구요숙소랑 거리가 가까우면 자전거로 여행하려고 합니다.숙소랑 여행 일정, 자자한 팁들 알려주세요!!"
515,헝가리철도청에서 기차를 예약하는데 카드이름 오류로 결재되지 않았네ᆢ 마스터카드인데 어떻게 입력해야하나요,/qna/detail.nhn?d1id=9&dirId=9020303&docId=298503541,헝가리철도청에서 부다페스트에서 빈으로 가는기차를 예약하는데ᆢ카드이름 오류로 결재되지 않았네ᆢ마스터카드인데 어떻게 입력해야하나요제가 사용하는 마스터카드는 KB국민카드입니다
516,제주 3박 4일 일정 부탁드립니다... 4월 14일 부터 3박 4일 예정이고 첫날 도착은 14일 저녁 7시,/qna/detail.nhn?d1id=9&dirId=90112&docId=298503525,제주 3박 4일 일정 부탁드립니다...4월 14일 부터 3박 4일 예정이고 첫날 도착은 14일 저녁 7시 구요.. 마지막날 출발은 13시 비행기입니다.. 숙소는 켄싱턴리조트 서귀포점이고... 저랑 와이프 9살 딸. 5살 아들 이렇게 4명입니다.. 일정 및 맛집 추천부탁드려요..
517,싱가포르 항공편 질문,/qna/detail.nhn?d1id=9&dirId=90201&docId=298503223,싱가포르 여행가면서 태국을 스탑오버로 여행을 하고 싶습니다.싱가포르 가는 비행기중에 태국 경유하면서 스탑오버 가능한 항공사나 항공편 소개좀 해주시면 감사하겠습니다. 12월 여행 예정입니다
518,아시아나항공기 3 X 3 배열 항공기인데...사전좌석 예약을 하려고요...2가지가 위치가 있는데 어디가 좋을,/qna/detail.nhn?d1id=9&dirId=90113&docId=298503115,아시아나항공기 3 X 3 배열 항공기인데...사전좌석 예약을 하려고요...2가지가 위치가 있는데 어디가 좋을가요?아!!제주도 1시간인데 어디 앉으나 마찬가지지만 나중 해외여행 장거리 갈때 어디가 좋은 자리일지 궁금해서 질문을 던짐니다.그림으로 표시했어요....2자리만 있는거는 앞부분이고요..좌우가 공간이 트여서 좋을것 같고...앞에가 트인 좌석은 3 배열이지만 앞공간이 탁트이고요2개좌석을 비교한다면 어디가 더 좋은 자리인가요?
519,중국의성이나 다리와 관련된 전설 몇가지만 알려주세요!!,/qna/detail.nhn?d1id=9&dirId=9020102&docId=298503068,중국의성이나 다리와 관련된 전설 몇가지만 알려주세요!!
520,제가 급히 해외로 갔다와야할일이 생겨서 그러는데요 미리 항공권사지않고 공항가서 바로 살수있나요?아직 미필인데,/qna/detail.nhn?d1id=9&dirId=90113&docId=298503015,제가 급히 해외로 갔다와야할일이 생겨서 그러는데요 미리 항공권사지않고 공항가서 바로 살수있나요?아직 미필인데 항공권 예약할수잇나요?내공 100점 드릴게요ㅠ
521,리튬밧데리 항공수화물,/qna/detail.nhn?d1id=9&dirId=90207&docId=298502768,21.6V-2.6A   56.2Wh의  리튬이온밧데리 2개가 있는 충전전동공구를 항공수화물로 가져올수 있나요?
522,제주도갈때 비행기 이용시,/qna/detail.nhn?d1id=9&dirId=90207&docId=298502756,제주도 갈때 출국심사 같은 것도 하고지문등록도 하나여??
523,에어아시아 환불 질문,/qna/detail.nhn?d1id=9&dirId=90206&docId=298502683,"고객님께,당사에 {1} 일자로 접수하신 접수번호02554957건에 대한 답변을 드릴 수 있도록 3일 이내에 회신하여 주십시오.에어아시아를 이용해 주셔서 감사합니다.에어아시아이렇게 메일이 왔는데. 회신불가 메일인데 어떻게 회신을 해요??"
524,2018진해 군항제 가려고하는데 9일~10일 까지 보러갈려고하는데 그때까지 벚꽃이 있을까요?? 답변 부탁드립,/qna/detail.nhn?d1id=9&dirId=90111&docId=298502126,2018진해 군항제 가려고하는데 9일~10일 까지 보러갈려고하는데 그때까지 벚꽃이 있을까요?? 답변 부탁드립니다ㅠ
525,도쿄여행 nex 열차 질문,/qna/detail.nhn?d1id=9&dirId=9020101&docId=298502096,도쿄여행 nex 열차 질문드립니다.제가 이번에 도쿄를 가게 되었는데요NEX열차를 왕복으로 끊고첫날에는 신주쿠 -> 나리타공항가는거 까지는 알겠는데혹시 그냥 왕복으로 끊은 표로요코하마에서 나리타공항까지 갈수있나요??!처음에 왕복으로 표를 끊으면 장소 상관없이그 장소에 맞게 시간만 맞춰서 탈수 있는지궁금합니다.
526,범죄자 얼굴 언떤가요?,/qna/detail.nhn?d1id=9&dirId=9020104&docId=298502022,범죄자 얼굴 언떤가요?
527,서울 당일치기 여행코스 부탁드려요 이번주 목요일 서울 가는데 갈만한곳 부탁드려요. 1. 남산타워는 꼭 넣어주,/qna/detail.nhn?d1id=9&dirId=90111&docId=298502001,서울 당일치기 여행코스 부탁드려요이번주 목요일 서울 가는데 갈만한곳 부탁드려요.1. 남산타워는 꼭 넣어주세요.2. 벚꽃도 구경할 수 있는곳이면 더 좋아요3. 이동거리는 최대한 짧게 부탁드립니다
528,이접시어디건지아세요?,/qna/detail.nhn?d1id=9&dirId=9020104&docId=298501706,이접시어디건지아세요?
529,일본 삿포로 여행 질문!,/qna/detail.nhn?d1id=9&dirId=9020101&docId=298501701,안녕하세요 이번 4월 9일에 삿포로 여행을 가게 됬는데요삿포로에 있는 오타루도 가볼꺼고 할껀데꼭 가봐야할 장소나 먹어야 할 음식 있을까요?이번이 일본 자유여행 처음이라...조언 꼭 부탁드립니다!!
530,유럽여행경비 얼마나 들까요?,/qna/detail.nhn?d1id=9&dirId=90203&docId=298501656,안녕하세요!유럽여행 한 달 정도 가려고 하는데 얼마나 들까요?!한 300만원으로도 넉넉히 다닐 수 있을까요??
531,베트남에서 스마트폰 현지유심 구매후 현지전화 거는방법,/qna/detail.nhn?d1id=9&dirId=9020107&docId=298501593,안녕하세요베트남 출장중 현지에서 폰 유심구매후 사용중인데현재 거주지는 하이퐁이고 하노이의 아시아나항공 지점에 전화 걸려면어떻게 걸어야 하나요?연락처는 84-24-3722-8000 입니다.
532,경주 1박 2일로 아이와 여행하려합니다. 서울에서 신경주역까지 기차타고 차를 빌리려하는데 쏘카와 렌트카 둘,/qna/detail.nhn?d1id=9&dirId=901&docId=298501477,경주 1박 2일로 아이와 여행하려합니다.서울에서 신경주역까지 기차타고 차를 빌리려하는데 쏘카와 렌트카 둘 중 어떤것이 나을까요? 쏘카는 이용 안해봐서 잘 몰라서요.. 경차로 다닐 예정이고 첫날 점심 때 부터 한 5~6시간 외부에 있을 예정이고 (자세한 일정을 안짜 이중 운전하는 시간을 잘 예측은 못하겠지만 한 두세 곳 들러 보고 숙소인 스위트 호텔로 갈 겁니다) 그리고 둘쨋날은 오전 10시 이후부터 한 오후 3~4시까지 외부에 있다가 서울행 열차를 탈 예정인데 따지고 보면 운전하는 시간은 별로 없을 것 같기도 하네요. 쏘카는 차관리가 잘 안되어 있다고도 본 것 같은데.. 괜찮을까요? 렌트카는 어떨까요?
533,안녕하세요 이번주 일욜날 에버랜드를 갑니다 제가 듣기로는 프리미엄 매직패스가 있다고 들었어요 저희가 총4명,/qna/detail.nhn?d1id=9&dirId=90103&docId=298501425,안녕하세요이번주 일욜날 롯데월드를 갑니다제가 듣기로는 프리미엄 매직패스가 있다고 들었어요저희가 총4명 가는데 2명은 다른 곳에서 줄을 서있기로 하고 나머지 2명은 프리미엄 매직패스를 살려구 하는데4명 전체가 같이 사러 가야 4개를 살 수 있나요?되도록이면 프리미엄 매직패스 사용 경력이 있으신 분과 롯데월드 관계자 분이 답변해주셨으면 감사하겠습니당
534,주근깨뺀지 2일지낫는데 딱지가아직도안생겻네요 이상잇는건가요?,/qna/detail.nhn?d1id=9&dirId=90108&docId=298501262,주근깨뺀지 2일지낫는데 딱지가아직도안생겻네요 이상잇는건가요?
535,위쳇페이 등록 하는데 자꾸 이말 뜨면서 등록 안됩..,/qna/detail.nhn?d1id=9&dirId=9020102&docId=298501249,중국에서 위쳇으로 카드 등록할려고 하는데등록이 안됩니다.카드는 중국 우리은행 카드로 만든 건데 그렇네요. 도와주세요 옆에 친구는 바로 등록 됐는데 저는 안되네요. 아이폰이라서 그런건가요???
536,상무지구 힐링낚시카페 영업하나요,/qna/detail.nhn?d1id=9&dirId=90111&docId=298500857,상무지구 힐링낚시카페 영업하나요
537,타이난 여행경비 질문드려요. 타이난을 5박6일 일정으로 가는데... 여행경비가 얼마쯤 들어가나요. 숙박비와,/qna/detail.nhn?d1id=9&dirId=9020108&docId=298500746,타이난 여행경비 질문드려요.타이난을 5박6일 일정으로 가는데...여행경비가 얼마쯤 들어가나요.숙박비와 항공료 빼고요. 이미 예약을 한상태라가서 쓸 비용이 어느정도인지 모르겠네요.9천대만달러에 150달러 정도 있는데..충분하나요?
538,부산국가지질공원에 대하여 소개하라고 하는데 그곳에 있는 암석 그리고 생상과정 암삭정류 이런거 해서 해주세요,/qna/detail.nhn?d1id=9&dirId=90108&docId=298500571,부산국가지질공원에 대하여 소개하라고 하는데그곳에 있는 암석 그리고 생상과정 암삭정류 이런거 해서해주세요 제발유제발유
539,밤에도 벚꽃 예쁘게 볼 수 있는곳,/qna/detail.nhn?d1id=9&dirId=901&docId=298500565,"서울, 경기에 여의도처럼 불켜줘서 밤에도 벚꽃 볼 수 있는곳 있나요?여의도 빼구요"
540,이 동상 한국에있는건가요? 위치나 이름을 알고싶은데 아시나요....ㅠㅠ 내공겁니다,/qna/detail.nhn?d1id=9&dirId=90105&docId=298500260,이 동상 한국에있는건가요?위치나 이름을 알고싶은데 아시나요....ㅠㅠ 내공겁니다
541,비행기 기내에 액체 100ml 이하만 가지고 탈 수 있나요? 제주도로 가는데 국내는 상관 없나요?,/qna/detail.nhn?d1id=9&dirId=90113&docId=298500142,비행기 기내에 액체 100ml 이하만 가지고 탈 수 있나요? 제주도로 가는데 국내는 상관 없나요?
542,보홀 새벽도착시 일정,/qna/detail.nhn?d1id=9&dirId=9020104&docId=298499951,안녕하세요4월30일 새벽2시45분비행기를 타고 바로 보홀로 가는데 도착시간이 새벽6시입니다.그날 헤난리조트 첵크인이 오후2시인데 보홀 도착해서 오후2시까지 시간이 붕떠서요...그 사이에 할 것이나 아니면 저렴하게 잠잘곳이 없나요?
543,일본인 친구하고 사진찍는법좀 알려주십시요..^^ 일본후쿠오카여행가는데 행사가있으면은 사진셀카 찍으려고요..^,/qna/detail.nhn?d1id=9&dirId=9020101&docId=298499617,일본인 친구하고 사진찍는법좀 알려주십시요..^^ 일본후쿠오카여행가는데 행사가있으면은 사진셀카 찍으려고요..^^ 일본어로 어떻게해야할까요?
544,인천 카타르 경유 스페인 도착 면세 액체,/qna/detail.nhn?d1id=9&dirId=90207&docId=298499456,안녕하세요인천에서 카타르공항을 경유해 스페인에 도착하는데요.인천 인도장에서 화장품 30ml 액체를 포함한 제품을 가지고가는데요.카타르공항에서 액체 반입 가능할까요?1. 인천에서 상품을 받은 후 스페인까지 안 뺏기고 가지고 갈수있을까요?아니면2. 인천에서 상품을 받은 후 카타르공항에서 제가 준비한 20cm*20cm 투명한 지퍼백에 담아서가져가야하나요?
545,스노쿨링못하는데 호핑투어하면 돈아까울까요?,/qna/detail.nhn?d1id=9&dirId=9020104&docId=298499450,수영을 못하고 물을 무서워해서 호핑투어를안하려고했는데 다른업체보다 저렴한곳을 찾아서 스노쿨링 2곳 + 크리스탈코브+간식+보트대여(총 4~5시간)가 인당 22000원에 예약을할까하는데 해볼만할까요?저말고 다른일행이라도하는거 구경하고 만약 용기가생긴다면 보트라도 살살타보려는데 가격대비 갈만한투어일까요?크리스탈코브는 개인적으로가려면 배를빌려야한다고해서고민이네요
546,스노쿨링못하는데 호핑투어하면 돈아까울까요?,/qna/detail.nhn?d1id=9&dirId=9020104&docId=298499364,수영을 못하고 물을 무서워해서 호핑투어를안하려고했는데 다른업체보다 저렴한곳을 찾아서 스노쿨링 2곳 + 크리스탈코브+간식+보트대여(총 4~5시간)가 인당 22000원에 예약을할까하는데 해볼만할까요?저말고 다른일행이라도하는거 구경하고 만약 용기가생긴다면 보트라도 살살타보려는데 가격대비 갈만한투어일까요?크리스탈코브는 개인적으로가려면 배를빌려야한다고해서고민이네요
547,하노이 4박 5일 친구랑 여행가는데 꼭 가야한다! 꼭 먹어야한다! 추천좀해주세요,/qna/detail.nhn?d1id=9&dirId=9020107&docId=298499300,친구랑 첫 여행이라 기대가 되고 뭐 봐야할지 . 꼭 먹어야 하는 거 꼭 봐야 하는거 추천좀 해주세요~
